favorite_count,source,text,in_reply_to_screen_name,is_retweet,created_at,retweet_count,id_str
0,Twitter Web Client,Suicide Attack Kills 36 in Afghanistan http://tinyurl.com/353ttm,,False,Mon Feb 18 15:09:00 +0000 2008,0,726596962
0,Twitter Web Client,The Medium: Curtains for the Old TV? http://tinyurl.com/ynmzgj,,False,Tue Jan 08 22:04:00 +0000 2008,0,577230192
0,Twitter Web Client,Makers Say Cholesterol Drug Has No Health Benefit http://tinyurl.com/yqy89m,,False,Mon Jan 14 16:09:21 +0000 2008,0,598058052
0,Twitter Web Client,Envoy Calls Kenyan Violence Ethnic Cleansing http://tinyurl.com/yp25dt,,False,Wed Jan 30 09:06:19 +0000 2008,0,658782422
0,Twitter Web Client,"Abroad: No Laughs, No Thrills, and Villains All Too Real http://tinyurl.com/37opue",,False,Wed Feb 27 01:09:33 +0000 2008,0,763208532
0,Twitter Web Client,Old Clinton Ties and Sway of Voters Tug at Delegates http://tinyurl.com/2w5mn7,,False,Sun Feb 17 01:09:08 +0000 2008,0,721184222
0,Twitter Web Client,A Funeral and a Rally in Lebanon http://tinyurl.com/2jqvtg,,False,Thu Feb 14 14:10:13 +0000 2008,0,711595762
1,Twitter Web Client,Justices Hear Lethal Injection Case http://tinyurl.com/2an8ow,,False,Mon Jan 07 20:03:44 +0000 2008,0,572929132
0,Twitter Web Client,Justices Uphold New York’s Judge System http://tinyurl.com/28v6jh,,False,Thu Jan 17 13:07:43 +0000 2008,0,609307092
0,Twitter Web Client,C.I.A. Confirms Rendition Report http://tinyurl.com/2wt6vn,,False,Thu Feb 21 22:10:50 +0000 2008,0,741138762
0,Twitter Web Client,"Britney Spears Taken in Ambulance, Police Say http://tinyurl.com/2ojk73",,False,Thu Jan 31 12:09:46 +0000 2008,0,662459482
0,Twitter Web Client,Weinstein Says He Reached Deal With Writers http://tinyurl.com/29uqze,,False,Thu Jan 10 19:08:28 +0000 2008,0,584668892
0,Twitter Web Client,The Caucus: Congress Takes Up Surveillance Bill http://tinyurl.com/34knlk,,False,Mon Feb 11 14:10:55 +0000 2008,0,699636762
0,Twitter Web Client,"A Landscape in Winter, Dying Heroically http://tinyurl.com/2ng4ka",,False,Thu Jan 31 12:09:15 +0000 2008,0,662458012
0,Twitter Web Client,Oo-rah! A Squad of Actors Takes Lanford Wilson to the Marines http://tinyurl.com/2xesxn,,False,Thu Jan 10 02:03:55 +0000 2008,0,581875472
0,Twitter Web Client,Sarkozy Expected to Marry Singer http://tinyurl.com/2hsz2x,,False,Tue Jan 08 15:02:34 +0000 2008,0,575910332
0,Twitter Web Client,Kerry to Plans Endorse Obama for President http://tinyurl.com/2gtxtn,,False,Thu Jan 10 16:03:49 +0000 2008,0,584055132
0,Twitter Web Client,"One on One, Democrats Set Aim at G.O.P. http://tinyurl.com/2nze8a",,False,Fri Feb 01 04:09:20 +0000 2008,0,664946952
0,Twitter Web Client,Paper Cuts: Bill Hader’s Book Picks http://tinyurl.com/32gquu,,False,Thu Jan 31 20:07:45 +0000 2008,0,663558192
0,Twitter Web Client,Pakistani Justice Breaks Silence http://tinyurl.com/2eg56w,,False,Wed Jan 30 21:06:16 +0000 2008,0,660764722
0,Twitter Web Client,"As Electronics Show Grows, Some Scale Back http://tinyurl.com/27sjay",,False,Mon Jan 07 13:02:47 +0000 2008,0,571601782
0,Twitter Web Client,Selig Given 3 - Year Contract Extension http://tinyurl.com/yoc7bs,,False,Fri Jan 18 01:07:46 +0000 2008,0,611594502
0,Twitter Web Client,Louisiana Governor Pierces Business as Usual http://tinyurl.com/3a9c5w,,False,Thu Feb 28 05:10:24 +0000 2008,0,764308918
0,Twitter Web Client,Roger Clemens Hires Top Washington Lawyer http://tinyurl.com/2ye7sv,,False,Fri Jan 18 02:09:30 +0000 2008,0,611765242
0,Twitter Web Client,DealBook: Private Equity Conference in Munich http://tinyurl.com/2mo38c,,False,Tue Feb 26 13:09:32 +0000 2008,0,760318522
0,Twitter Web Client,Floyd Norris: What Should a Candidate Read? http://tinyurl.com/35jvxh,,False,Thu Jan 31 20:07:31 +0000 2008,0,663557382
0,Twitter Web Client,Kenyan Leader and Opponent to Meet http://tinyurl.com/ysm7qf,,False,Mon Jan 07 20:03:47 +0000 2008,0,572929282
0,Twitter Web Client,Chinese and U.S. Demand Drives Commodities Surge http://tinyurl.com/yt59bc,,False,Tue Jan 15 10:08:59 +0000 2008,0,601012952
0,Twitter Web Client,Fed Chief Sees Economic Rebound Later in Year http://tinyurl.com/2o4uuy,,False,Thu Feb 14 16:10:19 +0000 2008,0,712086072
0,Twitter Web Client,Now Screening | Band of Outsiders http://tinyurl.com/35ykzs,,False,Fri Feb 01 07:06:20 +0000 2008,0,665176902
0,Twitter Web Client,The Moment: Fragrance Critic Reviews Mandorlo http://tinyurl.com/2ekwgf,,False,Thu Jan 10 20:09:47 +0000 2008,0,584851322
0,Twitter Web Client,Fischer vs. the World: A Chess Giant’s Endgame http://tinyurl.com/ypwasj,,False,Sat Jan 19 07:07:32 +0000 2008,0,616404492
0,Twitter Web Client,"China, in New Role, Presses Sudan on Darfur http://tinyurl.com/2qypuj",,False,Sat Feb 23 05:10:05 +0000 2008,0,746785452
0,Twitter Web Client,Police Track Thefts of Sidekick Phones http://tinyurl.com/2b8u3d,,False,Tue Jan 15 21:08:35 +0000 2008,0,602937092
0,Twitter Web Client,The Passion of Steve Jobs http://tinyurl.com/2dfcaf,,False,Wed Jan 16 05:07:54 +0000 2008,0,604142842
0,Twitter Web Client,Texas Women Size Up the Democrats http://tinyurl.com/357p8n,,False,Sun Feb 24 16:10:16 +0000 2008,0,751780212
0,Twitter Web Client,Mob Violence Is Tearing Kenya Apart http://tinyurl.com/ysewhn,,False,Sat Jan 26 17:06:44 +0000 2008,0,644233092
0,Twitter Web Client,Judge Dismisses Nevada Caucus Challenge http://tinyurl.com/22hxzc,,False,Thu Jan 17 20:08:52 +0000 2008,0,610720602
0,Twitter Web Client,An Article Brings Sharp Responses From Russians http://tinyurl.com/3yw8n4,,False,Mon Feb 25 04:11:41 +0000 2008,0,754051652
0,Twitter Web Client,Randolph Confident Mets Can Kick ‘Funk’ http://tinyurl.com/2jz25d,,False,Fri Feb 15 23:09:23 +0000 2008,0,717827272
0,Twitter Web Client,The Right to Jump Off a Building http://tinyurl.com/23qhzy,,False,Tue Jan 08 23:02:36 +0000 2008,0,577401692
0,Twitter Web Client,City Room: The Vanguard of Digital Design http://tinyurl.com/3c6zp7,,False,Fri Feb 22 21:10:07 +0000 2008,0,745429262
0,Twitter Web Client,It Went By in a Blur: PATH’s 100th http://tinyurl.com/2ooo5o,,False,Tue Feb 26 11:09:29 +0000 2008,0,759947592
1,Twitter Web Client,U.S. Sees Stalling by North Korea on Nuclear Pact http://tinyurl.com/269vv4,,False,Sat Jan 19 05:09:37 +0000 2008,0,616159262
0,Twitter Web Client,Second Kenyan Opposition Legislator Killed http://tinyurl.com/2pjqel,,False,Thu Jan 31 14:07:35 +0000 2008,0,662772352
0,Twitter Web Client,Name Your Favorite New York Film http://tinyurl.com/342tv2,,False,Fri Feb 22 16:10:52 +0000 2008,0,744372902
0,Twitter Web Client,Oil in North Dakota Brings Job Boom and Burdens http://tinyurl.com/yp7nlg,,False,Tue Jan 01 04:05:34 +0000 2008,0,551331372
0,Twitter Web Client,North Korea Says It Has Said Enough http://tinyurl.com/ywevg5,,False,Fri Jan 04 18:04:06 +0000 2008,0,562710272
1,Twitter Web Client,‘Miraculous’ Recovery for Man Who Fell From Sky http://tinyurl.com/2bsu7f,,False,Thu Jan 03 23:03:08 +0000 2008,0,559894332
0,Twitter Web Client,Head of World Bank Fraud Unit Resigns http://tinyurl.com/26kbqz,,False,Thu Jan 17 03:07:49 +0000 2008,0,607819012
0,Twitter Web Client,Clinton and Obama Spar Over Remark About Dr. King http://tinyurl.com/29lsrc,,False,Sun Jan 13 22:09:06 +0000 2008,0,595350742
0,Twitter Web Client,The Moment: Help for High-Heel Pain http://tinyurl.com/39zrhh,,False,Thu Feb 14 17:09:36 +0000 2008,0,712341482
0,Twitter Web Client,Thousands Said to Flee Chad’s Capital http://tinyurl.com/3yswnk,,False,Mon Feb 04 19:05:42 +0000 2008,0,677254882
1,Twitter Web Client,Tax Rebate or Payment? A Policy Debate Begins http://tinyurl.com/2a9rdm,,False,Sun Jan 20 06:08:43 +0000 2008,0,619412652
0,Twitter Web Client,Vote Begins for Castro’s Successor http://tinyurl.com/2tew9h,,False,Sun Feb 24 17:09:36 +0000 2008,0,751939732
0,Twitter Web Client,Young Evangelicals Embrace Huckabee as Old Guard Balks http://tinyurl.com/2y7kw5,,False,Sat Jan 12 19:08:18 +0000 2008,0,591898212
1,Twitter Web Client,War Concussions and Stress Linked http://tinyurl.com/yr2qb8,,False,Wed Jan 30 14:07:47 +0000 2008,0,659639362
0,Twitter Web Client,Marine Freed in Japanese Rape Case http://tinyurl.com/33ttu9,,False,Fri Feb 29 19:10:13 +0000 2008,0,764974445
0,Twitter Web Client,"A Caribbean Corner of Brooklyn, Fighting to Survive http://tinyurl.com/2tkmnr",,False,Mon Feb 11 12:09:52 +0000 2008,0,699287922
0,Twitter Web Client,Iranian Official Singles Out ‘Persepolis’ http://tinyurl.com/345osr,,False,Wed Feb 13 21:10:09 +0000 2008,0,708949882
0,Twitter Web Client,U.S. Presses Kenya Parties on Talks http://tinyurl.com/26hn8b,,False,Sat Jan 12 19:08:20 +0000 2008,0,591898312
1,Twitter Web Client,F.B.I. Opens Subprime Inquiry http://tinyurl.com/2bvbso,,False,Wed Jan 30 01:06:20 +0000 2008,0,657444342
0,Twitter Web Client,Police Kill Maryland Inmate After He Escapes http://tinyurl.com/2hg4xm,,False,Thu Jan 03 00:04:30 +0000 2008,0,556652302
0,Twitter Web Client,"No. 2 Tennessee 66, No. 1 Memphis 62: No. 1 No More: Memphis Falls to Tennessee http://tinyurl.com/3xm9v6",,False,Sun Feb 24 06:10:35 +0000 2008,0,750507632
0,Twitter Web Client,North Korea Calls for End to ‘Hostile’ U.S. Policies http://tinyurl.com/yva9y9,,False,Tue Jan 01 15:03:22 +0000 2008,0,552480852
0,Twitter Web Client,The Top Steroids Investigator Is a Silent Presence http://tinyurl.com/2szra6,,False,Thu Feb 14 16:10:14 +0000 2008,0,712085662
0,Twitter Web Client,Kurds’ Power Wanes as Arab Anger Rises http://tinyurl.com/3cat3z,,False,Fri Feb 01 00:07:47 +0000 2008,0,664261622
0,Twitter Web Client,News Analysis: Hints of Change Are Met in Cuba by Cautious Eyes http://tinyurl.com/3dkxle,,False,Wed Feb 27 03:09:36 +0000 2008,0,763615553
0,Twitter Web Client,The Dreaded Weigh-In http://tinyurl.com/39l97m,,False,Fri Feb 29 17:11:23 +0000 2008,0,764939129
0,Twitter Web Client,Job Losses Raise Recession Fears http://tinyurl.com/3d6dpf,,False,Sat Feb 02 04:08:37 +0000 2008,0,668752972
0,Twitter Web Client,"From Texas to Iraq, and Center of Blackwater Case http://tinyurl.com/2f352o",,False,Sat Jan 19 18:08:37 +0000 2008,0,617868752
0,Twitter Web Client,City Room: Congestion Pricing and Alternatives http://tinyurl.com/28j5zf,,False,Thu Jan 10 15:02:28 +0000 2008,0,583834462
0,Twitter Web Client,Reviving a Coney Island Ride http://tinyurl.com/3awavh,,False,Fri Feb 29 19:10:15 +0000 2008,0,764974458
0,Twitter Web Client,One Dead in Attack on Transit Worker http://tinyurl.com/yqaym7,,False,Fri Jan 11 20:09:40 +0000 2008,0,588821662
1,Twitter Web Client,Huckabee Walks Fine Line Amid Pulpit and Podium http://tinyurl.com/28vgj7,,False,Sat Jan 19 05:09:22 +0000 2008,0,616158842
0,Twitter Web Client,Offering New Roles to Wounded Marines http://tinyurl.com/2mfrer,,False,Sun Feb 03 13:05:51 +0000 2008,0,672730352
0,Twitter Web Client,Gordon B. Hinckley Is Dead at 97; Led Mormon Church in Global Expansion http://tinyurl.com/ypca4v,,False,Mon Jan 28 05:06:42 +0000 2008,0,649393812
0,Twitter Web Client,"In Spinal Device Research, Questions on Conflicts http://tinyurl.com/yuo3qn",,False,Wed Jan 30 02:07:58 +0000 2008,0,657634912
0,Twitter Web Client,Ready or Not: Navy to Shoot Down Rogue Satellite http://tinyurl.com/2panfg,,False,Wed Feb 20 16:11:15 +0000 2008,0,735493582
0,Twitter Web Client,Packers Lead Giants in the Third Quarter http://tinyurl.com/2da45h,,False,Mon Jan 21 02:08:56 +0000 2008,0,622053772
0,Twitter Web Client,Pieces of Texas Turn Primary Into a Puzzle http://tinyurl.com/2klxfd,,False,Tue Feb 26 04:12:29 +0000 2008,0,758846632
0,Twitter Web Client,Job Growth Sputtered in December http://tinyurl.com/28kcvq,,False,Fri Jan 04 16:04:06 +0000 2008,0,562347462
0,Twitter Web Client,EA Offers $2 Billion for Take-Two http://tinyurl.com/37xc89,,False,Sun Feb 24 21:09:40 +0000 2008,0,752615932
0,Twitter Web Client,C.I.A. Says Militant Was Behind Bhutto’s Death http://tinyurl.com/ywfsv8,,False,Fri Jan 18 23:07:42 +0000 2008,0,615341492
0,Twitter Web Client,"3 Killed in Israel Suicide Bombing, Officials Say http://tinyurl.com/36j4kn",,False,Mon Feb 04 10:06:44 +0000 2008,0,675718912
0,Twitter Web Client,Clinton’s Campaign Shows Stress Before Primary http://tinyurl.com/2xuaoy,,False,Tue Jan 08 05:03:24 +0000 2008,0,574374292
0,Twitter Web Client,Global Warming Paradox? http://tinyurl.com/2pdst6,,False,Fri Feb 29 18:09:00 +0000 2008,0,764953417
1,Twitter Web Client,Play Magazine: Oedipus Bronx http://tinyurl.com/2rqhgf,,False,Thu Feb 28 19:10:38 +0000 2008,0,764587240
0,Twitter Web Client,Justices Question Validity of Voter I.D. Case http://tinyurl.com/yo5fpt,,False,Thu Jan 10 02:04:00 +0000 2008,0,581875632
0,Twitter Web Client,"Seeking Unity, Obama Feels Pull of Racial Divide http://tinyurl.com/3aof9u",,False,Tue Feb 12 06:10:41 +0000 2008,0,702492162
0,Twitter Web Client,A Spiral of Losses by a ‘Plain Vanilla’ Trader http://tinyurl.com/2y9f5j,,False,Fri Jan 25 06:09:14 +0000 2008,0,639200392
0,Twitter Web Client,British-Russian Tension Escalates http://tinyurl.com/ytqn3h,,False,Mon Jan 14 19:08:01 +0000 2008,0,598662762
0,Twitter Web Client,U.S. Said to Seek Execution for 6 in Sept. 11 Case http://tinyurl.com/2wsu2d,,False,Mon Feb 11 03:09:22 +0000 2008,0,698073362
0,Twitter Web Client,Justices Indicate They May Uphold Voter ID Rules http://tinyurl.com/2zry7c,,False,Thu Jan 10 04:04:51 +0000 2008,0,582177752
0,Twitter Web Client,"Pessimistic Bulls, or Optimistic Bears? http://tinyurl.com/28o9jl",,False,Thu Jan 24 06:10:06 +0000 2008,0,635101802
0,Twitter Web Client,Exxon Mobil Profit Sets Record Again http://tinyurl.com/3bpam4,,False,Fri Feb 01 15:06:11 +0000 2008,0,666538612
0,Twitter Web Client,Dot Earth: Renaming Global Warming http://tinyurl.com/35m67g,,False,Mon Feb 18 12:09:46 +0000 2008,0,726003292
0,Twitter Web Client,Gates Says Anger Over Iraq Hurts Afghan Effort http://tinyurl.com/34pnh3,,False,Fri Feb 08 19:10:12 +0000 2008,0,691504242
0,Twitter Web Client,Losing Our Heads in Paris http://tinyurl.com/22pgrb,,False,Mon Jan 21 14:08:17 +0000 2008,0,623913012
0,Twitter Web Client,The Tracks of Clinton’s Tears http://tinyurl.com/26f264,,False,Tue Jan 08 23:02:37 +0000 2008,0,577401762
0,Twitter Web Client,"The Lede: Mia Farrow, Spielberg and Darfur http://tinyurl.com/37k6nw",,False,Wed Feb 13 17:09:48 +0000 2008,0,708231372
0,Twitter Web Client,Visa Plans $17 Billion Public Offering http://tinyurl.com/2vtfk6,,False,Mon Feb 25 21:09:38 +0000 2008,0,757345832
0,Twitter Web Client,Israel Increases Its Gaza Forces http://tinyurl.com/2qxwnk,,False,Sun Feb 24 21:09:43 +0000 2008,0,752616082
0,Twitter Web Client,City Room: The Mayor and the Philip Roth Quote http://tinyurl.com/2x5ygr,,False,Fri Jan 18 21:07:38 +0000 2008,0,615014802
0,Twitter Web Client,Escape From Camelot http://tinyurl.com/ytrvet,,False,Tue Jan 08 19:02:43 +0000 2008,0,576713222
0,Twitter Web Client,Clemens Campaigns as His Wife Is Named http://tinyurl.com/2t2yjm,,False,Sat Feb 09 05:11:07 +0000 2008,0,692668182
0,Twitter Web Client,Monitor Group Cancels Mission to Russia Election http://tinyurl.com/2o34wa,,False,Thu Feb 07 15:10:14 +0000 2008,0,687275342
1,Twitter Web Client,The Endless Fear of Terrorism http://tinyurl.com/yrog5a,,False,Wed Jan 16 19:07:52 +0000 2008,0,606453352
0,Twitter Web Client,Senate Panel Unveils Its Own Stimulus Plan http://tinyurl.com/ywtt6z,,False,Tue Jan 29 02:09:10 +0000 2008,0,653160882
0,Twitter Web Client,"From Palestinians, Harsh View of Bush http://tinyurl.com/26w9nr",,False,Wed Jan 09 23:02:27 +0000 2008,0,581386772
0,Twitter Web Client,Attacks Imperil Militiamen in Iraq Allied With U.S. http://tinyurl.com/25aftm,,False,Thu Jan 24 05:08:32 +0000 2008,0,634931352
0,Twitter Web Client,Guggenheim’s Provocative Director Steps Down http://tinyurl.com/2rowxz,,False,Thu Feb 28 00:10:21 +0000 2008,0,764217840
0,Twitter Web Client,DealBook: Diller Fires Back at Malone Lawsuit http://tinyurl.com/28psyb,,False,Tue Jan 29 17:06:23 +0000 2008,0,655853392
0,Twitter Web Client,Japan Approves Bill on Afghan War Mission http://tinyurl.com/2zhzdv,,False,Fri Jan 11 13:08:20 +0000 2008,0,587467272
0,Twitter Web Client,‘50 People Who Could Save the Planet’ http://tinyurl.com/27wojf,,False,Mon Jan 07 05:02:51 +0000 2008,0,570476282
0,Twitter Web Client,U.S. Marine in Japan Rape Case Freed http://www.nytimes.com/reuters/world/news-japan-okinawa.html?ex=1362027600&en=28aff32283dab570&ei=5 ...,,False,Fri Feb 29 15:10:11 +0000 2008,0,764905056
0,Twitter Web Client,Fears of Violence as Pakistani Election Nears http://tinyurl.com/3y99t8,,False,Sat Feb 16 18:09:59 +0000 2008,0,720288882
0,Twitter Web Client,Gates Calls Australia Alliance Strong http://tinyurl.com/3xkh9m,,False,Sat Feb 23 16:10:32 +0000 2008,0,748358882
0,Twitter Web Client,The Lede: Less Confidence on U.S.-Iran Incident http://tinyurl.com/26agxy,,False,Thu Jan 10 16:03:51 +0000 2008,0,584055262
0,Twitter Web Client,Officials Say Iraqi Soldier Killed 2 U.S. Soldiers http://tinyurl.com/27kkc6,,False,Sat Jan 05 21:03:28 +0000 2008,0,566296132
0,Twitter Web Client,Voters Showing a Darker Mood Than in 2000 Race http://tinyurl.com/23583u,,False,Thu Jan 24 05:08:27 +0000 2008,0,634931112
0,Twitter Web Client,Mormons Say Farewell to President http://tinyurl.com/2leek4,,False,Sat Feb 02 17:06:02 +0000 2008,0,670428612
0,Twitter Web Client,Britain to Nationalize Northern Rock http://tinyurl.com/3y3776,,False,Sun Feb 17 17:09:03 +0000 2008,0,723148792
0,Twitter Web Client,"Europe Takes Africa’s Fish, and Migrants Follow http://tinyurl.com/2hg4bh",,False,Mon Jan 14 04:10:01 +0000 2008,0,596207752
0,Twitter Web Client,"Political Memo: Soldiering On, but Somber as the Horizon Darkens http://tinyurl.com/3dxcrg",,False,Sat Feb 23 20:10:45 +0000 2008,0,749050472
0,Twitter Web Client,A Rush of Water Leaves a Nevada Town in Anguish http://tinyurl.com/2hnn8q,,False,Mon Jan 07 05:02:44 +0000 2008,0,570476042
0,Twitter Web Client,U.S. Promises Tapes on Iran Skirmish http://tinyurl.com/2y9nyv,,False,Tue Jan 08 22:04:05 +0000 2008,0,577230622
1,Twitter Web Client,Writers Vote to End Strike http://tinyurl.com/36gznp,,False,Wed Feb 13 04:10:47 +0000 2008,0,706062322
0,Twitter Web Client,Jasper Johns Shows His True Color http://tinyurl.com/2tua4w,,False,Fri Feb 08 11:10:00 +0000 2008,0,690119212
0,Twitter Web Client,Intelligence Chief Cites Qaeda Threat to U.S. http://tinyurl.com/2qwovo,,False,Wed Feb 06 04:06:03 +0000 2008,0,682401842
0,Twitter Web Client,"In Stimulus Plan, Democrats See Gain http://tinyurl.com/2prtqu",,False,Sat Feb 09 22:09:24 +0000 2008,0,694549402
0,Twitter Web Client,Iraq Passes Law to Rehire Baathists http://tinyurl.com/23f654,,False,Sat Jan 12 13:08:18 +0000 2008,0,591009612
0,Twitter Web Client,Why Surprises Still Lurk After Enron http://tinyurl.com/2oeb9b,,False,Fri Feb 29 14:09:26 +0000 2008,0,764879683
0,Twitter Web Client,"China and the Philharmonic, in Harmony http://tinyurl.com/3azswc",,False,Sat Feb 23 05:10:01 +0000 2008,0,746785092
0,Twitter Web Client,"An Ex-President, a Mining Deal and a Big Donor http://tinyurl.com/32owzs",,False,Thu Jan 31 12:08:10 +0000 2008,0,662454342
0,Twitter Web Client,"Saying Race Is No Barrier, Obama Still Courts Blacks http://tinyurl.com/2auq9g",,False,Wed Jan 02 06:05:42 +0000 2008,0,554223642
0,Twitter Web Client,Home Resales and Prices Decline http://tinyurl.com/2lbd7h,,False,Mon Feb 25 17:09:36 +0000 2008,0,756491532
0,Twitter Web Client,Lilly Considers $1 Billion Fine to Settle Case http://tinyurl.com/2pszbn,,False,Thu Jan 31 12:07:52 +0000 2008,0,662453392
0,Twitter Web Client,Bush Calls Surveillance Bill an ‘Urgent Priority’ http://tinyurl.com/2jo4yl,,False,Thu Feb 28 17:10:42 +0000 2008,0,764540564
0,Twitter Web Client,A Common Foe in Nevada: Confusion http://tinyurl.com/yta3tb,,False,Sat Jan 19 15:07:27 +0000 2008,0,617377812
0,Twitter Web Client,Gay Muslims Pack a Dance Floor of Their Own http://tinyurl.com/2zjbya,,False,Tue Jan 01 09:03:22 +0000 2008,0,551902382
0,Twitter Web Client,Clinton Escapes to Fight Another Day http://tinyurl.com/26ettj,,False,Wed Jan 09 05:02:30 +0000 2008,0,578415942
0,Twitter Web Client,Suicide Biker Kills 6 in Pakistan http://tinyurl.com/375bgy,,False,Mon Feb 04 20:07:08 +0000 2008,0,677420932
0,Twitter Web Client,Gates Urges Limits on Turkish Raids in Northern Iraq http://tinyurl.com/3xl7w8,,False,Wed Feb 27 21:09:27 +0000 2008,0,764159227
0,Twitter Web Client,Bush’s Final Budget Hints at Tough Choices Ahead http://tinyurl.com/2rdpnh,,False,Tue Feb 05 13:05:39 +0000 2008,0,679798442
0,Twitter Web Client,Bloomberg Warns of Looming Spending Cuts http://tinyurl.com/29oqca,,False,Thu Jan 17 19:07:49 +0000 2008,0,610538342
0,Twitter Web Client,South Texas Hispanics Face a Tough Choice in Primary http://tinyurl.com/3762xl,,False,Mon Feb 25 16:11:10 +0000 2008,0,756264012
0,Twitter Web Client,House Hearing on Steroids in Baseball Is Postponed http://tinyurl.com/28asc7,,False,Wed Jan 09 22:03:51 +0000 2008,0,581219452
0,Twitter Web Client,Justices Send Age Case to Lower Court http://tinyurl.com/36xqt7,,False,Tue Feb 26 18:10:20 +0000 2008,0,761585802
0,Twitter Web Client,Bloggers Push China to Prosecute Beating Death http://tinyurl.com/23nypt,,False,Fri Jan 18 01:07:43 +0000 2008,0,611594322
0,Twitter Web Client,Ohioans Hear Populist Pleas by Democrats http://tinyurl.com/3b2dph,,False,Wed Feb 27 04:12:24 +0000 2008,0,763729910
0,Twitter Web Client,Arizona Congressman Is Indicted http://tinyurl.com/2kefc8,,False,Fri Feb 22 20:10:43 +0000 2008,0,745241622
0,Twitter Web Client,Well: Doctors Take On a Notorious E-Mail http://tinyurl.com/2dzwtl,,False,Fri Jan 18 13:07:37 +0000 2008,0,613448662
0,Twitter Web Client,Volatility of the Markets Carries On in 2008 http://tinyurl.com/2d8ovf,,False,Thu Jan 03 07:03:15 +0000 2008,0,557552972
0,Twitter Web Client,Mayor Hails City’s Immigrants and Innovation http://tinyurl.com/ypylcn,,False,Fri Jan 18 05:07:41 +0000 2008,0,612264992
0,Twitter Web Client,’05 Use of Gas by Blackwater Leaves Questions http://tinyurl.com/ypf5c9,,False,Thu Jan 10 04:04:57 +0000 2008,0,582178012
0,Twitter Web Client,The Lede: Stolen Paintings’ Street Sojourn http://tinyurl.com/377a8o,,False,Tue Feb 19 16:09:53 +0000 2008,0,731140882
0,Twitter Web Client,What’s $34 Billion on Wall Street? http://tinyurl.com/236b4p,,False,Sat Jan 26 02:08:30 +0000 2008,0,642216022
0,Twitter Web Client,"Customers, Not Brokers, Profited in an Odd 2007 http://tinyurl.com/ysv6bg",,False,Wed Jan 02 05:03:30 +0000 2008,0,554103762
0,Twitter Web Client,A French Style of Capitalism Is Now Stained http://tinyurl.com/2admy3,,False,Mon Jan 28 03:06:36 +0000 2008,0,649067202
0,Twitter Web Client,Serbia Warned Over Embassy Attacks http://tinyurl.com/39ymco,,False,Fri Feb 22 18:10:48 +0000 2008,0,744838352
0,Twitter Web Client,"In an Ancient Culture, America’s Team Takes Root http://tinyurl.com/2xrcxq",,False,Sat Jan 12 12:09:09 +0000 2008,0,590890002
0,Twitter Web Client,Tentative Deal Is Reached in Writers’ Strike http://tinyurl.com/24zuot,,False,Sat Feb 09 18:09:32 +0000 2008,0,694063222
0,Twitter Web Client,Amputee Ineligible for Olympic Events http://tinyurl.com/25dok3,,False,Mon Jan 14 16:09:17 +0000 2008,0,598057772
0,Twitter Web Client,UBS Is Expecting a Difficult 2008 http://tinyurl.com/2vz9zd,,False,Thu Feb 14 08:11:13 +0000 2008,0,710486492
0,Twitter Web Client,Justice Dept. Is Asked to Investigate Roger Clemens http://tinyurl.com/3bv4rr,,False,Wed Feb 27 18:10:15 +0000 2008,0,764092843
0,Twitter Web Client,Murder Case Against Tankleff to Be Dropped http://tinyurl.com/2axlaz,,False,Wed Jan 02 22:04:16 +0000 2008,0,556365592
0,Twitter Web Client,"In Asia, Global Market Decline Accelerates http://tinyurl.com/297lvd",,False,Tue Jan 22 08:08:13 +0000 2008,0,627037582
0,Twitter Web Client,Bush Ends Peace Mission Without Breakthroughs http://tinyurl.com/27aav7,,False,Fri Jan 11 15:08:20 +0000 2008,0,587837012
0,Twitter Web Client,A Firefighter Is Killed in a Brooklyn Blaze http://tinyurl.com/29ggvj,,False,Fri Jan 04 06:07:03 +0000 2008,0,560962662
0,Twitter Web Client,Field Narrows as Giuliani and Edwards End Campaigns http://tinyurl.com/2w79yo,,False,Thu Jan 31 12:08:15 +0000 2008,0,662454642
0,Twitter Web Client,The Construction Site Called Saudi Arabia http://tinyurl.com/24efuz,,False,Sat Jan 19 20:08:32 +0000 2008,0,618146572
0,Twitter Web Client,Iraq Parliament Purges Hussein Vestiges on Flag http://tinyurl.com/2248fk,,False,Tue Jan 22 20:08:47 +0000 2008,0,629240642
0,Twitter Web Client,Oscar Picks http://tinyurl.com/342jq5,,False,Fri Feb 15 16:10:05 +0000 2008,0,716522652
0,Twitter Web Client,Philharmonic Arrives in North Korea http://tinyurl.com/2l538x,,False,Mon Feb 25 12:10:13 +0000 2008,0,755438352
0,Twitter Web Client,Mystery Voice in the Strait of Hormuz http://tinyurl.com/2zxw78,,False,Mon Jan 14 19:08:04 +0000 2008,0,598663002
0,Twitter Web Client,"Chad’s Leader Survives, but Dissidents’ Peril Grows http://tinyurl.com/2ug6od",,False,Tue Feb 12 13:09:47 +0000 2008,0,703556302
0,Twitter Web Client,That Mushroom Cloud? They’re Just Svejking Around http://tinyurl.com/2b9jwa,,False,Thu Jan 24 01:07:01 +0000 2008,0,634474932
0,Twitter Web Client,Yahoo Is Said to Be in Talks With News Corp. http://tinyurl.com/2qvdh2,,False,Thu Feb 14 01:11:33 +0000 2008,0,709610642
0,Twitter Web Client,Japan Warns U.S. After Alleged Rape http://tinyurl.com/35mtn9,,False,Tue Feb 12 12:10:29 +0000 2008,0,703379952
0,Twitter Web Client,"At Toyota, a Global Giant Reaches for Agility http://tinyurl.com/3xvrbj",,False,Fri Feb 22 00:10:44 +0000 2008,0,741517932
0,Twitter Web Client,Well Blog: Do You Lie to Your Therapist? http://tinyurl.com/2ezrgm,,False,Thu Jan 10 18:09:46 +0000 2008,0,584484322
0,Twitter Web Client,Philippines on Alert After Plot http://tinyurl.com/38hjok,,False,Thu Feb 14 12:10:17 +0000 2008,0,711182002
