favorite_count,source,text,in_reply_to_screen_name,is_retweet,created_at,retweet_count,id_str
0,Twitter Web Client,Russia Steps Back From Key Arms Treaty http://tinyurl.com/youzkt,,False,Sat Jul 14 15:10:04 +0000 2007,0,149785132
0,Twitter Web Client,Notes Detail Visit to Ashcroft’s Hospital Room http://tinyurl.com/yw89r9,,False,Thu Aug 16 20:10:48 +0000 2007,0,209781232
0,Twitter Web Client,Appeals Court Rejects Lawsuit on Surveillance http://tinyurl.com/2xxg4k,,False,Fri Jul 06 19:10:50 +0000 2007,0,137640592
0,Twitter Web Client,A Nuclear Ruse Uncovers Holes in U.S. Security http://tinyurl.com/2d465s,,False,Thu Jul 12 02:10:16 +0000 2007,0,145702132
0,Twitter Web Client,"Thompson Woos Iowa, a Presidential Hopeful in All but Formality http://tinyurl.com/yurlng",,False,Sat Aug 18 03:10:39 +0000 2007,0,212071512
0,Twitter Web Client,The Caucus Blog: Deborah Pryce Bows Out of Congress http://tinyurl.com/ys54uz,,False,Thu Aug 16 18:10:52 +0000 2007,0,209617082
1,Twitter Web Client,"Reluctant Witness Now on Trial for a Murder Seen, Then Unseen http://tinyurl.com/2hkufz",,False,Sat Jul 28 17:18:31 +0000 2007,0,173311682
0,Twitter Web Client,China Quick to Execute Drug Official http://tinyurl.com/2ywnma,,False,Wed Jul 11 04:10:20 +0000 2007,0,144098712
0,Twitter Web Client,"A $135 Million Home, but if You Have to Ask ... http://tinyurl.com/2dckyq",,False,Mon Jul 02 02:08:17 +0000 2007,0,129941952
0,Twitter Web Client,F.D.A. Scientist Warns of Diabetes Drug’s Risks http://tinyurl.com/2bbobb,,False,Mon Jul 30 14:18:13 +0000 2007,0,176433312
0,Twitter Web Client,Daimler Says Snag Won’t Halt Sale http://tinyurl.com/2ega88,,False,Wed Jul 25 19:08:44 +0000 2007,0,168205532
0,Twitter Web Client,Air Flow in Mine Tunnel Offers Hope to Rescuers http://tinyurl.com/yp6gtp,,False,Sat Aug 11 17:21:19 +0000 2007,0,200377672
0,Twitter Web Client,"Iraqi Military Says 175 Killed, 200 Wounded in 4 Bombings http://tinyurl.com/22ufs9",,False,Tue Aug 14 22:10:55 +0000 2007,0,206233612
0,Twitter Web Client,Surgeon General Sees 4-year Term as Compromised http://tinyurl.com/2dvrwh,,False,Wed Jul 11 03:30:37 +0000 2007,0,144033422
0,Twitter Web Client,Libya Frees Foreign Medical Workers in H.I.V. Case http://tinyurl.com/24rvga,,False,Tue Jul 24 08:08:49 +0000 2007,0,165436412
0,Twitter Web Client,Bush Visits Collapsed Bridge in Minneapolis http://tinyurl.com/24yf5b,,False,Sat Aug 04 18:22:05 +0000 2007,0,186750292
0,Twitter Web Client,"Before Running Cars, Ethanol Fuels Land Boom http://tinyurl.com/26u6bf",,False,Tue Aug 07 22:21:52 +0000 2007,0,192720222
0,Twitter Web Client,Pakistan Celebrates Independence Amid Security Fears http://tinyurl.com/257yqd,,False,Tue Aug 14 13:11:34 +0000 2007,0,205368922
0,Twitter Web Client,Bringing Moos and Oinks Into the Food Debate http://tinyurl.com/yump48,,False,Wed Jul 25 04:48:52 +0000 2007,0,167064512
0,Twitter Web Client,The Lede Blog: Latest Updates http://tinyurl.com/26vus5,,False,Thu Aug 02 13:17:47 +0000 2007,0,182365412
0,Twitter Web Client,U.S. Bomb Kills 3 British Soldiers in Afghanistan http://tinyurl.com/ytsmnf,,False,Fri Aug 24 16:10:04 +0000 2007,0,224981022
0,Twitter Web Client,"In City of Ancient Bridges, Dissent Over a New One http://tinyurl.com/2grh8x",,False,Sun Aug 12 09:21:12 +0000 2007,0,201400792
0,Twitter Web Client,Israel Frees More Than 250 Palestinian Prisoners http://tinyurl.com/2ewpmr,,False,Fri Jul 20 16:09:21 +0000 2007,0,159714602
0,Twitter Web Client,"American League 5, National League 4: Suzuki Puts on a Show and A.L. Hangs On http://tinyurl.com/yw42tm",,False,Wed Jul 11 06:10:52 +0000 2007,0,144232122
0,Twitter Web Client,States Try to Weigh Safety With Dog Owners’ Rights http://tinyurl.com/2f23w4,,False,Mon Jul 23 03:29:12 +0000 2007,0,163328272
0,Twitter Web Client,Top Riders Injured in Tour de France Crash http://tinyurl.com/ytot52,,False,Thu Jul 12 19:10:08 +0000 2007,0,146976012
0,Twitter Web Client,The Caucus: Iraq Veteran in House Backs Obama http://tinyurl.com/yqesd4,,False,Tue Aug 21 15:10:21 +0000 2007,0,218197702
0,Twitter Web Client,Bats: Mussina on Shaky Ground? http://tinyurl.com/yte4y5,,False,Thu Aug 23 13:09:58 +0000 2007,0,222445012
0,Twitter Web Client,City Room: Morning News Roundup http://tinyurl.com/28qzxw,,False,Tue Aug 21 13:10:48 +0000 2007,0,217971862
0,Twitter Web Client,"U.S. Officials Voice Frustrations With Saudis, Citing Role in Iraq http://tinyurl.com/2ahcys",,False,Fri Jul 27 02:08:39 +0000 2007,0,170583752
0,Twitter Web Client,Jailed Academic in Iran Is Released on Bail http://tinyurl.com/yuuryt,,False,Wed Aug 22 03:11:31 +0000 2007,0,219280602
0,Twitter Web Client,City Room: How Would You Spend $250 Million? http://tinyurl.com/yux3cx,,False,Tue Aug 28 19:19:24 +0000 2007,0,233092372
0,Twitter Web Client,Product Packages Now Shout to Get Your Attention http://tinyurl.com/ywvbo3,,False,Fri Aug 10 03:21:32 +0000 2007,0,197431172
0,Twitter Web Client,"After Months of Flirting, Thompson Is Almost In http://tinyurl.com/23hcvd",,False,Fri Aug 31 07:29:17 +0000 2007,0,238716022
0,Twitter Web Client,Bush and Putin Project United Front on Iran http://tinyurl.com/2gkgkw,,False,Mon Jul 02 18:28:38 +0000 2007,0,131062522
0,Twitter Web Client,Drop Foreseen in Median Price of U.S. Homes http://tinyurl.com/2ywya8,,False,Sat Aug 25 17:09:47 +0000 2007,0,226951692
0,Twitter Web Client,Firefighters Bid One of Their Own Farewell http://tinyurl.com/2cx7an,,False,Fri Aug 24 19:10:06 +0000 2007,0,225289572
0,Twitter Web Client,U.N. Mission to North Korea Approved http://tinyurl.com/yr73qq,,False,Mon Jul 09 16:10:35 +0000 2007,0,141591922
0,Twitter Web Client,Stocks Open Flat After Sell-Offs in Asia and Europe http://tinyurl.com/263y4m,,False,Wed Aug 01 16:17:57 +0000 2007,0,180623262
0,Twitter Web Client,Putin Joins Bush at Family Compound in Maine http://tinyurl.com/2y8lrf,,False,Sun Jul 01 23:08:02 +0000 2007,0,129766662
0,Twitter Web Client,Vet Hospitals Compete for Best in Show http://tinyurl.com/27z9e8,,False,Sun Jul 22 16:09:01 +0000 2007,0,162592142
0,Twitter Web Client,"The Saturday Profile: Carving Plight of Coal Miners, He Churns China http://tinyurl.com/yq42ru",,False,Sat Jul 14 09:09:56 +0000 2007,0,149462282
0,Twitter Web Client,Noriega Can Be Extradited to France http://tinyurl.com/yvuqtp,,False,Tue Aug 28 18:19:25 +0000 2007,0,232991992
0,Twitter Web Client,Pope Eases Curbs on Celebrating the Latin Mass http://tinyurl.com/29w55l,,False,Sat Jul 07 17:10:51 +0000 2007,0,138900712
0,Twitter Web Client,Pet Projects Are Flourishing in Congress http://tinyurl.com/25c7ft,,False,Sat Aug 04 18:22:07 +0000 2007,0,186750362
0,Twitter Web Client,Cuba’s Revolution Lurches Forward Under Two Masters http://tinyurl.com/2aex39,,False,Fri Jul 27 01:08:31 +0000 2007,0,170504232
0,Twitter Web Client,"Dow Industrials Close Above 14,000 http://tinyurl.com/2z5x3u",,False,Thu Jul 19 21:09:46 +0000 2007,0,158213232
1,Twitter Web Client,"Elizabeth Murray, 66, Artist of Vivid Forms, Dies http://tinyurl.com/yoc5q2",,False,Mon Aug 13 03:21:40 +0000 2007,0,202656242
0,Twitter Web Client,"Plane Crashes in Florida, Killing 5 http://tinyurl.com/2ej8no",,False,Tue Jul 10 17:10:22 +0000 2007,0,143313022
0,Twitter Web Client,Caps on Prices Only Deepen Zimbabweans’ Misery http://tinyurl.com/29sjvd,,False,Thu Aug 02 03:17:51 +0000 2007,0,181561412
0,Twitter Web Client,Wheels: Ford Fuel Cell Car Goes 200 M.P.H. http://tinyurl.com/yvga5n,,False,Thu Aug 16 16:10:45 +0000 2007,0,209417822
0,Twitter Web Client,"On Money, Romney and Giuliani Trail Top Democrats http://tinyurl.com/2arbox",,False,Tue Jul 03 20:11:26 +0000 2007,0,132881452
0,Twitter Web Client,Iraqi Cabinet Approves Part of Oil Law http://tinyurl.com/yvesdj,,False,Tue Jul 03 20:11:23 +0000 2007,0,132881292
1,Twitter Web Client,"In San Francisco, It’s 5 to 1 for 666 http://tinyurl.com/2dz988",,False,Wed Jul 25 22:08:39 +0000 2007,0,168428192
0,Twitter Web Client,Gates Plans His Leave Amid Great Change http://tinyurl.com/2yv4fh,,False,Mon Jul 30 01:18:29 +0000 2007,0,175391982
0,Twitter Web Client,Obama Warns Pakistan on Terrorism http://tinyurl.com/2eod4d,,False,Wed Aug 01 19:17:53 +0000 2007,0,180898072
0,Twitter Web Client,Group Agrees to Pay F.E.C. Fine for 2004 Campaign Violations http://tinyurl.com/yvqtvo,,False,Thu Aug 30 01:09:38 +0000 2007,0,235899322
0,Twitter Web Client,US Open: The Man Behind the Muscles http://tinyurl.com/29zo6j,,False,Thu Aug 30 14:09:15 +0000 2007,0,237046102
0,Twitter Web Client,Bits Blog: The High-Tech Immigrant Challenge http://tinyurl.com/yoz88r,,False,Thu Aug 23 00:10:41 +0000 2007,0,221304172
0,Twitter Web Client,Bits: The Sony vs. Microsoft Console Battle http://tinyurl.com/2xz3la,,False,Fri Aug 17 13:10:38 +0000 2007,0,210868382
0,Twitter Web Client,Youth Groups Created by Kremlin Serve Putin’s Cause http://tinyurl.com/26eelh,,False,Sat Jul 07 17:10:47 +0000 2007,0,138900632
0,Twitter Web Client,"Summer Rituals | Boldface Barbecue: Hot Off the Grill, It’s Hamptons High Society http://tinyurl.com/yonvxn",,False,Sat Aug 11 00:21:21 +0000 2007,0,199250372
0,Twitter Web Client,U.N. Warns of Gaza Collapse if Border Stays Closed http://tinyurl.com/yu2bew,,False,Wed Jul 18 18:09:27 +0000 2007,0,156197982
0,Twitter Web Client,Dogfighting Charges Filed Against Falcons’ Vick http://tinyurl.com/yv2urv,,False,Wed Jul 18 02:10:32 +0000 2007,0,155044932
0,Twitter Web Client,A Trip Back in Time and Space http://tinyurl.com/25e47q,,False,Tue Jul 10 00:10:31 +0000 2007,0,142138392
0,Twitter Web Client,Ousted Thai Leader Haunts Junta http://tinyurl.com/28s8w8,,False,Tue Aug 14 16:11:06 +0000 2007,0,205682462
0,Twitter Web Client,Career Women in Japan Find a Blocked Path http://tinyurl.com/yw84af,,False,Mon Aug 06 02:21:57 +0000 2007,0,188880392
0,Twitter Web Client,Dancing Elmo Smackdown http://tinyurl.com/22wq7l,,False,Thu Jul 26 03:08:42 +0000 2007,0,168785732
0,Twitter Web Client,"Now a Lobbyist, Ex-Senator Uses Campaign Money http://tinyurl.com/2yocjs",,False,Fri Aug 24 04:12:48 +0000 2007,0,223865002
0,Twitter Web Client,China Replaces Key Ministers http://tinyurl.com/2cdnbh,,False,Thu Aug 30 16:09:26 +0000 2007,0,237273642
0,Twitter Web Client,Senate Passes Bill Based on 9/11 Panel Proposals http://tinyurl.com/22vxx3,,False,Fri Jul 27 06:08:34 +0000 2007,0,170880592
0,Twitter Web Client,Pa. Governor Orders Partial Shutdown http://tinyurl.com/ys38yh,,False,Mon Jul 09 12:10:35 +0000 2007,0,141265802
0,Twitter Web Client,An Ambivalent Panama Weighs Noriega’s Threat http://tinyurl.com/27bgfj,,False,Sat Jul 28 16:18:32 +0000 2007,0,173239412
0,Twitter Web Client,"In a Killing on a Baghdad Street, the Questions That Haunt Iraq http://tinyurl.com/2a6buv",,False,Sat Jul 14 03:10:23 +0000 2007,0,149153832
0,Twitter Web Client,Iraq Cabinet Approves Oil Law Draft http://tinyurl.com/yr7vsc,,False,Tue Jul 03 13:18:16 +0000 2007,0,132336412
0,Twitter Web Client,Safety Issues Slow Mine Rescue Efforts http://tinyurl.com/2eztw7,,False,Wed Aug 08 02:21:44 +0000 2007,0,193076202
0,Twitter Web Client,Gonzales Faces Senate Questioning http://tinyurl.com/ynjs7c,,False,Tue Jul 24 14:08:50 +0000 2007,0,165888482
0,Twitter Web Client,Man Regains Speech After Brain Stimulation http://tinyurl.com/24k83y,,False,Thu Aug 02 02:17:55 +0000 2007,0,181472122
0,Twitter Web Client,Bombers Kill Dozens North of Baghdad http://tinyurl.com/2zef3m,,False,Sat Jul 07 16:10:43 +0000 2007,0,138834732
0,Twitter Web Client,British Criticize U.S. Air Attacks in Afghan Region http://tinyurl.com/2a3qch,,False,Thu Aug 09 02:21:39 +0000 2007,0,195210322
0,Twitter Web Client,"The Iowa Straw Poll, Mostly Barbecue and Carnival http://tinyurl.com/25pevp",,False,Sat Aug 11 20:21:14 +0000 2007,0,200586562
0,Twitter Web Client,North Korea Offers Nuclear Concessions http://tinyurl.com/2ecmtb,,False,Wed Jul 18 15:09:31 +0000 2007,0,155959272
0,Twitter Web Client,Tom Snyder of ‘Tomorrow Show’ Dies at 71 http://tinyurl.com/yu6t8s,,False,Mon Jul 30 14:18:11 +0000 2007,0,176433242
0,Twitter Web Client,"For Architects, the Archives as Gold Mine http://tinyurl.com/25pooa",,False,Mon Jul 23 02:19:55 +0000 2007,0,163247182
0,Twitter Web Client,Curfew Near Taj Mahal After Violence http://tinyurl.com/28kk4o,,False,Wed Aug 29 18:09:47 +0000 2007,0,235255202
0,Twitter Web Client,Ex-Mayor of Newark Indicted in Corruption Case http://tinyurl.com/2b6swb,,False,Thu Jul 12 18:10:08 +0000 2007,0,146901102
0,Twitter Web Client,"With Fixtures of War as Their Canvas, Muralists Add Beauty to Baghdad http://tinyurl.com/ynoye7",,False,Sat Aug 11 06:31:22 +0000 2007,0,199652752
0,Twitter Web Client,Romney Pushed on Conservative Credentials http://tinyurl.com/2fszzl,,False,Fri Aug 10 03:21:28 +0000 2007,0,197431052
0,Twitter Web Client,Ex-Partner at Milberg Pleads Guilty to Conspiracy http://tinyurl.com/29h6ae,,False,Tue Jul 10 02:10:37 +0000 2007,0,142245522
0,Twitter Web Client,Gates Offers Blunt Review of Progress in Iraq http://tinyurl.com/2h9fde,,False,Fri Aug 03 03:22:17 +0000 2007,0,183701842
0,Twitter Web Client,NASA Moves Up Landing Because of Storm http://tinyurl.com/26l6ro,,False,Sun Aug 19 01:10:26 +0000 2007,0,213477032
0,Twitter Web Client,Bruno Calls for Investigation of Spitzer’s Role http://tinyurl.com/2cm9ve,,False,Wed Jul 25 17:18:57 +0000 2007,0,168058932
0,Twitter Web Client,A Top Official at Bear Stearns Ousted Over Funds Implosion http://tinyurl.com/2dq4qv,,False,Mon Aug 06 02:21:56 +0000 2007,0,188880372
0,Twitter Web Client,Australia Police Drop Bid to Hold Suspect in Bomb Plots http://tinyurl.com/284ob9,,False,Fri Jul 13 11:10:08 +0000 2007,0,148029372
0,Twitter Web Client,"For Clinton, Faith Intertwined With Political Life http://tinyurl.com/27tu42",,False,Sat Jul 07 02:10:51 +0000 2007,0,138068862
0,Twitter Web Client,Russia Orders Bomber Patrols http://tinyurl.com/28zt6n,,False,Fri Aug 17 16:10:40 +0000 2007,0,211188512
0,Twitter Web Client,Edwards’s Campaign Tries to Harness Internet http://tinyurl.com/2xaq4s,,False,Wed Aug 01 03:19:17 +0000 2007,0,179518122
0,Twitter Web Client,XM and Sirius Radio Propose Pricing http://tinyurl.com/2zgnp6,,False,Mon Jul 23 20:08:54 +0000 2007,0,164546002
0,Twitter Web Client,Giants’ Strahan May Be Calling It Quits http://tinyurl.com/2clnue,,False,Fri Jul 27 20:18:48 +0000 2007,0,171992282
0,Twitter Web Client,Cuba Looks Back Without Fidel Castro http://tinyurl.com/2xlwkf,,False,Thu Jul 26 15:08:58 +0000 2007,0,169698712
0,Twitter Web Client,"Facing the Multiple Risks of Newer, Deeper Mines http://tinyurl.com/227ne6",,False,Thu Aug 16 02:11:06 +0000 2007,0,208301072
0,Twitter Web Client,Floods Kill 13 in Midwest http://tinyurl.com/296hjy,,False,Mon Aug 20 16:11:01 +0000 2007,0,216209602
0,Twitter Web Client,Taliban Extends Deadline for Captives http://tinyurl.com/2cey4p,,False,Mon Jul 23 16:09:24 +0000 2007,0,164209932
0,Twitter Web Client,City Room: Latest Updates http://tinyurl.com/2e5c32,,False,Wed Aug 08 15:22:34 +0000 2007,0,194194192
0,Twitter Web Client,"For Its Next Music Director, the Philharmonic Turns to Family http://tinyurl.com/24928y",,False,Wed Jul 18 00:09:38 +0000 2007,0,154903682
0,Twitter Web Client,Britain Eases Livestock Restrictions http://tinyurl.com/2g2ukw,,False,Thu Aug 09 19:21:30 +0000 2007,0,196733462
0,Twitter Web Client,Pakistani Wife Embodies Cause of ‘Disappeared’ http://tinyurl.com/27q3e6,,False,Thu Jul 19 02:09:26 +0000 2007,0,156764612
0,Twitter Web Client,"Turkish Presidential Pick Sets Up Clash, Again http://tinyurl.com/2xkmcu",,False,Tue Aug 14 02:11:13 +0000 2007,0,204535952
0,Twitter Web Client,It Ain’t ‘Damn Yankees’ but It’s Got Legs http://tinyurl.com/2el2pm,,False,Tue Aug 14 05:11:06 +0000 2007,0,204767472
0,Twitter Web Client,The Lede Blog: Street-Smarts Chutzpah on Wall Street http://tinyurl.com/2ahrwu,,False,Tue Aug 21 19:10:14 +0000 2007,0,218595052
0,Twitter Web Client,Marines’ Trials in Iraq Killings Are Withering http://tinyurl.com/2c9hjj,,False,Thu Aug 30 02:10:10 +0000 2007,0,235985682
0,Twitter Web Client,All 8 Suspects in British Attacks Are Expatriate Medical Professionals http://tinyurl.com/25ydf6,,False,Wed Jul 04 04:11:05 +0000 2007,0,133414122
0,Twitter Web Client,"For Venus Williams, From No. 23 to a Title http://tinyurl.com/yp9jjy",,False,Sat Jul 07 17:10:46 +0000 2007,0,138900612
0,Twitter Web Client,Path to Parole Becomes Issue in Murder Case http://tinyurl.com/2bfp5c,,False,Tue Jul 31 03:18:24 +0000 2007,0,177553332
0,Twitter Web Client,War on Terror Takes Focus at Democrats’ Debate http://tinyurl.com/2bccyw,,False,Wed Aug 08 03:21:55 +0000 2007,0,193167542
0,Twitter Web Client,Culture: Seducing France Into Affairs of the Art http://tinyurl.com/2emz9p,,False,Mon Jul 23 04:29:30 +0000 2007,0,163398902
0,Twitter Web Client,Hastert Will Not Seek New Congressional Term http://tinyurl.com/2xknzn,,False,Wed Aug 15 01:10:57 +0000 2007,0,206436312
0,Twitter Web Client,"After Seizure, Roberts Faces Hard Decision http://tinyurl.com/272vm6",,False,Wed Aug 01 02:18:05 +0000 2007,0,179426512
0,Twitter Web Client,"In Study Abroad, Gifts and Money for Universities http://tinyurl.com/264onb",,False,Mon Aug 13 02:21:12 +0000 2007,0,202575662
0,Twitter Web Client,"Rome Journal: Love Rite on a Bridge, but Is the Romance Fading? http://tinyurl.com/23nkca",,False,Mon Aug 06 01:22:00 +0000 2007,0,188804652
0,Twitter Web Client,U.S. Ties Iranians to Iraq Attack That Killed G.I.’s http://tinyurl.com/2do2hg,,False,Mon Jul 02 12:08:00 +0000 2007,0,130573612
0,Twitter Web Client,City Room: Who’s That With the Milk Mustache? http://tinyurl.com/2dm9au,,False,Tue Aug 21 17:10:15 +0000 2007,0,218408332
0,Twitter Web Client,Uncle of Suspect in Cheshire Home Invasion Speaks http://tinyurl.com/264bql,,False,Thu Jul 26 19:08:33 +0000 2007,0,170054902
0,Twitter Web Client,Ochoa Wins Her First Major Title http://tinyurl.com/yox8qb,,False,Mon Aug 06 02:22:03 +0000 2007,0,188880562
0,Twitter Web Client,U.S. Told to Pay $101 Million for Framing 4 Men http://tinyurl.com/yq7pay,,False,Thu Jul 26 20:08:54 +0000 2007,0,170131142
0,Twitter Web Client,"With Rove Absent, Aide Is Grilled by Senate Panel http://tinyurl.com/2dhzf5",,False,Thu Aug 02 18:22:24 +0000 2007,0,182920492
0,Twitter Web Client,Debt Market Is Squeezing Private Equity http://tinyurl.com/yqkmlw,,False,Sat Jul 21 04:29:12 +0000 2007,0,160580472
0,Twitter Web Client,Cancer Society Focuses Its Ads on Uninsured http://tinyurl.com/ypy2hx,,False,Fri Aug 31 03:29:45 +0000 2007,0,238382112
0,Twitter Web Client,"As Legal Counsel, Thompson Was Pulled in Two Directions http://tinyurl.com/255z5j",,False,Mon Aug 27 03:20:33 +0000 2007,0,229415832
0,Twitter Web Client,New York Company Indicted in Collapse of Big Dig http://tinyurl.com/yr8px9,,False,Thu Aug 09 00:21:37 +0000 2007,0,195033102
0,Twitter Web Client,Chinese Pig Virus Causes Concern Around the Globe http://tinyurl.com/299b4j,,False,Thu Aug 16 00:11:44 +0000 2007,0,208135072
0,Twitter Web Client,"US Open Blog: Nobody Loses, but Djokovic Advances http://tinyurl.com/yuyqkx",,False,Fri Aug 31 23:09:00 +0000 2007,0,240086612
0,Twitter Web Client,Musharraf Loses Fight Over Suspension of Judge http://tinyurl.com/yvjn3d,,False,Sat Jul 21 03:09:15 +0000 2007,0,160504172
0,Twitter Web Client,G.I.’s Forge Sunni Tie in Bid to Squeeze Militants http://tinyurl.com/2zh72s,,False,Fri Jul 06 02:10:57 +0000 2007,0,136464222
0,Twitter Web Client,IPhone Futures Prove to Be a Bad Investment http://tinyurl.com/2lf5xv,,False,Thu Jul 05 22:11:03 +0000 2007,0,136214132
0,Twitter Web Client,"Bill Walsh, Ex-49ers Coach, Dies at 75 http://tinyurl.com/yubwbh",,False,Mon Jul 30 20:18:09 +0000 2007,0,176990492
0,Twitter Web Client,"Memo From Dubai: U.S. Promotes Free Elections, Only to See Allies Lose http://tinyurl.com/2avyxq",,False,Fri Aug 10 02:21:45 +0000 2007,0,197343652
0,Twitter Web Client,Musharraf Said to Agree to Drop Role as Army Chief http://tinyurl.com/ytunxr,,False,Wed Aug 29 16:10:39 +0000 2007,0,235049282
0,Twitter Web Client,Campaign Puts Giuliani and Ailes in Uncharted Territory http://tinyurl.com/yq4tkm,,False,Wed Aug 01 23:17:52 +0000 2007,0,181222532
0,Twitter Web Client,Concern Over Wider Spying Under New Law http://tinyurl.com/2hyfpq,,False,Sat Aug 18 18:10:28 +0000 2007,0,213056402
0,Twitter Web Client,Spying Program May Be Tested by Terror Case http://tinyurl.com/2dq544,,False,Sat Aug 25 19:09:42 +0000 2007,0,227106332
0,Twitter Web Client,"Butch van Breda Kolff, Basketball Coach, Is Dead http://tinyurl.com/yu9qf5",,False,Thu Aug 23 20:09:57 +0000 2007,0,223185272
0,Twitter Web Client,Democrats Say Leaving Iraq May Take Years http://tinyurl.com/ywawl6,,False,Sat Aug 11 18:21:19 +0000 2007,0,200454702
0,Twitter Web Client,Fatah Militants Lay Down Their Arms to Bolster Abbas http://tinyurl.com/25pzeq,,False,Sat Jul 21 20:09:11 +0000 2007,0,161497242
0,Twitter Web Client,Report on Iraq Shows Mixed Results http://tinyurl.com/24ww6e,,False,Thu Jul 12 15:10:13 +0000 2007,0,146642702
0,Twitter Web Client,Palestinian Emergency Cabinet Transfers Power http://tinyurl.com/2xkzuk,,False,Fri Jul 13 17:10:33 +0000 2007,0,148542782
0,Twitter Web Client,Spitzer Woes Are Enjoyed on Wall Street http://tinyurl.com/27yn7u,,False,Fri Jul 27 03:19:09 +0000 2007,0,170679662
0,Twitter Web Client,Global Stock Markets Tumble Amid Deepening Credit Fears http://tinyurl.com/ywu7gg,,False,Fri Jul 27 02:08:37 +0000 2007,0,170583702
0,Twitter Web Client,Six Remain Trapped in Coal Mine in Utah http://tinyurl.com/yq72hh,,False,Tue Aug 07 01:22:15 +0000 2007,0,190833122
0,Twitter Web Client,Family Feud at CBS and Viacom http://tinyurl.com/2gjyum,,False,Fri Jul 20 02:09:34 +0000 2007,0,158581092
0,Twitter Web Client,Chinese Launch High-Tech Plan to Track People http://tinyurl.com/2djyy2,,False,Sat Aug 11 19:21:19 +0000 2007,0,200523032
0,Twitter Web Client,"A Slippery, Writhing Trade Dispute http://tinyurl.com/yto5lq",,False,Tue Jul 03 02:07:57 +0000 2007,0,131595762
0,Twitter Web Client,Mortgage Lender Says It Will Close http://tinyurl.com/2xl99t,,False,Fri Aug 03 02:22:21 +0000 2007,0,183613592
0,Twitter Web Client,"With Troop Rise, Iraqi Detainees Soar in Number http://tinyurl.com/2z5x9k",,False,Sat Aug 25 01:11:20 +0000 2007,0,225808102
0,Twitter Web Client,Immigration Is at Center of New Laws Around U.S. http://tinyurl.com/254f84,,False,Mon Aug 06 04:21:52 +0000 2007,0,189043922
0,Twitter Web Client,Home Depot Unit Sold for Far Less in Tight Market http://tinyurl.com/2fl493,,False,Mon Aug 27 03:20:14 +0000 2007,0,229415302
0,Twitter Web Client,"Brazil, Alarmed, Reconsiders Policy on Climate Change http://tinyurl.com/yteo6s",,False,Tue Jul 31 09:18:01 +0000 2007,0,177999682
0,Twitter Web Client,"Ugly Airline Math: Planes Late, Fliers Even Later http://tinyurl.com/yszxed",,False,Thu Jul 05 02:11:00 +0000 2007,0,134851042
0,Twitter Web Client,Tax Break Used by Drug Makers Failed to Add Jobs http://tinyurl.com/2zo7hm,,False,Tue Jul 24 03:08:59 +0000 2007,0,165095552
0,Twitter Web Client,Clinton Donor Under a Cloud in Fraud Case http://tinyurl.com/ysh7k5,,False,Thu Aug 30 03:19:29 +0000 2007,0,236092822
0,Twitter Web Client,Top G.O.P. Candidates See Signs of Progress in Iraq http://tinyurl.com/2vv7t2,,False,Sun Aug 05 18:22:01 +0000 2007,0,188317632
0,Twitter Web Client,Firm Hired to Monitor Gambling on Open http://tinyurl.com/223x87,,False,Fri Aug 24 15:10:08 +0000 2007,0,224862682
0,Twitter Web Client,A Day of Wild Market Swings and Global Anxiety http://tinyurl.com/278uw7,,False,Fri Aug 17 02:10:59 +0000 2007,0,210251362
0,Twitter Web Client,What Is the Seventh Potter Book Called in China? http://tinyurl.com/ypv3jn,,False,Wed Aug 01 02:18:04 +0000 2007,0,179426482
0,Twitter Web Client,Russia Plants Underwater Flag at North Pole http://tinyurl.com/2e8ame,,False,Thu Aug 02 20:22:15 +0000 2007,0,183106032
0,Twitter Web Client,What Autistic Girls Are Made Of http://tinyurl.com/2xegbr,,False,Mon Aug 06 07:21:52 +0000 2007,0,189255392
0,Twitter Web Client,"Your Ad Here, on My S.U.V.? And You’ll Pay? http://tinyurl.com/yt66ue",,False,Mon Aug 27 03:20:17 +0000 2007,0,229415402
0,Twitter Web Client,Afghans Search for S. Korean Hostages http://tinyurl.com/yrmotj,,False,Sun Jul 22 10:09:09 +0000 2007,0,162187202
0,Twitter Web Client,Almost Over http://tinyurl.com/yqksu5,,False,Fri Aug 31 01:09:43 +0000 2007,0,238182442
0,Twitter Web Client,Russia Challenges Europe on I.M.F. http://tinyurl.com/yu3uyl,,False,Wed Aug 22 16:10:02 +0000 2007,0,220514322
0,Twitter Web Client,Fed Chairman Cites Inflation Threat http://tinyurl.com/26utcb,,False,Tue Jul 10 18:10:22 +0000 2007,0,143390362
0,Twitter Web Client,Paper Cuts: Ingmar and Woody http://tinyurl.com/2gt25g,,False,Mon Jul 30 19:18:06 +0000 2007,0,176905332
0,Twitter Web Client,British Police Deport Suspect in Berezovsky Plot http://tinyurl.com/ypn3jj,,False,Wed Jul 18 21:09:26 +0000 2007,0,156410652
0,Twitter Web Client,Savings and Issues in Candidates’ Use of Private Jets http://tinyurl.com/ywnzfy,,False,Thu Jul 26 11:08:35 +0000 2007,0,169355152
0,Twitter Web Client,Hijackers Said to Divert Turkish Plane http://tinyurl.com/2dh5ls,,False,Sat Aug 18 08:10:56 +0000 2007,0,212400282
0,Twitter Web Client,"Cairo Journal: Stepping Boldly Off the Curb, With a Wave and a Prayer http://tinyurl.com/2yvn3u",,False,Tue Jul 17 08:09:36 +0000 2007,0,153722642
0,Twitter Web Client,"Leona Helmsley, ‘Queen’ of Hotel Chain, Dies at 87 http://tinyurl.com/29eawj",,False,Tue Aug 21 03:10:21 +0000 2007,0,217140872
0,Twitter Web Client,"No Oil Yet, but African Isle Finds Dealings Slippery http://tinyurl.com/258kdq",,False,Mon Jul 02 03:28:15 +0000 2007,0,130024902
0,Twitter Web Client,Taliban Threatens to Kill 23 Koreans http://tinyurl.com/yqp57q,,False,Mon Jul 23 15:09:10 +0000 2007,0,164127312
