favorite_count,source,text,in_reply_to_screen_name,is_retweet,created_at,retweet_count,id_str
7,Twitter Web Client,On Par: Golfers Have Clothes Laid Out for Them http://bit.ly/OmwZM,,False,Mon Jul 13 06:10:57 +0000 2009,0,2610331279
8,Twitter Web Client,Economix: State-by-State Drug Use http://bit.ly/1gJ5i,,False,Tue Aug 11 18:33:15 +0000 2009,0,3250067609
2,Twitter Web Client,NYT NEWS ALERT: Watson Bogey Puts Him in British Open Playoff With Cink,,False,Sun Jul 19 17:28:05 +0000 2009,0,2724526887
11,Twitter Web Client,Aug. 15 marks the 40th anniversary of Woodstock. Today @nytimesphoto features behind the scenes memories of the fest: http://bit.ly/tPPuL,,False,Thu Jul 30 20:15:56 +0000 2009,0,2937017366
4,Twitter Web Client,Albany Leader Fires Aide Over Real Estate Woes http://bit.ly/8Gkn4,,False,Mon Aug 31 22:29:40 +0000 2009,0,3675132822
4,Twitter Web Client,Abuse Issue Puts the Justice Dept. and C.I.A. at Odds http://bit.ly/AibSh,,False,Fri Aug 28 03:16:56 +0000 2009,0,3594991413
6,Twitter Web Client,China Holds Rio Tinto Executive on Spying Charges http://bit.ly/2K5lW,,False,Wed Jul 08 18:08:51 +0000 2009,0,2536227210
0,Twitter Web Client,We're hearing: Announcement of a new surgeon general later this morning.,,False,Mon Jul 13 14:14:18 +0000 2009,0,2614460454
5,Twitter Web Client,Scientist at Work: Tucker Childs: Linguist’s Preservation Kit Has New Digital Tools http://bit.ly/KXSOF,,False,Mon Jul 27 22:27:25 +0000 2009,0,2878754953
3,Twitter Web Client,India Rebuffs New Efforts for Binding Carbon Targets http://bit.ly/WBmRe,,False,Sun Jul 19 17:19:52 +0000 2009,0,2724419244
6,Twitter Web Client,"Calm, but Moved to Be Heard on Health Care http://bit.ly/jz98B",,False,Tue Aug 25 02:00:42 +0000 2009,0,3525836457
2,Twitter Web Client,China Opens Trial of Quake Critic http://bit.ly/8rElm,,False,Wed Aug 05 21:34:44 +0000 2009,0,3153445380
4,Twitter Web Client,Sharp Rise in New U.S. Home Sales http://bit.ly/3sQwdo,,False,Mon Jul 27 14:38:01 +0000 2009,0,2871113192
4,Twitter Web Client,An Appraisal: ‘Cronkite’ Meant the News http://bit.ly/15r6u9,,False,Sat Jul 18 02:10:41 +0000 2009,0,2699706404
6,Twitter Web Client,Obama Renews Vow of No Middle-Class Tax Increase http://bit.ly/3ieZSm,,False,Tue Aug 04 01:04:53 +0000 2009,0,3115204775
18,Twitter Web Client,We have a special section  today on value of continuing education. Lots of interesting articles and helpful info:  http://bit.ly/SU4Ai,,False,Thu Aug 20 14:39:14 +0000 2009,0,3428458252
10,Twitter Web Client,Clinton’s Trip Gave Rare Insight on N. Korean Leaders http://bit.ly/3pXJXm,,False,Wed Aug 19 01:26:57 +0000 2009,0,3395573866
10,Twitter Web Client,Economic Scene: Workers With Part-Time Jobs Mask Joblessness http://bit.ly/aXMb5,,False,Wed Jul 15 01:38:33 +0000 2009,1,2643130478
6,Twitter Web Client,Bill Clinton Reported Heading to North Korea http://bit.ly/YMqbR,,False,Tue Aug 04 03:09:19 +0000 2009,0,3117279859
7,Twitter Web Client,Idea of the Day: Health Care’s Oil Problem http://bit.ly/3ZRQJ,,False,Mon Aug 10 11:41:17 +0000 2009,0,3223657504
5,Twitter Web Client,Toyota Posts $819 Million Loss http://bit.ly/8HMTP,,False,Tue Aug 04 09:40:25 +0000 2009,0,3121814261
5,Twitter Web Client,Prolonged Aid to Unemployed Is Running Out http://bit.ly/4W0K6,,False,Sat Aug 01 18:20:15 +0000 2009,0,3073518128
4,Twitter Web Client,DealBook: Judge Approves G.M. Sale Plan http://bit.ly/s5E7S,,False,Mon Jul 06 03:54:36 +0000 2009,0,2491941999
3,Twitter Web Client,California Budget Deal Closes $24 Billion Gap http://bit.ly/4ze9E6,,False,Fri Jul 24 20:46:25 +0000 2009,0,2825586976
1,Twitter Web Client,U.S. Signals 2nd Gitmo Detainee Headed to Trial http://bit.ly/4eGEO,,False,Fri Jul 24 22:24:00 +0000 2009,0,2827156780
2,Twitter Web Client,Correction: Follow the Tour de France with @JulietMacur. Sorry if we sent you to the wrong place.,,False,Mon Jul 06 13:04:29 +0000 2009,0,2496500197
6,Twitter Web Client,"Mozart Festival Opens, With Haydn and Beethoven in Attendance http://bit.ly/ed7LX",,False,Wed Jul 29 20:19:50 +0000 2009,0,2916125271
2,Twitter Web Client,"After Iowa Flood, Feeling Just a Bit Ignored http://bit.ly/2YBO1C",,False,Fri Aug 28 05:34:57 +0000 2009,0,3597136069
8,Twitter Web Client,Varied Opinions on Gates Controversy Light Up the Web http://bit.ly/JVL8c,,False,Fri Jul 24 23:16:03 +0000 2009,0,2827950688
8,Twitter Web Client,The Caucus: Senator Martinez Resigns Early http://bit.ly/mmK0j,,False,Fri Aug 07 17:34:36 +0000 2009,0,3180676606
2,Twitter Web Client,Ex-President in Iran Seeks Referendum http://bit.ly/15t8kO,,False,Mon Jul 20 02:04:25 +0000 2009,0,2731302710
10,Twitter Web Client,"Ads Follow Web Users, and Get Deeply Personal http://bit.ly/zh6w9",,False,Fri Jul 31 03:03:26 +0000 2009,0,2943912881
7,Twitter Web Client,"Pushing the Limit: You Created It, Tough Guy. So Let’s See You Finish It. http://bit.ly/i9AUP",,False,Tue Jul 07 07:34:59 +0000 2009,0,2510939795
7,Twitter Web Client,"News Analysis: A Nominee on Display, but Not Her Views http://bit.ly/5MatB",,False,Fri Jul 17 03:55:15 +0000 2009,0,2682317184
6,Twitter Web Client,Iran’s Supreme Leader Softens Tone on Reformists http://bit.ly/9Lcif,,False,Thu Aug 27 18:38:11 +0000 2009,0,3584897627
6,Twitter Web Client,J.P. Morgan Profit Soars Despite Downturn http://bit.ly/5sGMb,,False,Thu Jul 16 11:18:00 +0000 2009,0,2668049673
3,Twitter Web Client,Movie Review | 'Bruno': Teutonic Fashion Plate Flaunts His Umlauts http://bit.ly/1MICjn,,False,Thu Jul 09 16:53:04 +0000 2009,0,2552941769
4,Twitter Web Client,Room for Debate: Room for Debate: Prosecuting the C.I.A. http://bit.ly/uArM7,,False,Tue Aug 25 13:43:00 +0000 2009,0,3534782355
5,Twitter Web Client,"In Mexico, Ambivalence on a Drug Law http://bit.ly/16ZUnk",,False,Mon Aug 24 01:24:53 +0000 2009,0,3503079337
2,Twitter Web Client,Biden Arrives in Iraq as Violence Flares Again http://bit.ly/f3obu,,False,Thu Jul 02 17:41:46 +0000 2009,0,2440336358
3,Twitter Web Client,California Starting to Pay With I.O.U.’s http://bit.ly/K28Of,,False,Thu Jul 02 17:26:05 +0000 2009,0,2440107005
4,Twitter Web Client,Inquiry Begun on Hacking Cases at Murdoch Papers http://bit.ly/vDUkE,,False,Thu Jul 09 11:29:29 +0000 2009,0,2548848218
16,Twitter Web Client,Readers' Photos: What's In Your Phone? Over 700 photos have been submitted to Lens ( @nytimesphoto ) so far: http://bit.ly/pWJbd,,False,Wed Jul 01 20:04:00 +0000 2009,0,2425308744
6,Twitter Web Client,"Dominick Dunne, Chronicler of Crime, Dies at 83 http://bit.ly/21bpRH",,False,Thu Aug 27 04:30:37 +0000 2009,0,3572889724
5,Twitter Web Client,"As Big Banks Repay Bailout Money, U.S. Sees a Profit http://bit.ly/cbYRG",,False,Mon Aug 31 02:32:52 +0000 2009,0,3657683567
16,Twitter Web Client,Scientist at Work: Stephen Kurtin: Making Eyeglasses That Let Wearers Change Focus on the Fly http://bit.ly/nxhi6,,False,Tue Aug 04 07:03:24 +0000 2009,0,3120417156
2,Twitter Web Client,Obama Takes Health Care Debate to a N.H. School http://bit.ly/zlpjM,,False,Tue Aug 11 20:51:06 +0000 2009,0,3251885282
2,Twitter Web Client,"Room for Debate: Sotomayor, Hispanics and the G.O.P. http://bit.ly/4GyJdn",,False,Thu Aug 06 19:24:55 +0000 2009,0,3168133224
7,Twitter Web Client,Plan to Heal Congo Plummets Into Scourge of Rape and Murder http://bit.ly/16It3c,,False,Wed Aug 05 01:05:15 +0000 2009,0,3135809649
8,Twitter Web Client,"Harlem Store Owner Shoots 4 Robbers, Killing 2 http://bit.ly/WFIGU",,False,Fri Aug 14 02:43:06 +0000 2009,0,3299795113
6,Twitter Web Client,Police Say Reality TV Star Found Dead http://bit.ly/2RfwW0,,False,Mon Aug 24 02:14:13 +0000 2009,0,3504025793
24,Twitter Web Client,Your Money: A Day Off to Tackle the Financial To-Do List http://bit.ly/cMWVX,,False,Fri Jul 03 16:05:49 +0000 2009,0,2455731497
4,Twitter Web Client,Summer Rituals | Play Street: Play Street Becomes a Sanctuary http://bit.ly/13LqDN,,False,Sat Aug 01 13:25:29 +0000 2009,0,3069765812
6,Twitter Web Client,Cash-Strapped California Turns to a Tag Sale http://bit.ly/wAw2z,,False,Fri Aug 28 01:56:00 +0000 2009,0,3593452960
6,Twitter Web Client,"Room for Debate: Goldman's Gain, America's Risk http://bit.ly/b5Oco",,False,Tue Jul 14 23:53:46 +0000 2009,0,2641547427
10,Twitter Web Client,Japanese Economy Grows http://bit.ly/F9KCx,,False,Mon Aug 17 01:43:38 +0000 2009,0,3353655892
7,Twitter Web Client,Biden Criticizes Russia in Move Called ‘Perplexing’ http://bit.ly/PLrWa,,False,Sat Jul 25 19:18:47 +0000 2009,0,2841444612
9,Twitter Web Client,7 Killed in Mobile Home in Georgia http://bit.ly/6wNKt,,False,Sat Aug 29 21:56:43 +0000 2009,0,3632935843
3,Twitter Web Client,Johnson & Johnson Buys Access to Alzheimer’s Drug http://bit.ly/gbHo6,,False,Thu Jul 02 14:52:57 +0000 2009,0,2437870444
11,Twitter Web Client,"Bin Laden’s Son Killed in Pakistan, U.S. Says http://bit.ly/D2DXA",,False,Thu Jul 23 18:56:35 +0000 2009,1,2803402084
6,Twitter Web Client,The Caucus: House Democrats Agree on Plan to Pay for Health Care Reform http://bit.ly/YbhH,,False,Fri Jul 10 23:40:46 +0000 2009,0,2575789655
7,Twitter Web Client,Police Kill Suspected Serial Murderer http://bit.ly/nftbn,,False,Tue Jul 07 00:24:58 +0000 2009,0,2505689776
2,Twitter Web Client,Corzine Rival Failed to Report Loan on Tax Return http://bit.ly/jlzkz,,False,Tue Aug 18 15:37:04 +0000 2009,0,3384413931
2,Twitter Web Client,"Mingora Journal: Back Home in Pakistan, but Feeling Under Siege http://bit.ly/WTFav",,False,Mon Jul 27 02:06:11 +0000 2009,0,2862748081
6,Twitter Web Client,Toy Factory Melee Set Off Western China Violence http://bit.ly/DYEpu,,False,Wed Jul 15 18:42:49 +0000 2009,0,2655598665
4,Twitter Web Client,A Truce Is Reached in a Cable News Feud http://bit.ly/iEGQz,,False,Fri Jul 31 22:42:17 +0000 2009,0,3059828407
20,Twitter Web Client,"Readers' Photos: More than 1,500 submissions; the Lens blog presents a gallery of some of your best cellphone shots.http://bit.ly/fumwz",,False,Fri Jul 10 19:02:57 +0000 2009,0,2572161663
3,Twitter Web Client,City Room: New Board of Education Votes to Keep Klein http://bit.ly/4bYsIS,,False,Wed Jul 01 18:49:53 +0000 2009,0,2424283044
4,Twitter Web Client,"3 Storms, 1 With Hurricane Potential, Near U.S. http://bit.ly/WmvUM",,False,Mon Aug 17 02:40:58 +0000 2009,0,3354596702
5,Twitter Web Client,The Lede: The Lede: Protesters Press on in Iran http://bit.ly/DZcfF,,False,Fri Aug 07 05:32:45 +0000 2009,0,3174678720
8,Twitter Web Client,The Man Who Sells America’s I.O.U.’s http://bit.ly/BXCyq,,False,Mon Aug 24 09:27:38 +0000 2009,0,3509695623
9,Twitter Web Client,U.S. Fighter Crashes in Afghanistan http://bit.ly/Fk5ek,,False,Sat Jul 18 04:16:51 +0000 2009,0,2701394355
7,Twitter Web Client,Cost of Decoding a Genome Is Lowered http://bit.ly/aObjV,,False,Mon Aug 10 20:23:19 +0000 2009,0,3231537614
15,Twitter Web Client,"Brain Power: After Injury, Fighting to Regain a Sense of Self http://bit.ly/o2EfM",,False,Sun Aug 09 02:23:37 +0000 2009,0,3201216761
10,Twitter Web Client,An Author Without Borders http://bit.ly/NVy4g,,False,Wed Jul 29 01:44:48 +0000 2009,0,2901334901
2,Twitter Web Client,Israelis Distrust Summer of Calm http://bit.ly/DrylJ,,False,Tue Aug 11 22:45:30 +0000 2009,0,3253750963
2,Twitter Web Client,Ex-Chief of A.I.G. Settles S.E.C. Case for $15 Million http://bit.ly/Dx01R,,False,Thu Aug 06 16:41:19 +0000 2009,0,3166606396
7,Twitter Web Client,"On the horizon: As he did with Iran, Rob Mackey will use the Lede blog to sort out the unrest in China. Stay tuned. http://bit.ly/3Sd95",,False,Tue Jul 07 11:32:14 +0000 2009,0,2512656200
14,Twitter Web Client,Gadgetwise: Marathon Tech Review http://bit.ly/syMbA,,False,Sat Aug 08 01:56:19 +0000 2009,0,3187120880
7,Twitter Web Client,U.S. Condemns Video of G.I. Taken by Taliban http://bit.ly/4rQVkr,,False,Sun Jul 19 15:21:35 +0000 2009,0,2722967289
4,Twitter Web Client,Pueblo Journal: New Energy Injects Hope in a Colorado Steel Town http://bit.ly/2mcidL,,False,Fri Jul 31 02:09:56 +0000 2009,0,2942991646
6,Twitter Web Client,"In Japan, Machines for Work and Play Are Idle http://bit.ly/DVLjP",,False,Mon Jul 13 00:53:40 +0000 2009,0,2606387874
3,Twitter Web Client,"Gates Says U.S. Army Will Grow by 22,000 http://bit.ly/vnhNy",,False,Tue Jul 21 00:51:25 +0000 2009,0,2748966623
9,Twitter Web Client,Submit home photos taken in 1969 when the Apollo 11 mission unfolded: http://bit.ly/ukFyA - They may end up here: http://bit.ly/hFpUb,,False,Thu Jul 16 20:56:53 +0000 2009,0,2676042903
3,Twitter Web Client,Napolitano Focuses on Immigration Enforcement http://bit.ly/d7cux,,False,Wed Aug 12 04:30:42 +0000 2009,0,3259534023
0,Twitter Web Client,The Caucus: Florida Governor Names Ally to Open Senate Seat http://bit.ly/3SxPja,,False,Fri Aug 28 17:24:25 +0000 2009,0,3606961286
5,Twitter Web Client,Hyundai Motor Reports Record Quarterly Profit http://bit.ly/OOBKg,,False,Thu Jul 23 07:30:47 +0000 2009,0,2794581637
5,Twitter Web Client,Sotomayor Leaves Passion Behind in Her Tesimony http://bit.ly/1aAmQw,,False,Wed Jul 15 02:09:49 +0000 2009,0,2643600170
5,Twitter Web Client,"Sidebar: In Two States, a Lower Bar for Conviction http://bit.ly/14GBDh",,False,Mon Jul 06 18:08:27 +0000 2009,0,2500559035
3,Twitter Web Client,City Room: Paterson Says Race Drives Criticism http://bit.ly/qRYf7,,False,Fri Aug 21 18:34:36 +0000 2009,0,3455365866
4,Twitter Web Client,"Abroad: In Dresden, High Culture and Ugly Reality Clash http://bit.ly/2wPuzo",,False,Sat Aug 15 01:31:23 +0000 2009,0,3320044531
4,Twitter Web Client,"In Spain, Bank Robberies Rise http://bit.ly/u6tSH",,False,Mon Jul 20 21:31:16 +0000 2009,0,2745902972
1,Twitter Web Client,South Korean Police Raid Worker-Occupied Factory http://bit.ly/13Ct27,,False,Tue Aug 04 21:06:45 +0000 2009,0,3131824072
3,Twitter Web Client,Phillies Acquire Lee From Indians http://bit.ly/2T95JJ,,False,Wed Jul 29 19:08:08 +0000 2009,0,2914921883
5,Twitter Web Client,The Caucus: Senators Spar Over Identity Politics and Sotomayor http://bit.ly/IQx0W,,False,Sun Jul 19 19:13:50 +0000 2009,0,2725906132
2,Twitter Web Client,Merkel’s Party Debates Strategy After Election Losses http://bit.ly/goMvE,,False,Mon Aug 31 10:38:16 +0000 2009,0,3663307164
6,Twitter Web Client,On our radar: N. Korea... Williams vs. Williams... Tour de France ... hot dogs,,False,Sat Jul 04 12:10:30 +0000 2009,0,2468459636
6,Twitter Web Client,Judge Orders Release of Young Detainee at Guantánamo http://bit.ly/xtYG7,,False,Thu Jul 30 20:55:30 +0000 2009,0,2937714944
10,Twitter Web Client,Henry Louis Gates Arrested http://bit.ly/16BQ5j,,False,Mon Jul 20 20:53:47 +0000 2009,0,2745306088
2,Twitter Web Client,The Caucus: Biden Says His Trip Proves Iraq Remains Priority http://bit.ly/iGEZG,,False,Sun Jul 05 15:43:37 +0000 2009,0,2483363896
3,Twitter Web Client,Libyan Convicted of Pan Am Bombing May Go Free http://bit.ly/UpBEp,,False,Thu Aug 20 00:54:04 +0000 2009,0,3417177476
2,Twitter Web Client,Ahmadinejad Inauguration Underway http://bit.ly/JkxAN,,False,Wed Aug 05 05:20:32 +0000 2009,0,3140058118
8,Twitter Web Client,"France’s Stimulus Projects, Unlike in U.S., Were ‘Shovel Ready’ http://bit.ly/cLLCL",,False,Mon Jul 06 19:00:26 +0000 2009,0,2501292198
4,Twitter Web Client,Thursday Styles and @nytimesvisual today bring you model India Hicks and her picks for island-inspired home accessories: http://bit.ly/FqoBq,,False,Thu Aug 20 15:17:49 +0000 2009,0,3429182034
3,Twitter Web Client,Iran Arrests 3 Americans Hiking in Kurdish Region http://bit.ly/MBy8F,,False,Sat Aug 01 17:09:17 +0000 2009,0,3072532312
7,Twitter Web Client,Music: Country Music Fills White House Bill http://bit.ly/XJtTL,,False,Wed Jul 22 02:53:17 +0000 2009,0,2770667672
5,Twitter Web Client,Britain’s ‘Great Train Robber’ Released http://bit.ly/6SZmY,,False,Thu Aug 06 23:38:54 +0000 2009,0,3171059547
7,Twitter Web Client,Tiger Journal: A Georgia County Shares a Tale of One Man’s Life and Death http://bit.ly/xtnVv,,False,Sun Aug 23 07:18:47 +0000 2009,0,3488256443
8,Twitter Web Client,Room for Debate: What Happened to a Public Health Plan? http://bit.ly/CwUno,,False,Mon Aug 10 23:58:48 +0000 2009,0,3235124765
3,Twitter Web Client,Lens: Full Circle in Afghanistan http://bit.ly/1TqCr3,,False,Tue Aug 11 11:28:23 +0000 2009,0,3243852146
4,Twitter Web Client,Transportation Secretary Reassures Dealers on Clunker Rebates http://bit.ly/OC9Lm,,False,Wed Aug 19 21:18:32 +0000 2009,0,3413311307
4,Twitter Web Client,Also updating: Obama in Russia. Earlier today he met with Putin and Gorbachev and stumbled a bit over Putin's title. http://bit.ly/12whgV,,False,Tue Jul 07 11:09:50 +0000 2009,0,2512480887
4,Twitter Web Client,Chinese Question Police Absence in Ethnic Riots http://bit.ly/P33l5,,False,Sat Jul 18 03:28:45 +0000 2009,0,2700762550
2,Twitter Web Client,Fate of Lockerbie Bomber to Be Decided Soon http://bit.ly/3o5oNp,,False,Thu Aug 13 08:40:15 +0000 2009,0,3283140054
10,Twitter Web Client,"NYT NEWS ALERT: Edward M. Kennedy, Senate Stalwart, Dies at 77",,False,Wed Aug 26 05:28:02 +0000 2009,0,3550964368
4,Twitter Web Client,Coming soon: Another uptick expected in the unemployment rate. Monthly report comes at 8:30,,False,Thu Jul 02 11:34:20 +0000 2009,0,2435641626
15,Twitter Web Client,Arrest Over Software Illuminates Wall St. Secret http://bit.ly/yhU1v,,False,Mon Aug 24 04:40:44 +0000 2009,0,3506631235
6,Twitter Web Client,China Bans Mosque Prayers Amid Strife http://bit.ly/3MSDhX,,False,Fri Jul 10 08:44:56 +0000 2009,0,2565471405
18,Twitter Web Client,C.I.A. Had Plan to Assassinate Qaeda Leaders http://bit.ly/9Re9O,,False,Tue Jul 14 00:35:31 +0000 2009,0,2623607310
5,Twitter Web Client,Governor Backs Naming Successor to Kennedy http://bit.ly/4jXSEk,,False,Mon Aug 31 20:43:44 +0000 2009,0,3673224725
4,Twitter Web Client,Strike Said to Kill Taliban Chief’s Wife http://bit.ly/1Tvda,,False,Wed Aug 05 11:03:46 +0000 2009,0,3143451654
2,Twitter Web Client,NYT NEWS ALERT: Senate Rejects Amendment Sought by Gun Rights Supporters,,False,Wed Jul 22 16:50:05 +0000 2009,0,2780860313
5,Twitter Web Client,Our Towns: When NASA Defined Long Island http://bit.ly/1btfDo,,False,Mon Jul 20 10:03:43 +0000 2009,0,2736512515
2,Twitter Web Client,Coordinated Attacks in Afghanistan Kill 6 http://bit.ly/7kcqw,,False,Tue Jul 21 10:04:35 +0000 2009,0,2755633910
12,Twitter Web Client,New Doubts Raised Over Famous War Photo http://bit.ly/U1ZXp,,False,Mon Aug 17 22:00:21 +0000 2009,0,3369859760
3,Twitter Web Client,Myanmar Forces Overwhelm Rebels http://bit.ly/4w62D,,False,Sun Aug 30 20:09:54 +0000 2009,0,3651048247
11,Twitter Web Client,"ArtsBeat: In Sister’s Book and Father’s Scrawl, New Mozart http://bit.ly/mInkq",,False,Sun Aug 02 10:50:19 +0000 2009,0,3085134912
9,Twitter Web Client,Radio: That Casey Kasem Show Was More Than Just Reaching for Stars http://bit.ly/DgtjJ,,False,Wed Jul 08 07:02:30 +0000 2009,0,2529051499
1,Twitter Web Client,Court Ruling Clears Path for G.M. to Restructure http://bit.ly/DNU0k,,False,Mon Jul 06 04:46:15 +0000 2009,0,2492534211
14,Twitter Web Client,Cyberattacks Hit U.S. and South Korean Web Sites http://bit.ly/YRSUA,,False,Wed Jul 08 11:48:13 +0000 2009,0,2531147676
8,Twitter Web Client,"Bernanke Sees High Jobless Rate, Even in Recovery http://bit.ly/17n36D",,False,Mon Jul 27 00:36:03 +0000 2009,0,2861444622
25,Twitter Web Client,Bits: Using Twitter as a Collective Mood Ring http://bit.ly/9dwPW,,False,Tue Aug 11 13:55:10 +0000 2009,0,3245544717
16,Twitter Web Client,Patient Money: The Expense of Eating With Celiac Disease http://bit.ly/38PpX,,False,Sat Aug 15 14:42:34 +0000 2009,0,3328770159
6,Twitter Web Client,The Caucus: Inquiry of Gov. Richardson Dropped http://bit.ly/3ri1t,,False,Thu Aug 27 20:35:15 +0000 2009,0,3587144134
2,Twitter Web Client,Straight Sets: Murray Storms Past Ferrero Into Semifinals http://bit.ly/3X7rEM,,False,Wed Jul 01 18:49:52 +0000 2009,0,2424282791
4,Twitter Web Client,Obama to Nominate Bernanke for Second Term http://bit.ly/4oawfT,,False,Tue Aug 25 01:36:30 +0000 2009,0,3525369633
1,Twitter Web Client,California Senate Passes Budget Plan http://bit.ly/2Lvwto,,False,Fri Jul 24 15:17:32 +0000 2009,0,2819978936
3,Twitter Web Client,Tsunami Warning After Asian Quake http://bit.ly/tkbXf,,False,Mon Aug 10 21:05:56 +0000 2009,0,3232274350
6,Twitter Web Client,Are Manufacturers Also Too Big to Fail? http://bit.ly/sdBQo,,False,Mon Jul 20 22:53:04 +0000 2009,0,2747191393
11,Twitter Web Client,Movie Review | 'Harry Potter and the Half-Blood Prince': Return to Hogwarts http://bit.ly/F4Bxv,,False,Tue Jul 14 18:56:47 +0000 2009,0,2636908638
2,Twitter Web Client,Police Search Home of Jackson’s Doctor http://bit.ly/482oi,,False,Tue Jul 28 19:45:25 +0000 2009,0,2895765716
2,Twitter Web Client,Deal Reached on California’s Budget http://bit.ly/vHCU0,,False,Tue Jul 21 02:18:19 +0000 2009,0,2750307796
3,Twitter Web Client,Ex-Honduran President Tries to Return as Clashes Erupt http://bit.ly/rX1Kh,,False,Sun Jul 05 22:53:51 +0000 2009,0,2488335146
3,Twitter Web Client,Biden Warns of More ‘Sacrifice’ in Afghanistan http://bit.ly/GttaW,,False,Thu Jul 23 09:10:50 +0000 2009,0,2795445940
3,Twitter Web Client,Drivers Scramble for Deals as ‘Cash for Clunkers’ Winds Down http://bit.ly/10A9tf,,False,Sun Aug 23 00:41:41 +0000 2009,0,3482382615
8,Twitter Web Client,"Women at Arms: Living and Fighting Alongside Men, and Fitting In http://bit.ly/136MnF",,False,Mon Aug 17 05:11:35 +0000 2009,0,3356758554
7,Twitter Web Client,A Peek Inside Iran Shows Protests Fading Under Withering Gaze http://bit.ly/5h4yq,,False,Wed Jul 08 22:00:05 +0000 2009,0,2539687827
10,Twitter Web Client,2 Shot Dead at Gay Center in Tel Aviv http://bit.ly/np8I5,,False,Sun Aug 02 05:26:42 +0000 2009,0,3082417764
12,Twitter Web Client,Ex-Nazi Officer Gets Life Sentence http://bit.ly/UPKOe,,False,Tue Aug 11 11:28:23 +0000 2009,0,3243852084
2,Twitter Web Client,Clinton Urges Flexibility in U.S.-India Relations http://bit.ly/6Z44e,,False,Mon Jul 20 09:17:31 +0000 2009,0,2736169514
4,Twitter Web Client,New Leader Tries to Get Toyota Back on the Road http://bit.ly/qT0aq,,False,Tue Aug 04 04:37:55 +0000 2009,0,3118667072
2,Twitter Web Client,U.S. Marines Launch Assault in Afghanistan http://bit.ly/2SEsD5,,False,Wed Jul 01 22:29:21 +0000 2009,0,2427334234
3,Twitter Web Client,"Back to Business: In Appraisal Shift, Lenders Gain Power and Critics http://bit.ly/YTaen",,False,Wed Aug 19 02:34:44 +0000 2009,0,3396940664
0,Twitter Web Client,"For Obama Visit, Russia Mutes TV Ranting at U.S. http://bit.ly/MOtnY",,False,Mon Jul 06 01:08:39 +0000 2009,0,2489896271
13,Twitter Web Client,This @nytimesvideo features interviews with young women in Japan drawn to the glamour of working as hostesses. Watch: http://bit.ly/13mGmp,,False,Tue Jul 28 21:04:52 +0000 2009,0,2897062370
5,Twitter Web Client,City Room: Bloomberg Calls for Free Crosstown Buses http://bit.ly/3taTIs,,False,Mon Aug 03 17:34:53 +0000 2009,0,3107877268
6,Twitter Web Client,Jackson’s Mother to Raise Children http://bit.ly/jt41J,,False,Thu Jul 30 20:04:52 +0000 2009,0,2936817799
3,Twitter Web Client,On the horizon: Paul McCartney at Citi Field. Jon Pareles will review on @artsbeat,,False,Fri Jul 17 22:17:50 +0000 2009,0,2696472345
2,Twitter Web Client,China Warms to New Credo: Business First http://bit.ly/3TBs8C,,False,Fri Aug 14 01:48:25 +0000 2009,0,3298816016
9,Twitter Web Client,War Without Borders: Mexico’s Drug Traffickers Continue Trade in Prison http://bit.ly/CDryf,,False,Tue Aug 11 01:27:36 +0000 2009,0,3236690926
8,Twitter Web Client,The Long Not Summer: A Calendar Quirk Stretches the Season http://bit.ly/5OxGX,,False,Mon Aug 31 10:38:15 +0000 2009,0,3663307067
2,Twitter Web Client,"On the Fairway, New Lessons in Saving Water http://bit.ly/MyWzu",,False,Thu Aug 06 01:13:17 +0000 2009,0,3157178904
4,Twitter Web Client,City Room: Complaint Box | No More Cheeks to Turn http://bit.ly/K1li3,,False,Sun Aug 09 04:21:47 +0000 2009,0,3202548541
5,Twitter Web Client,"In Mexico, a Soccer Stadium Where Visitors Gasp http://bit.ly/1273MJ",,False,Tue Aug 11 10:12:48 +0000 2009,0,3243231168
6,Twitter Web Client,Global Stocks Build on U.S. Data http://bit.ly/FNDbo,,False,Mon Aug 24 13:48:59 +0000 2009,0,3512688528
5,Twitter Web Client,"Straight Sets: Haas, Flash From the Past, Upsets Djokovic http://bit.ly/E3yWW",,False,Wed Jul 01 16:28:48 +0000 2009,0,2422292747
6,Twitter Web Client,City Room: A Name Only a Lawyer Could Love http://bit.ly/1bwGD9,,False,Wed Jul 29 18:16:54 +0000 2009,0,2914067882
3,Twitter Web Client,"Eunice Kennedy Shriver, Founder of Special Olympics, Dies at 88 http://bit.ly/19mE8L",,False,Tue Aug 11 10:40:48 +0000 2009,0,3243447620
9,Twitter Web Client,Movie Review | 'Julie & Julia': Two for the Stove http://bit.ly/11pcN5,,False,Thu Aug 06 17:49:25 +0000 2009,0,3167137866
11,Twitter Web Client,"Why Short Al, Talkative Fan, Calls No More http://bit.ly/zVFI0",,False,Sat Jul 04 18:49:48 +0000 2009,0,2472549495
6,Twitter Web Client,Generations of Skaters Gather to Pay Tribute to a Legend of the City http://bit.ly/10nd02,,False,Mon Aug 17 01:43:38 +0000 2009,0,3353655788
6,Twitter Web Client,Organized Crime in Pakistan Feeds Taliban http://bit.ly/3gYko,,False,Sat Aug 29 01:43:24 +0000 2009,0,3616476683
4,Twitter Web Client,Mexico Puts New Officers on the Job at Customs http://bit.ly/qj3sN,,False,Mon Aug 17 01:01:30 +0000 2009,0,3352996683
6,Twitter Web Client,"Robert Novak, Conservative Columnist, Is Dead at 78 http://bit.ly/hIefs",,False,Tue Aug 18 16:37:16 +0000 2009,0,3385531332
0,Twitter Web Client,"Yankees 8, White Sox 5: Cabrera Hits for Cycle to Help Yanks http://bit.ly/4gEcNv",,False,Sun Aug 02 22:49:25 +0000 2009,0,3093604553
11,Twitter Web Client,Japan Prepares for a Change http://bit.ly/kHYXj,,False,Sat Aug 29 23:15:53 +0000 2009,0,3634204815
