favorite_count,source,text,in_reply_to_screen_name,is_retweet,created_at,retweet_count,id_str
2,Twitter Web Client,Claiming a Loaded Phrase http://bit.ly/3416X9,,False,Fri Aug 07 22:39:52 +0000 2009,0,3184670154
17,Twitter Web Client,"Photo slide show of  Walter Cronkite: ""The Most Trusted Man in America""  http://bit.ly/199jwW",,False,Sat Jul 18 02:48:21 +0000 2009,0,2700217750
11,Twitter Web Client,"We asked, ""What impact did Sen. Kennedy have on the Democratic Party & politics?"" Now, here are your responses: http://bit.ly/v26fD #nytkenn",,False,Wed Aug 26 21:20:06 +0000 2009,0,3564836004
5,Twitter Web Client,June Is Another Weak Month for U.S. Retail Sales http://bit.ly/10kRDS,,False,Thu Jul 09 14:27:18 +0000 2009,0,2550784400
1,Twitter Web Client,2 Aid Workers Killed in Chechnya http://bit.ly/pBO7a,,False,Tue Aug 11 09:08:16 +0000 2009,0,3242731034
5,Twitter Web Client,French Jet Did Not Break Up in Flight http://bit.ly/2wsbL,,False,Thu Jul 02 14:11:19 +0000 2009,0,2437301533
15,Twitter Web Client,Low-Calorie Diet May Extend Life in Primates http://bit.ly/12IWfw,,False,Thu Jul 09 20:26:26 +0000 2009,0,2556135478
4,Twitter Web Client,Senate Support Grows for Extending Auto Rebates http://bit.ly/i48cr,,False,Tue Aug 04 00:42:05 +0000 2009,0,3114824582
4,Twitter Web Client,In Turkey to Catch the Wind http://bit.ly/9Y74H,,False,Wed Aug 19 05:10:37 +0000 2009,0,3399561946
15,Twitter Web Client,Site Wins Fashion Fans by Letting Them Design http://bit.ly/3hHwnU,,False,Mon Jul 27 02:39:55 +0000 2009,0,2863274569
16,Twitter Web Client,Democrats Say C.I.A. Deceived Congress for Years http://bit.ly/CfEVH,,False,Thu Jul 09 04:28:25 +0000 2009,0,2545143325
4,Twitter Web Client,Hundreds Feared Dead in Taiwan After Typhoon http://bit.ly/5Pt1s,,False,Tue Aug 11 07:25:52 +0000 2009,0,3241880155
17,Twitter Web Client,Memorable video of Walter Cronkite http://bit.ly/1h0FA,,False,Sat Jul 18 02:43:37 +0000 2009,0,2700153641
8,Twitter Web Client,Swine Flu Rattles Nerves as It Spreads in India http://bit.ly/2NWqQz,,False,Thu Aug 13 02:58:44 +0000 2009,0,3278799857
2,Twitter Web Client,Indonesian President Is Re-elected http://bit.ly/MQ6Zr,,False,Wed Jul 08 13:17:19 +0000 2009,0,2532033401
5,Twitter Web Client,"NYT NEWS ALERT: Eunice Kennedy Shriver, Founder of Special Olympics, Is Dead at 88",,False,Tue Aug 11 10:14:01 +0000 2009,0,3243240530
8,Twitter Web Client,Volatile Mix at Meetings on Health Care Plans http://bit.ly/2B1Pr,,False,Sat Aug 08 02:54:22 +0000 2009,0,3187869763
3,Twitter Web Client,News Analysis: Why Ghana? Few Choices for Obama http://bit.ly/423db,,False,Sat Jul 11 02:02:03 +0000 2009,0,2577603880
1,Twitter Web Client,Republicans See Opportunity in Races for Governor http://bit.ly/13Y3aw,,False,Tue Jul 21 13:47:32 +0000 2009,0,2757955307
7,Twitter Web Client,Obama Renews Health Care Push http://bit.ly/FRuCQ,,False,Tue Jul 21 18:18:16 +0000 2009,0,2762231990
6,Twitter Web Client,White House Adapts to New Playbook in Health Care Debate http://bit.ly/4All6,,False,Tue Aug 11 02:46:44 +0000 2009,0,3238101604
3,Twitter Web Client,Long Island Man Charged in Attack on U.S. Base in Afghanistan http://bit.ly/Z9eTE,,False,Wed Jul 22 19:38:55 +0000 2009,0,2783727965
0,Twitter Web Client,Orders for Durable Goods Fall Sharply http://bit.ly/GA8m3,,False,Wed Jul 29 16:18:32 +0000 2009,0,2912050151
4,Twitter Web Client,City Spends to Aid Minority Firms but Falls Short http://bit.ly/PPhUF,,False,Thu Jul 30 03:12:02 +0000 2009,0,2923027159
2,Twitter Web Client,Tribune Sells Cubs to Ricketts Family http://bit.ly/1639UQ,,False,Fri Aug 21 21:47:24 +0000 2009,0,3459141112
10,Twitter Web Client,Sotomayor Sworn In as Supreme Court Justice http://bit.ly/D1Obf,,False,Sat Aug 08 15:31:20 +0000 2009,0,3194022710
2,Twitter Web Client,G.M. Completes Its Turnaround in Bankruptcy http://bit.ly/1J731,,False,Fri Jul 10 11:05:21 +0000 2009,0,2566514841
6,Twitter Web Client,DealBook: Cablevision Will Spin Off Madison Square Garden http://bit.ly/26tG7b,,False,Thu Jul 30 14:24:10 +0000 2009,0,2930774232
5,Twitter Web Client,Google’s Profit Surges as Advertising Stabilizes http://bit.ly/hWu9H,,False,Thu Jul 16 21:07:06 +0000 2009,0,2676203109
9,Twitter Web Client,Judge Ends Monitor of the Los Angeles Police http://bit.ly/ZIfUM,,False,Sat Jul 18 05:40:33 +0000 2009,0,2702391465
5,Twitter Web Client,Outbreak of Fungus Threatens Tomato Crop http://bit.ly/WsPQp,,False,Fri Jul 17 17:34:58 +0000 2009,0,2692003856
2,Twitter Web Client,"Ellie Greenwich, Pop Songwriter, Dies at 68 http://bit.ly/12zcZ7",,False,Thu Aug 27 13:35:31 +0000 2009,0,3579109136
4,Twitter Web Client,Biden Suggests U.S. Not Standing in Israel’s Way on Iran http://bit.ly/1KPeAJ,,False,Sun Jul 05 17:27:31 +0000 2009,0,2484518921
2,Twitter Web Client,"Homeland Chief Offer Shift in Tone, but Few Details http://bit.ly/oAJZO",,False,Wed Jul 29 16:18:31 +0000 2009,0,2912049802
2,Twitter Web Client,"Iraqi Shiite Leaders Create Alliance, Minus Maliki http://bit.ly/H5z8K",,False,Mon Aug 24 19:10:33 +0000 2009,0,3518399168
3,Twitter Web Client,On our radar: Big day (evening actually) for Obama; prime time news conference on health. Will he take a hard line? http://bit.ly/14B2WN,,False,Wed Jul 22 10:59:17 +0000 2009,0,2776042804
4,Twitter Web Client,Mauritanians See Chance to Break Cycle of Coups http://bit.ly/1yeKm,,False,Sat Jul 18 03:38:19 +0000 2009,0,2700889181
6,Twitter Web Client,Obama Lashes Defense Establishment and Congress http://bit.ly/2aJnM,,False,Mon Aug 17 18:57:12 +0000 2009,0,3366623504
6,Twitter Web Client,The Caucus: Obamas Arrive at the Vineyard http://bit.ly/ANCyO,,False,Sun Aug 23 21:38:47 +0000 2009,0,3499184179
7,Twitter Web Client,Obama Says Insurers Are Trying to Block Change http://bit.ly/14euK9,,False,Sat Aug 15 01:40:40 +0000 2009,0,3320196389
7,Twitter Web Client,North Korea Asserts New Willingness to Talk http://bit.ly/sANVP,,False,Mon Jul 27 03:51:01 +0000 2009,0,2864356600
1,Twitter Web Client,Clinton Praises Angola’s Progress http://bit.ly/zNm6c,,False,Sun Aug 09 16:10:30 +0000 2009,0,3209340371
3,Twitter Web Client,"Watching closely: Friday prayers in Tehran, with Rafsanjani and Moussavi. @thelede has the latest updates. http://bit.ly/70F3Q",,False,Fri Jul 17 10:58:56 +0000 2009,0,2686546232
4,Twitter Web Client,"Iraqis Take the Lead, With U.S. Close By http://bit.ly/njKHX",,False,Sun Aug 09 01:37:29 +0000 2009,0,3200703219
1,Twitter Web Client,DealBook: Live Blog: Paulson on Capitol Hill http://bit.ly/jTdiz,,False,Thu Jul 16 14:30:55 +0000 2009,0,2670274128
10,Twitter Web Client,"Theater: In London, Stagings Where 3 Dimensions Aren’t Needed http://bit.ly/az4qM",,False,Sat Jul 04 05:11:04 +0000 2009,0,2465588174
6,Twitter Web Client,Online Scammers Prey on the Jobless http://bit.ly/iw4e8,,False,Wed Aug 05 20:16:23 +0000 2009,0,3152059823
4,Twitter Web Client,"Bloomberg, Too, Lost on Stocks Last Year http://bit.ly/14am3x",,False,Sat Jul 11 11:14:18 +0000 2009,0,2582595213
9,Twitter Web Client,New York Seeks to Consolidate Its Garment District http://bit.ly/3PIWB,,False,Wed Aug 19 18:38:30 +0000 2009,0,3410360449
11,Twitter Web Client,Report Says Wiretaps Got Too Little Legal Review http://bit.ly/sujVl,,False,Fri Jul 10 19:54:41 +0000 2009,0,2572793304
2,Twitter Web Client,The Lede: Clinton Said to Meet With Journalists http://bit.ly/6Dht2,,False,Tue Aug 04 18:58:24 +0000 2009,0,3129583071
4,Twitter Web Client,The Caucus: House Chairman Sees Health Care ‘Breakthrough’ http://bit.ly/KULXI,,False,Fri Jul 24 18:10:08 +0000 2009,0,2822984171
9,Twitter Web Client,A U.S.  army captain writes in 1st post for @nytimesAtWar about differing views of war when friends are in the field. http://bit.ly/1aSAYR,,False,Tue Aug 25 20:13:10 +0000 2009,0,3541866615
3,Twitter Web Client,Recession Shadowing Chicago Bid for Games http://bit.ly/JiGJu,,False,Mon Jul 27 02:49:51 +0000 2009,0,2863426044
7,Twitter Web Client,Debate in Germany: Research or Manufacturing? http://bit.ly/1bzrn6,,False,Wed Aug 12 02:58:36 +0000 2009,0,3258025387
7,Twitter Web Client,Murder Highlights Russian System’s Flaws http://bit.ly/12Utoy,,False,Sun Jul 12 19:11:58 +0000 2009,0,2602144159
8,Twitter Web Client,Swine Flu Vaccine Priorities Outlined http://bit.ly/1e1ZVR,,False,Wed Jul 29 22:02:50 +0000 2009,0,2917820400
6,Twitter Web Client,"Karl Malden, Everyman Actor, Dies at 97 http://bit.ly/18ZMS4",,False,Wed Jul 01 20:33:02 +0000 2009,0,2425712144
5,Twitter Web Client,Obama Lashes Defense Establishment and Congress http://bit.ly/VgqP6,,False,Mon Aug 17 19:50:54 +0000 2009,0,3367543132
3,Twitter Web Client,N. Korea Says It’s Open to Dialogue on Its Weapons http://bit.ly/YHU9t,,False,Mon Jul 27 04:35:19 +0000 2009,0,2864985995
4,Twitter Web Client,U.S. Adviser’s Blunt Memo on Iraq: Time ‘to Go Home’ http://bit.ly/12F8sI,,False,Thu Jul 30 14:42:48 +0000 2009,0,2931081449
4,Twitter Web Client,"Amazon Is Buying Zappos, an Online Shoe Seller http://bit.ly/EdLJF",,False,Wed Jul 22 23:22:28 +0000 2009,0,2787595184
8,Twitter Web Client,Lockerbie Convict Welcomed Home http://bit.ly/3KCy48,,False,Fri Aug 21 08:01:00 +0000 2009,0,3445954249
2,Twitter Web Client,Magazine Preview: Karzai in His Labyrinth http://bit.ly/VV3ek,,False,Wed Aug 05 20:05:12 +0000 2009,0,3151863539
5,Twitter Web Client,Debate Intensifies Over U.S. Deportation Policy http://bit.ly/11tI5H,,False,Sat Jul 25 23:18:48 +0000 2009,0,2844516780
6,Twitter Web Client,McNair’s Death Declared a Homicide http://bit.ly/7pvkh,,False,Sun Jul 05 21:09:51 +0000 2009,0,2487115259
7,Twitter Web Client,Diner's Journal: The Times Names Restaurant Critic http://bit.ly/zTBUP,,False,Wed Aug 05 16:55:34 +0000 2009,0,3148508806
1,Twitter Web Client,City Room: Complaint Box | Rule Breakers at the Pool http://bit.ly/17rA0y,,False,Sat Aug 01 06:14:32 +0000 2009,0,3066302156
2,Twitter Web Client,Late-Fee Profits May Trump Plan to Modify Loans http://bit.ly/2Y8NHu,,False,Thu Jul 30 01:51:15 +0000 2009,0,2921590449
2,Twitter Web Client,Pakistani Taliban Confirm That Leader Is Dead http://bit.ly/Rw9EM,,False,Tue Aug 25 19:43:34 +0000 2009,0,3541331805
5,Twitter Web Client,Clinton Presses Congo on Sexual Violence http://bit.ly/1bP9NI,,False,Mon Aug 10 16:37:27 +0000 2009,0,3227729459
6,Twitter Web Client,"With Demise of Jewish Burial Societies, Resting Places Are in Turmoil http://bit.ly/Syxji",,False,Mon Aug 03 10:04:24 +0000 2009,0,3101985202
1,Twitter Web Client,Armstrong Surge Comes in Early Tour Surprise http://bit.ly/19orsV,,False,Mon Jul 06 21:02:19 +0000 2009,0,2503006090
6,Twitter Web Client,Hate Engulfs Christians in Pakistan http://bit.ly/UJqMr,,False,Mon Aug 03 12:06:12 +0000 2009,0,3103042058
7,Twitter Web Client,The Lede: Nepal Hails ‘Goddess’ From ‘Absolutely Fabulous’ http://bit.ly/iLEdJ,,False,Mon Jul 27 17:03:54 +0000 2009,0,2873435881
1,Twitter Web Client,"Reconsecration, With Bells, Saffron and Elephant http://bit.ly/10FZ5n",,False,Tue Jul 14 07:09:41 +0000 2009,0,2628771393
1,Twitter Web Client,Strike Kills Relatives of Taliban Chief http://bit.ly/Wdfrt,,False,Wed Aug 05 10:46:58 +0000 2009,0,3143308623
3,Twitter Web Client,Musharraf’s ’07 Actions Ruled Illegal http://bit.ly/5JfHz,,False,Fri Jul 31 16:19:40 +0000 2009,0,2953724951
12,Twitter Web Client,"In New York City, Fewer Murders on Rainy Days http://bit.ly/uHkjc",,False,Thu Jul 02 17:13:45 +0000 2009,0,2439923640
8,Twitter Web Client,"Sotomayor Confirmed by Senate, 68-31 http://bit.ly/Qjglf",,False,Thu Aug 06 19:24:54 +0000 2009,0,3168133112
2,Twitter Web Client,Sergeant Who Arrested Professor Defends Actions http://bit.ly/HubJB,,False,Fri Jul 24 02:04:51 +0000 2009,0,2810374347
5,Twitter Web Client,Turkey and Armenia to Establish Diplomatic Ties http://bit.ly/lICDa,,False,Mon Aug 31 20:43:44 +0000 2009,0,3673224597
3,Twitter Web Client,We want to know: What impact did Senator Ted M. Kennedy have on the Democratic party and politics? Hash tag your response: #nytkenn,,False,Wed Aug 26 13:17:15 +0000 2009,0,3555938081
0,Twitter Web Client,Albany Republicans Seek to Block Paterson’s Nominee http://bit.ly/P8q4X,,False,Thu Jul 09 13:30:04 +0000 2009,0,2550040832
14,Twitter Web Client,Well: A Day in the Life of a Family Doctor http://bit.ly/PyI1y,,False,Mon Aug 10 20:10:53 +0000 2009,0,3231309674
4,Twitter Web Client,Judge Rules for J.D. Salinger in ‘Catcher’ Copyright Suit http://bit.ly/WVS6A,,False,Wed Jul 01 23:58:00 +0000 2009,0,2428520015
16,Twitter Web Client,They’re Old Enough to Text. Now What? http://bit.ly/ELtZW,,False,Wed Aug 26 19:34:19 +0000 2009,0,3562795459
5,Twitter Web Client,Government Might Allow Trial in U.S. for Detainee http://bit.ly/ph6SQ,,False,Sat Jul 25 01:16:51 +0000 2009,0,2829712220
4,Twitter Web Client,Sotomayor Casts First Vote on Court http://bit.ly/2zi3DW,,False,Wed Aug 19 00:31:41 +0000 2009,0,3394514377
7,Twitter Web Client,"Suicide's Rising Toll: After Combat, Victims of an Inner War http://bit.ly/ugFn9",,False,Sat Aug 01 21:26:48 +0000 2009,0,3076065191
6,Twitter Web Client,Retailer Knockoffs Abound in India http://bit.ly/399tTo,,False,Thu Jul 16 04:28:21 +0000 2009,0,2664260601
4,Twitter Web Client,Former Leader Says Iran Trial a Sham http://bit.ly/favE9,,False,Sun Aug 02 09:05:07 +0000 2009,0,3084410263
1,Twitter Web Client,U.S.-Afghan Relations Strained Over Election http://bit.ly/zsJ4g,,False,Fri Aug 28 20:37:46 +0000 2009,0,3610784784
11,Twitter Web Client,"For Firstborns, Secondhand Fits the Bill http://bit.ly/rFXXx",,False,Thu Jul 09 09:55:37 +0000 2009,0,2548154719
4,Twitter Web Client,U.S. Raises Estimate for 10-Year Deficit to $9 Trillion http://bit.ly/2rMqU5,,False,Tue Aug 25 13:42:59 +0000 2009,0,3534782225
4,Twitter Web Client,Suitmaker to Princes Adapts to Crisis http://bit.ly/yJ4LT,,False,Mon Aug 10 21:20:17 +0000 2009,0,3232514692
4,Twitter Web Client,Increase Seen in Mental Health Diagnoses in Veterans http://bit.ly/3NsKFO,,False,Thu Jul 16 20:57:17 +0000 2009,0,2676049025
8,Twitter Web Client,Toyota Falling Behind Rivals in Race to Go Electric http://bit.ly/1FRGZ,,False,Thu Aug 20 02:47:24 +0000 2009,0,3419360869
4,Twitter Web Client,Police and Militants Clash in Nigeria http://bit.ly/16slfA,,False,Mon Jul 27 21:24:33 +0000 2009,0,2877739270
6,Twitter Web Client,"During Crisis, Paulson’s Calls to Goldman Posed Ethics Test http://bit.ly/K14Ef",,False,Sat Aug 08 18:43:56 +0000 2009,0,3196194219
14,Twitter Web Client,"Architecture: As Heroes Disappear, the City Needs More http://bit.ly/103uXb",,False,Mon Aug 24 08:28:21 +0000 2009,0,3509165144
22,Twitter Web Client,Bits: Tweeting for Dollars http://bit.ly/fL0gU,,False,Mon Aug 10 12:27:48 +0000 2009,0,3224116063
5,Twitter Web Client,"NYT NEWS ALERT: Corazon Aquino, Former President of the Phillippines, Is Dead, AP Reports",,False,Fri Jul 31 21:36:02 +0000 2009,0,3058754469
3,Twitter Web Client,Ex-Boxing Champ Killed in Georgia http://bit.ly/2bMLEk,,False,Sun Jul 26 16:07:13 +0000 2009,0,2854616903
9,Twitter Web Client,Summer Rituals | Sleep-Away Camp: A Century of Character-Building and Games http://bit.ly/18EesQ,,False,Sun Jul 26 02:19:32 +0000 2009,0,2846777808
8,Twitter Web Client,ArtsBeat: Secrets of the TKTS Booth http://bit.ly/vWhJY,,False,Wed Jul 29 14:18:54 +0000 2009,0,2910092976
6,Twitter Web Client,News Analysis: Obama Faces a New Push to Look Back http://bit.ly/yHixk,,False,Mon Jul 13 01:51:12 +0000 2009,0,2607127561
4,Twitter Web Client,Search Firms Offer Big Pitches and Big Fees but Few Jobs http://bit.ly/t6SsL,,False,Mon Aug 17 02:40:59 +0000 2009,0,3354596602
2,Twitter Web Client,City Room: Council Approves Deal to Upgrade Coney Island http://bit.ly/sUeWw,,False,Wed Jul 29 21:51:34 +0000 2009,0,2917637076
3,Twitter Web Client,Also watching the standoff with Honduras. OAS issues ultimatum; Zelaya vows to return Thursday. http://bit.ly/aN5Aj,,False,Wed Jul 01 11:39:55 +0000 2009,0,2418833458
2,Twitter Web Client,Also watching: Obama heads to Indiana to talk economy. But jobless numbers on Friday may overtake message. http://bit.ly/jZ0Kc,,False,Wed Aug 05 11:39:41 +0000 2009,0,3143773684
10,Twitter Web Client,Celebrating the Sounds of Appalachian Strings http://bit.ly/10JXmI,,False,Fri Jul 03 10:40:40 +0000 2009,0,2452227737
1,Twitter Web Client,"Newly Empowered, Kurdish Leader Asserts Agenda http://bit.ly/ZSVvU",,False,Tue Jul 28 20:35:34 +0000 2009,0,2896583600
8,Twitter Web Client,"For City’s Poor, Banks Are Still a Matter of Distrust http://bit.ly/2rPWw7",,False,Mon Aug 17 16:48:34 +0000 2009,0,3364437822
10,Twitter Web Client,"Invisible Immigrants, Old and Left With ‘Nobody to Talk To’ http://bit.ly/jKs9x",,False,Mon Aug 31 02:02:02 +0000 2009,0,3657116126
9,Twitter Web Client,"Out of Search Business, Yahoo Shifts Its Focus http://bit.ly/f6UT3",,False,Mon Aug 03 14:43:40 +0000 2009,0,3105067367
3,Twitter Web Client,Judge Finds Racial Bias in Recruiting by Fire Dept. http://bit.ly/A5CXc,,False,Thu Jul 23 02:55:57 +0000 2009,0,2791003503
7,Twitter Web Client,Iranian President Fires Cabinet Ministers http://bit.ly/gmSQF,,False,Sun Jul 26 18:45:20 +0000 2009,0,2856644821
3,Twitter Web Client,Lens: On the Razor’s Edge http://bit.ly/BUsDw,,False,Wed Aug 12 09:43:31 +0000 2009,0,3262813455
5,Twitter Web Client,Spain Is Open to Bolstering Forces in Afghanistan http://bit.ly/m2kyn,,False,Thu Jul 30 00:58:17 +0000 2009,0,2920677669
5,Twitter Web Client,"In Azerbaijan, a Donkey Suit Provokes Laughs and, Possibly, Arrests http://bit.ly/lv8Bt",,False,Wed Jul 15 05:37:09 +0000 2009,0,2646526968
1,Twitter Web Client,Myanmar Dissident’s Trial Nears End http://bit.ly/AU09O,,False,Fri Jul 24 09:15:21 +0000 2009,0,2815738255
7,Twitter Web Client,"For Clinton, ’09 Campaign Is for Her Turf http://bit.ly/srY22",,False,Thu Jul 16 02:12:26 +0000 2009,0,2662323920
3,Twitter Web Client,"Sanford Didn’t Improperly Use Public Funds, Official Says http://bit.ly/STMm",,False,Thu Jul 02 22:25:51 +0000 2009,0,2444390359
2,Twitter Web Client,Heavy Fire Erupts in Afghan City http://bit.ly/kSQ81,,False,Sat Jul 25 12:18:49 +0000 2009,0,2836492385
10,Twitter Web Client,Niger Senses a Threat to Its Scrap of Democracy http://bit.ly/FEW3o,,False,Tue Jul 14 00:35:32 +0000 2009,0,2623607526
6,Twitter Web Client,ArtsBeat: Live Blogging the Jackson Memorial http://bit.ly/vekew,,False,Tue Jul 07 16:09:46 +0000 2009,0,2516077699
10,Twitter Web Client,Limits on Logging in Old-Growth Forest Reinstated http://bit.ly/nUCrT,,False,Thu Jul 16 20:57:18 +0000 2009,0,2676049335
5,Twitter Web Client,"On our radar: Michael Jackson. Crowds are gathering. We'll have live video of memorial, updates and reviews in ArtsBeat. http://bit.ly/nlr8Q",,False,Tue Jul 07 11:00:15 +0000 2009,0,2512407964
9,Twitter Web Client,Va. Tech Gunman’s Mental Health Records Found http://bit.ly/10aCcO,,False,Wed Jul 22 15:06:57 +0000 2009,0,2779142490
10,Twitter Web Client,No Apologies From the Boss of a No-Frills Airline http://bit.ly/Mz9nM,,False,Fri Jul 31 21:05:33 +0000 2009,0,3058249143
2,Twitter Web Client,Detainee With Bin Laden Ties Ordered Released http://bit.ly/kp7RX,,False,Sat Aug 22 01:37:31 +0000 2009,0,3463299611
3,Twitter Web Client,Obama to Let Holder Decide on C.I.A. Investigations http://bit.ly/kDhqQ,,False,Mon Aug 24 18:13:31 +0000 2009,0,3517345323
4,Twitter Web Client,Goal of Unified Europe Falters Amid Downturn http://bit.ly/59s2w,,False,Sun Aug 23 10:57:15 +0000 2009,0,3490163382
2,Twitter Web Client,Economic Scene: A Forecast With Hope Built In http://bit.ly/178WVa,,False,Wed Jul 01 11:43:54 +0000 2009,0,2418864469
12,Twitter Web Client,"For Private Equity, a Public Disaster http://bit.ly/RkaID",,False,Sun Aug 09 01:37:29 +0000 2009,0,3200703142
11,Twitter Web Client,"The Choice: Off to Law School, at 19 http://bit.ly/MjkGx",,False,Mon Aug 10 18:22:24 +0000 2009,0,3229486966
12,Twitter Web Client,Netscape Founder Enters Browser Wars http://bit.ly/18YS9L,,False,Fri Aug 14 00:14:13 +0000 2009,0,3297146056
6,Twitter Web Client,"Facing Party Rift, Japan’s Prime Minster Calls Election http://bit.ly/ZIoMw",,False,Mon Jul 13 14:18:52 +0000 2009,0,2614519265
6,Twitter Web Client,"Bill Clinton Traveling to N. Korea, Report Says http://bit.ly/4eeX5S",,False,Tue Aug 04 01:28:10 +0000 2009,0,3115595871
1,Twitter Web Client,City Room: Water Main Break Floods Section of TriBeCa http://bit.ly/tuwT1,,False,Fri Aug 07 13:08:54 +0000 2009,0,3177417856
2,Twitter Web Client,"After Sprint Finish, the Real Showdown Begins http://bit.ly/1lTP09",,False,Thu Jul 09 18:06:07 +0000 2009,0,2554055813
5,Twitter Web Client,The Lettered Set http://bit.ly/2u51sx,,False,Thu Jul 02 08:02:00 +0000 2009,0,2434160123
4,Twitter Web Client,Ireland to Accept Two Guantánamo Detainees http://bit.ly/Hpx8O,,False,Wed Jul 29 12:22:57 +0000 2009,0,2908568943
8,Twitter Web Client,"All Around London, an Invitation to Make Music http://bit.ly/DFivD",,False,Sat Jul 11 06:28:21 +0000 2009,0,2580636165
10,Twitter Web Client,Obama Says Health Plan Won’t Add to Deficit http://bit.ly/NiKMx,,False,Sat Jul 18 10:21:05 +0000 2009,0,2704651266
11,Twitter Web Client,"Slow, Costly and Often Dangerous Road to Wind Power http://bit.ly/lT7Vu",,False,Thu Jul 23 06:48:24 +0000 2009,0,2794172301
20,Twitter Web Client,"Our Father, Lead Us to Tweet, and Forgive the Trespassers http://bit.ly/RndXb",,False,Sat Jul 04 17:57:37 +0000 2009,0,2471953987
25,Twitter Web Client,Google Plans to Introduce a PC Operating System http://bit.ly/Gucqn,,False,Wed Jul 08 04:47:43 +0000 2009,0,2527657422
8,Twitter Web Client,"For Hispanic Firefighter in New Haven Bias Suit, Awkward Position but Firm Resolve http://bit.ly/18ZUhX",,False,Fri Jul 03 05:04:41 +0000 2009,1,2449501571
8,Twitter Web Client,"In Russia, Obama’s Star Power Does Not Translate http://bit.ly/2A4Yj",,False,Wed Jul 08 06:36:45 +0000 2009,0,2528825388
2,Twitter Web Client,Retailers Post Weak Quarterly Earnings and July Sales http://bit.ly/5uUeo,,False,Fri Aug 14 00:01:30 +0000 2009,0,3296929553
6,Twitter Web Client,Journeys: Buenos Aires Spotlights Its Cafes http://bit.ly/13LSLz,,False,Sat Jul 11 08:49:31 +0000 2009,0,2581708969
1,Twitter Web Client,Claims Differ on Pakistani Taliban Struggle http://bit.ly/5X8ot,,False,Mon Aug 10 09:42:20 +0000 2009,0,3222684311
2,Twitter Web Client,Al Taqaddum Journal: Tracking Faraway Action From an Iraqi Base http://bit.ly/3qnnV,,False,Wed Jul 08 10:04:16 +0000 2009,0,2530376455
5,Twitter Web Client,Alleged Drug Ties of Top Afghan Official Worry U.S. http://bit.ly/zeL6L,,False,Thu Aug 27 00:34:35 +0000 2009,0,3568490377
5,Twitter Web Client,Counselors Make Their Tour of Colleges a Long Workout http://bit.ly/2fy3t,,False,Thu Jul 16 01:51:16 +0000 2009,0,2662013859
4,Twitter Web Client,Freed U.S. Man Departs Myanmar With Senator http://bit.ly/OLClP,,False,Sun Aug 16 08:20:43 +0000 2009,0,3341927400
12,Twitter Web Client,Episcopal Church Picks Gay Priests for Promotion http://bit.ly/XWL7f,,False,Mon Aug 03 01:04:37 +0000 2009,0,3095521992
2,Twitter Web Client,Inflation at a Low; New Home Construction Dips http://bit.ly/9Xity,,False,Tue Aug 18 13:11:36 +0000 2009,0,3382084599
3,Twitter Web Client,Fed Chairman Says American Economy Is Poised to Grow http://bit.ly/18g7ZA,,False,Fri Aug 21 14:36:49 +0000 2009,0,3450699608
7,Twitter Web Client,"Steve McNair, a Super Bowl Quarterback, Is Shot to Death http://bit.ly/hedLb",,False,Sun Jul 05 01:29:17 +0000 2009,0,2476682595
5,Twitter Web Client,On our radar. Obama in Ghana. Full report coming.,,False,Sat Jul 11 13:22:03 +0000 2009,0,2583512910
3,Twitter Web Client,Abroad: High-Born Prussians Who Defied Their Origin http://bit.ly/11KiT5,,False,Thu Jul 16 08:11:12 +0000 2009,0,2666586427
10,Twitter Web Client,Army Will Train Soldiers to Cope With Emotions http://bit.ly/272z6K,,False,Tue Aug 18 01:55:45 +0000 2009,0,3374015054
11,Twitter Web Client,"Idea of the Day: China, Next Bubble to Burst? http://bit.ly/3JlaoT",,False,Tue Aug 11 11:38:44 +0000 2009,0,3243945959
5,Twitter Web Client,Lawyer’s Detention Shakes China’s Rights Movement http://bit.ly/tLOfz,,False,Mon Aug 10 00:11:52 +0000 2009,0,3216257149
9,Twitter Web Client,Some Lawyers Are Said to Prey on Illegal Immigrants http://bit.ly/RQQNh,,False,Sat Aug 15 03:27:49 +0000 2009,0,3321937452
7,Twitter Web Client,NYT NEWS ALERT: Remains of First American Lost in Persian Gulf War Found After Nearly 20 Years,,False,Sun Aug 02 11:10:02 +0000 2009,0,3085263266
5,Twitter Web Client,High-Risk Drug Is in Spotlight in Wake of High-Profile Death http://bit.ly/2fpYoW,,False,Fri Aug 07 04:54:06 +0000 2009,0,3174357783
6,Twitter Web Client,Obama Taking an Active Role in Health Talks http://bit.ly/AveQy,,False,Thu Aug 13 02:29:38 +0000 2009,0,3278281345
4,Twitter Web Client,"In a twist on the mental health day, Ron Lieber takes a fiscal health day in this new video by @nytimesvideo - Watch: http://bit.ly/uwxiG",,False,Mon Jul 06 19:24:46 +0000 2009,0,2501638732
4,Twitter Web Client,CIT Is Near Deal for $3 Billion Loan to Avert Bankruptcy http://bit.ly/18l9Yd,,False,Sun Jul 19 23:47:18 +0000 2009,0,2729443504
4,Twitter Web Client,Judges’ Dissents for Death Row Inmates Are Rising http://bit.ly/1HmrMf,,False,Fri Aug 14 02:33:43 +0000 2009,0,3299628884
6,Twitter Web Client,Helicopter and Small Plane Collide Over Hudson River http://bit.ly/e7YUu,,False,Sat Aug 08 16:48:53 +0000 2009,0,3194889464
5,Twitter Web Client,U.S. Military Says Afghan Force Is Insufficient http://bit.ly/7Kmkb,,False,Mon Aug 24 02:01:48 +0000 2009,0,3503787206
5,Twitter Web Client,More Troops Are Sought for Iraq’s Restive North http://bit.ly/Am3a3,,False,Mon Aug 17 13:46:38 +0000 2009,0,3361577316
6,Twitter Web Client,Cash Deal For Clunkers So Popular It’s Broke http://bit.ly/u5RL6,,False,Fri Jul 31 01:51:00 +0000 2009,0,2942659309
