favorite_count,source,text,in_reply_to_screen_name,is_retweet,created_at,retweet_count,id_str
0,Twitter Web Client,Buying 3rd Car as Way to Save on Price of Gas http://tinyurl.com/2yu5tv,,False,Sat May 26 03:07:24 +0000 2007,0,78766782
0,Twitter Web Client,Video of Captive BBC Reporter Emerges http://tinyurl.com/2hq7yd,,False,Fri Jun 01 14:26:39 +0000 2007,0,86865102
0,Twitter Web Client,Going to Court Over Fiction by a Fictitious Writer http://tinyurl.com/ywymsu,,False,Fri Jun 15 14:09:54 +0000 2007,0,105796442
0,Twitter Web Client,"Murdoch’s Dealings in China: It’s Business, and It’s Personal http://tinyurl.com/2fflqr",,False,Tue Jun 26 02:08:47 +0000 2007,0,120824402
0,Twitter Web Client,F.D.A. Warns of Toothpaste Made in China http://tinyurl.com/2db9al,,False,Sat Jun 02 02:16:45 +0000 2007,0,87573162
0,Twitter Web Client,Movie Ratings Panel Will Start to Assess the Smoking http://tinyurl.com/yull6d,,False,Fri May 11 01:09:08 +0000 2007,0,59352352
0,Twitter Web Client,"After Bus Attack, Afghan Police Mourn Their Own http://tinyurl.com/2zl5zz",,False,Mon Jun 18 03:19:37 +0000 2007,0,109136812
0,Twitter Web Client,The Superfabulous World of Rufus Wainwright http://tinyurl.com/yo5ogs,,False,Mon Jun 04 07:15:04 +0000 2007,0,90189122
0,Twitter Web Client,Israeli Labor Party Voting to Choose New Leader http://tinyurl.com/2xpmzv,,False,Mon May 28 18:18:58 +0000 2007,0,81656512
0,Twitter Web Client,"Officer in Diallo Killing Fights for His Name, and His Gun http://tinyurl.com/2fbaqs",,False,Sun May 20 17:18:01 +0000 2007,0,71485082
0,Twitter Web Client,G.O.P. Senator Says Gonzales Might Quit http://tinyurl.com/22nz3c,,False,Mon May 21 02:18:07 +0000 2007,0,71884922
0,Twitter Web Client,Bush Meets Pope Benedict for the First Time http://tinyurl.com/2z9a47,,False,Sat Jun 09 17:19:47 +0000 2007,0,97500892
0,Twitter Web Client,Former Newark Mayor Warned About Charges http://tinyurl.com/ynjfrt,,False,Sun Jun 10 04:19:49 +0000 2007,0,98031642
0,Twitter Web Client,In Their Shoes: Prenatal Test Puts Down Syndrome in Hard Focus http://tinyurl.com/2dsbw6,,False,Wed May 09 03:09:22 +0000 2007,0,56455372
0,Twitter Web Client,New Poll Finds That Young Americans Are Leaning Left http://tinyurl.com/yqfbrq,,False,Wed Jun 27 03:08:36 +0000 2007,0,122353622
0,Twitter Web Client,[TS] This Land: Where Two Rivers Converge and Two Histories Divide http://select.nytimes.com/2007/05/20/us/20land.html?,,False,Sun May 20 15:18:01 +0000 2007,0,71374132
0,Twitter Web Client,Democratic Congressman Expected to Be Indicted http://tinyurl.com/ypgbdw,,False,Mon Jun 04 19:16:20 +0000 2007,0,90948862
0,Twitter Web Client,German Raids Aim to Foil Any Plot to Upset Group of 8 Meeting http://tinyurl.com/2xol94,,False,Thu May 10 00:09:17 +0000 2007,0,57909012
0,Twitter Web Client,Pope Opens Trip With Remarks Against Abortion http://tinyurl.com/2c6wog,,False,Thu May 10 02:09:32 +0000 2007,0,58022862
0,Twitter Web Client,Skimping on Drug Benefits Doesn’t Pay http://tinyurl.com/2fbmyn,,False,Tue Jun 26 22:08:36 +0000 2007,0,122024202
0,Twitter Web Client,Bush Meets Pope Benedict for the First Time http://tinyurl.com/2yht9o,,False,Sat Jun 09 15:19:46 +0000 2007,0,97379882
0,Twitter Web Client,Campaign Funds for Alaskan; Road Aid to Florida http://tinyurl.com/2yssvo,,False,Thu Jun 07 02:10:17 +0000 2007,0,94114862
0,Twitter Web Client,Nadal Continues His Clay-Court Dominance at French Open http://tinyurl.com/2dfrbu,,False,Mon Jun 04 20:16:16 +0000 2007,0,90998682
0,Twitter Web Client,Sarkozy’s Party on the Way to a Big Victory http://tinyurl.com/2288jb,,False,Sun Jun 10 21:19:38 +0000 2007,0,98860222
1,Twitter Web Client,Mayweather Wins Decision Over De La Hoya http://tinyurl.com/2f5xmg,,False,Sun May 06 06:09:41 +0000 2007,0,51634652
0,Twitter Web Client,Rumors Fly on Microsoft and Yahoo http://tinyurl.com/2h22bq,,False,Sat May 05 03:09:53 +0000 2007,0,50477102
0,Twitter Web Client,"U.S. Not Pushing for Attack on Iran, Rice Says http://tinyurl.com/2be99l",,False,Fri Jun 01 20:26:48 +0000 2007,0,87257072
0,Twitter Web Client,Pope Softens Remarks on Conversion of Natives http://tinyurl.com/yvbpdh,,False,Wed May 23 17:07:42 +0000 2007,0,75500322
0,Twitter Web Client,World Health Agency Warns of Surge in Drug-Resistant TB http://tinyurl.com/27dy4n,,False,Wed Jun 06 11:16:06 +0000 2007,0,93195182
0,Twitter Web Client,Bit Wars: When Computers Attack http://tinyurl.com/2y96cc,,False,Sun Jun 24 01:18:53 +0000 2007,0,117903352
0,Twitter Web Client,Bush Proposes Goal to Reduce Greenhouse Gas http://tinyurl.com/ypedlo,,False,Fri Jun 01 03:06:44 +0000 2007,0,86191372
0,Twitter Web Client,"Heart in Israel, Home (Court) in New York http://tinyurl.com/24vngg",,False,Sun May 20 12:18:08 +0000 2007,0,71201542
0,Twitter Web Client,When Fakery Turns Fatal http://tinyurl.com/2gpj22,,False,Tue Jun 05 04:16:18 +0000 2007,0,91361702
0,Twitter Web Client,Bribery Investigation Looks at Senator Stevens http://tinyurl.com/28nhvy,,False,Fri Jun 08 04:19:56 +0000 2007,0,95464432
0,Twitter Web Client,Labor Formally Names Brown as Blair’s Successor http://tinyurl.com/2fkvfn,,False,Sun Jun 24 23:08:55 +0000 2007,0,119049052
0,Twitter Web Client,Minarets on Shiite Shrine in Iraq Destroyed in Attack http://tinyurl.com/yuk4z9,,False,Wed Jun 13 13:10:06 +0000 2007,0,102912582
0,Twitter Web Client,Ghosts Wail as Cambodians Plunder Killing Field Graves http://tinyurl.com/2ez6aa,,False,Sun May 20 06:18:04 +0000 2007,0,70938092
0,Twitter Web Client,Senate Leaders Agree to Revive Immigration Bill http://tinyurl.com/2axacg,,False,Fri Jun 15 01:10:09 +0000 2007,0,105020352
0,Twitter Web Client,A Cross-Country Blame Game http://tinyurl.com/yv9xkv,,False,Tue May 08 13:09:27 +0000 2007,0,55158022
0,Twitter Web Client,Computer Problem on Space Station Persists http://tinyurl.com/28epr6,,False,Thu Jun 14 15:10:14 +0000 2007,0,104421002
0,Twitter Web Client,Ex-E.P.A. Chief Defends Role in 9/11 Response http://tinyurl.com/2azfzb,,False,Tue Jun 26 01:08:41 +0000 2007,0,120756522
0,Twitter Web Client,U.S. Bid to Win the America’s Cup Ends http://tinyurl.com/ypgy3e,,False,Mon May 21 04:17:57 +0000 2007,0,71998642
0,Twitter Web Client,NBC Will Bring Back All 3 ‘Law & Order’ Shows http://tinyurl.com/2h7ssa,,False,Mon May 14 01:19:23 +0000 2007,0,63142392
0,Twitter Web Client,Democrats Seek No-Confidence Vote on Gonzales http://www.nytimes.com/2007/05/17/washington/17cnd-gonzales.html?ex=1337054400&en=0fa14c78492e,,False,Thu May 17 21:18:21 +0000 2007,0,67635602
0,Twitter Web Client,"For the First Time, New York Links a Death to 9/11 Dust http://tinyurl.com/2zaf4h",,False,Thu May 24 10:17:34 +0000 2007,0,76447442
0,Twitter Web Client,China to Revise Food and Drug Safety Rules http://tinyurl.com/2a5gpo,,False,Wed Jun 06 18:16:09 +0000 2007,0,93659272
0,Twitter Web Client,"Yankees 8, Red Sox 3: Yanks Make a Dent as Pettitte Finds Support http://tinyurl.com/2b4vzx",,False,Thu May 24 04:18:02 +0000 2007,0,76146262
0,Twitter Web Client,General Peter Pace to Retire as Chairman of the Joint Chiefs of Staff http://tinyurl.com/2fmjae,,False,Fri Jun 08 18:19:53 +0000 2007,0,96335112
0,Twitter Web Client,Alinghi’s Crew Begins Where It Left Off http://tinyurl.com/yuareo,,False,Sat Jun 23 17:08:59 +0000 2007,0,117483362
0,Twitter Web Client,Romney to Tap Own Money for Campaign http://tinyurl.com/yrc6n5,,False,Tue Jun 26 05:18:43 +0000 2007,0,121037092
0,Twitter Web Client,Wildfire Rages in Los Angeles http://tinyurl.com/259s88,,False,Wed May 09 07:09:20 +0000 2007,0,56831242
0,Twitter Web Client,Bush’s Nominee Has New Agenda for Bank http://tinyurl.com/23g3rf,,False,Thu May 31 08:06:47 +0000 2007,0,85077032
0,Twitter Web Client,Giuliani Takes On G.O.P. Orthodoxy on Social Issues http://tinyurl.com/yul2v7,,False,Sat May 12 02:09:09 +0000 2007,0,60909442
0,Twitter Web Client,"In French Bid, Immigrant’s Son Battles Reputation as Anti-Immigrant http://tinyurl.com/ywcgp6",,False,Sat May 05 03:09:50 +0000 2007,0,50477062
0,Twitter Web Client,"In Senate Deal, Details Bedevil Illegal Migrants http://tinyurl.com/2dn3d6",,False,Sat May 19 18:18:08 +0000 2007,0,70369172
0,Twitter Web Client,Giant Bird-Like Dinosaur Fossil Found in China http://tinyurl.com/2d95h4,,False,Wed Jun 13 18:30:43 +0000 2007,0,103277522
0,Twitter Web Client,Detainee Case Stirs Arguments on Boy Fighters http://tinyurl.com/yw9asz,,False,Sat Jun 02 18:16:30 +0000 2007,0,88372052
0,Twitter Web Client,Puerto Rico’s AIDS Care in Disarray Over Funds http://tinyurl.com/26fuhs,,False,Tue Jun 05 02:35:35 +0000 2007,0,91272002
0,Twitter Web Client,Putin Presents Bush With Plan on Missile Shield http://tinyurl.com/2cqvay,,False,Fri Jun 08 03:19:59 +0000 2007,0,95401302
0,Twitter Web Client,Opposition Splits While Zimbabwe Slips http://tinyurl.com/2y3emz,,False,Wed May 09 02:09:47 +0000 2007,0,56366362
0,Twitter Web Client,Olmert Survives Three No-Confidence Motions http://tinyurl.com/2hgafx,,False,Mon May 07 19:09:32 +0000 2007,0,53655032
0,Twitter Web Client,Government Report Rates Hospitals on Their Heart Treatment http://tinyurl.com/ypdc2l,,False,Fri Jun 22 02:09:28 +0000 2007,0,115479142
0,Twitter Web Client,Research Finds Firstborns Gain the Higher I.Q. http://tinyurl.com/24jcx5,,False,Fri Jun 22 03:09:09 +0000 2007,0,115548292
0,Twitter Web Client,ABC Says It Was Outbid for Paris Hilton Interview http://tinyurl.com/2zo72l,,False,Fri Jun 22 03:09:11 +0000 2007,0,115548322
0,Twitter Web Client,Supreme Court Lifts Ban on Minimum Retail Pricing http://tinyurl.com/2yfnu3,,False,Fri Jun 29 02:08:28 +0000 2007,0,125526142
0,Twitter Web Client,Abbas Swears In Emergency Cabinet http://tinyurl.com/2bvu62,,False,Sun Jun 17 16:09:47 +0000 2007,0,108574882
0,Twitter Web Client,"For Changing Queens, Lessons in Talk of the Streets http://tinyurl.com/ywpo3d",,False,Mon May 28 03:07:11 +0000 2007,0,81060652
0,Twitter Web Client,TB Patient Moved to Specialized Hospital http://tinyurl.com/2yz84y,,False,Thu May 31 18:26:46 +0000 2007,0,85739112
0,Twitter Web Client,French Open: Sharapova Won’t Let Injury Hold Her Back http://tinyurl.com/28o2p5,,False,Wed May 30 18:06:54 +0000 2007,0,84305402
0,Twitter Web Client,General’s Report on Iraq Progress Has Competition http://tinyurl.com/2hhu35,,False,Sat Jun 23 18:08:58 +0000 2007,0,117547632
0,Twitter Web Client,"Fighting the Web, Sports Teams Seek to Control Ticket Resales http://tinyurl.com/28htk6",,False,Thu Jun 14 09:10:09 +0000 2007,0,104036802
0,Twitter Web Client,State Bar Weighs Law License of Duke Prosecutor http://tinyurl.com/yvwepb,,False,Wed Jun 13 00:20:10 +0000 2007,0,102156322
0,Twitter Web Client,"In a Switch, China Triples the Tax on Stock Trades http://tinyurl.com/2euhw3",,False,Wed May 30 06:07:17 +0000 2007,0,83611652
0,Twitter Web Client,Democrats Drop Withdrawal Dates From Iraq Bill http://tinyurl.com/2xj7lh,,False,Tue May 22 21:17:47 +0000 2007,0,74463462
0,Twitter Web Client,Search for Britons Continues in Baghdad http://tinyurl.com/25xpjf,,False,Fri Jun 01 02:26:49 +0000 2007,0,86156932
0,Twitter Web Client,Is U.S. Safer Since 9/11? Clinton and Rivals Spar http://tinyurl.com/2gh22b,,False,Wed Jun 06 03:16:13 +0000 2007,0,92769372
0,Twitter Web Client,Europe to Resume Aid to Palestinian Authority http://tinyurl.com/yorrgj,,False,Mon Jun 18 16:40:29 +0000 2007,0,109923672
0,Twitter Web Client,Rattletrap East German Icon Has ‘Ostalgic’ Appeal http://tinyurl.com/yss6g3,,False,Sat Jun 16 17:09:45 +0000 2007,0,107426972
0,Twitter Web Client,Chinese Commemorate 18th Anniversary of Tiananmen Crackdown http://tinyurl.com/ytaup3,,False,Mon Jun 04 18:16:16 +0000 2007,0,90887992
0,Twitter Web Client,Lieberman Backs Limited U.S. Attacks on Iran http://tinyurl.com/youdzs,,False,Sun Jun 10 18:19:39 +0000 2007,0,98705852
0,Twitter Web Client,Palestinian Rivals Meet to Discuss Ceasefire http://tinyurl.com/yp348p,,False,Wed May 23 16:07:49 +0000 2007,0,75435842
0,Twitter Web Client,House Panel Considers Cuts for Missile Defense http://tinyurl.com/2etgbk,,False,Thu May 10 00:09:18 +0000 2007,0,57909022
0,Twitter Web Client,"At Home Depot, How Green Is That Chainsaw? http://tinyurl.com/2yeheq",,False,Mon Jun 25 02:08:54 +0000 2007,0,119228972
0,Twitter Web Client,"Investors’ Suits Face Higher Bar, Justices Rule http://tinyurl.com/2bs9ea",,False,Fri Jun 22 02:09:23 +0000 2007,0,115479052
0,Twitter Web Client,Abbas Swears in Emergency Government http://tinyurl.com/22fhdy,,False,Mon Jun 18 02:09:43 +0000 2007,0,109074492
0,Twitter Web Client,Sunni Ministers Threaten to Quit Cabinet in Iraq http://tinyurl.com/28fe32,,False,Tue May 01 04:10:19 +0000 2007,0,45620622
0,Twitter Web Client,Court Backs Police in Chase That Hurt Driver http://tinyurl.com/25lurn,,False,Tue May 01 03:10:23 +0000 2007,0,45578142
0,Twitter Web Client,BP Chief Resigns Amid Battle With Tabloid http://tinyurl.com/yt5w54,,False,Tue May 01 21:10:12 +0000 2007,0,46356922
0,Twitter Web Client,Israel to Step Up Military Action in Gaza http://tinyurl.com/ypmqe4,,False,Sun May 20 18:18:11 +0000 2007,0,71533882
0,Twitter Web Client,Olmert’s Testimony on Lebanon War Is Made Public http://tinyurl.com/yry5fb,,False,Thu May 10 20:09:10 +0000 2007,0,59059282
0,Twitter Web Client,Judge Throws Out Charges in Guantanamo Prisoner Case http://tinyurl.com/yuqdn5,,False,Mon Jun 04 19:16:19 +0000 2007,0,90948832
0,Twitter Web Client,"Rainfall Floods Texas Towns, Killing 4 People http://tinyurl.com/ypml8t",,False,Tue Jun 19 01:19:33 +0000 2007,0,110475412
0,Twitter Web Client,Committee Is Likely to Say Wolfowitz Broke Rules http://tinyurl.com/246jtx,,False,Thu May 03 02:10:14 +0000 2007,0,47951582
0,Twitter Web Client,F.T.C. to Sue in Bid to Halt Food Merger http://tinyurl.com/yu24nm,,False,Wed Jun 06 03:16:16 +0000 2007,0,92769472
0,Twitter Web Client,"On Mt. Shasta, Winter’s Wrath Knows No Calendar http://tinyurl.com/ywkvhd",,False,Fri Jun 15 09:09:54 +0000 2007,0,105472032
0,Twitter Web Client,The Saturday Profile: A Castro Strives to Open Cuban Society’s Opinions on Sex http://tinyurl.com/2aaedy,,False,Sat Jun 09 07:19:50 +0000 2007,0,96996732
0,Twitter Web Client,"Michelle Obama Adds New Role to Balancing Act &lt;html&gt;
	&lt;head&gt;
		&lt;title&gt;OpenDNS&lt;/title&gt;
	&lt;/head&gt;

	&lt;body id=""",,False,Fri May 18 02:18:26 +0000 2007,0,67931682
0,Twitter Web Client,"Cheated of Future, Iraqi Graduates Want to Flee http://tinyurl.com/ypb2fc",,False,Tue Jun 05 02:37:01 +0000 2007,0,91271972
0,Twitter Web Client,States Found to Vary Widely on Education http://tinyurl.com/2d6v2s,,False,Fri Jun 08 03:20:04 +0000 2007,0,95401452
0,Twitter Web Client,G.O.P. Leader Says Results Needed in Iraq by Fall http://tinyurl.com/ywjwbt,,False,Sun May 06 20:09:36 +0000 2007,0,52309242
0,Twitter Web Client,Heart Risk Seen in Drug for Diabetes http://tinyurl.com/27ldf8,,False,Tue May 22 02:17:54 +0000 2007,0,73270572
0,Twitter Web Client,Olmert and Abbas to Meet in Palestinian Territories http://tinyurl.com/yv2kjp,,False,Thu May 31 23:06:43 +0000 2007,0,85986062
0,Twitter Web Client,Attacker Kills 4 Sunni Sheiks Who Aided U.S. http://tinyurl.com/26hu7c,,False,Tue Jun 26 03:09:01 +0000 2007,0,120893012
0,Twitter Web Client,Car Bomb Kills at Least 25 in Baghdad http://tinyurl.com/2arpph,,False,Thu Jun 28 12:08:29 +0000 2007,0,124490232
0,Twitter Web Client,U.N. Approves Court to Prosecute Hariri Killing http://tinyurl.com/2fhprc,,False,Thu May 31 04:26:49 +0000 2007,0,84885402
0,Twitter Web Client,Justices Limit Discrimination Suits http://tinyurl.com/26z2y5,,False,Tue May 29 18:07:05 +0000 2007,0,82920332
0,Twitter Web Client,F.D.A. Issues Strictest Warning on Diabetes Drugs http://tinyurl.com/yo8odc,,False,Thu Jun 07 02:10:13 +0000 2007,0,94114762
0,Twitter Web Client,"Hard Knocks: The Right: Down, but Maybe Not Out http://tinyurl.com/ywz8an",,False,Sat May 19 18:18:07 +0000 2007,0,70369152
0,Twitter Web Client,"Beam It Down From the Web, Scotty http://tinyurl.com/29s6d2",,False,Mon May 07 12:09:32 +0000 2007,0,53145022
0,Twitter Web Client,Israel Seizes 33 Palestinians in Crackdown http://tinyurl.com/28avjs,,False,Fri May 25 02:07:31 +0000 2007,0,77325372
0,Twitter Web Client,U.S. to Keep Europe as Site for Deterrent to Missiles http://tinyurl.com/ypy3vl,,False,Fri Jun 15 02:09:59 +0000 2007,0,105081542
0,Twitter Web Client,"Qaeda Figure in Iraq Killed, U.S. Military Says http://tinyurl.com/2h3wfn",,False,Thu May 03 14:10:03 +0000 2007,0,48511212
0,Twitter Web Client,U.S. Officials Question Ability of Iraqi Troops http://tinyurl.com/yplaju,,False,Sun Jun 24 23:08:55 +0000 2007,0,119049062
0,Twitter Web Client,2 Sides Give Opening Arguments in Padilla Trial http://tinyurl.com/299dyq,,False,Mon May 14 22:18:55 +0000 2007,0,64214062
0,Twitter Web Client,New AIDS Cases in Africa Outpace Treatment Gains http://tinyurl.com/2es52v,,False,Wed Jun 06 05:16:15 +0000 2007,0,92882572
0,Twitter Web Client,G.E. and Pearson Decide Against Dow Jones Bid http://tinyurl.com/23dwl3,,False,Thu Jun 21 18:09:16 +0000 2007,0,114949872
0,Twitter Web Client,Lake Tahoe Fire Hits Year-Round Residents http://tinyurl.com/22jay8,,False,Thu Jun 28 02:08:31 +0000 2007,0,123953242
0,Twitter Web Client,Jankovic Advances at Wimbledon http://tinyurl.com/2erx4r,,False,Fri Jun 29 21:08:16 +0000 2007,0,126804252
0,Twitter Web Client,Palestinian Rivals Meet to Discuss Ceasefire http://www.nytimes.com/2007/05/23/world/middleeast/23cnd-mideast.html?ex=1337572800&en=0a75ba55,,False,Wed May 23 16:17:47 +0000 2007,0,75444482
0,Twitter Web Client,Inspector of Projects in Iraq Is Now Under Investigation http://tinyurl.com/2gucq6,,False,Fri May 04 02:10:02 +0000 2007,0,49199272
0,Twitter Web Client,"Needing Cash, Cemeteries Seek Breathing Clients http://tinyurl.com/2gldmo",,False,Fri May 25 03:07:31 +0000 2007,0,77384152
0,Twitter Web Client,"Amid Burst of Fervor, Pope Canonizes a Brazilian http://tinyurl.com/263ssp",,False,Sat May 12 04:09:20 +0000 2007,0,61016662
0,Twitter Web Client,Britain on Edge After Car Slams Into Airport http://tinyurl.com/yoh5yq,,False,Sat Jun 30 20:08:11 +0000 2007,0,128234572
0,Twitter Web Client,Democrats and White House Remain at Odds on Iraq Bill http://tinyurl.com/2fyhqv,,False,Fri May 18 23:18:12 +0000 2007,0,69358252
0,Twitter Web Client,Bloomberg Shows Off His Spanish http://tinyurl.com/2gblax,,False,Thu May 03 00:10:04 +0000 2007,0,47851252
0,Twitter Web Client,"Venice Journal: On Canals, a Woman Paddles Against the Tide http://tinyurl.com/276acn",,False,Mon May 14 03:21:46 +0000 2007,0,63243772
0,Twitter Web Client,Justices Loosen Ad Restrictions in Campaign Law http://tinyurl.com/2zme8a,,False,Tue Jun 26 02:08:43 +0000 2007,0,120824282
0,Twitter Web Client,House Votes to Expand Stem Cell Research http://tinyurl.com/2zkhvq,,False,Fri Jun 08 01:19:59 +0000 2007,0,95277952
0,Twitter Web Client,6 Arrested in Plot to Attack Fort Dix http://tinyurl.com/267vjr,,False,Tue May 08 16:09:24 +0000 2007,0,55489692
0,Twitter Web Client,"Whale Pair, Seen by Thousands, Begin to Head Home http://tinyurl.com/2b24qf",,False,Mon May 21 02:18:06 +0000 2007,0,71884892
0,Twitter Web Client,"Israelis Ask, What Have We Gained Since the ’67 War? http://tinyurl.com/yu9d6n",,False,Sat Jun 09 09:19:57 +0000 2007,0,97085092
0,Twitter Web Client,The Unintended Consequences of Hyperhydration http://tinyurl.com/2zaonl,,False,Sun May 27 15:07:27 +0000 2007,0,80503322
0,Twitter Web Client,Gazans Adjust to Power Shift as New Rulers Revel http://tinyurl.com/2ahlny,,False,Wed Jun 20 03:09:27 +0000 2007,0,112315192
0,Twitter Web Client,Guyanese Suspect in JFK Plot Surrenders http://tinyurl.com/24e8qs,,False,Tue Jun 05 18:16:10 +0000 2007,0,92239942
0,Twitter Web Client,White House Names General to Be ‘War Czar’ http://tinyurl.com/yomtpn,,False,Wed May 16 01:18:33 +0000 2007,0,65566122
0,Twitter Web Client,"For Lohan, a Cocktail of Sympathy and Scorn http://tinyurl.com/287qrs",,False,Thu May 31 12:06:51 +0000 2007,0,85298402
0,Twitter Web Client,Europeans Press Wolfowitz to Quit as Bank Chief http://tinyurl.com/229v2e,,False,Fri May 11 03:09:09 +0000 2007,0,59473052
0,Twitter Web Client,Bay St. Louis Journal: A Bridge Restores a Lifeline to a Battered Town http://tinyurl.com/28tns8,,False,Tue May 29 04:07:07 +0000 2007,0,82066642
0,Twitter Web Client,Funds Released in North Korea Deal http://tinyurl.com/24u2a2,,False,Thu Jun 14 15:10:11 +0000 2007,0,104420892
0,Twitter Web Client,Sarkozy’s Party Wins Smaller Majority Than Expected in French Assembly http://tinyurl.com/yq2lgg,,False,Sun Jun 17 23:09:50 +0000 2007,0,108920492
0,Twitter Web Client,"Jerry Falwell, Moral Majority Founder, Dies at 73 http://tinyurl.com/2dt6qg",,False,Wed May 16 02:19:18 +0000 2007,0,65630222
0,Twitter Web Client,"Cavaliers 88, Nets 72: Elimination May Break Up Nets’ 3 Best Players http://tinyurl.com/yrxkcw",,False,Sat May 19 03:18:14 +0000 2007,0,69577422
0,Twitter Web Client,Gaza Is Calm After Hamas Gains Control http://tinyurl.com/yr85mj,,False,Fri Jun 15 12:19:54 +0000 2007,0,105663402
0,Twitter Web Client,Iraqis Are Failing to Meet U.S. Benchmarks http://tinyurl.com/2342zl,,False,Wed Jun 13 03:20:14 +0000 2007,0,102330072
1,Twitter Web Client,Bhutan Lets the World In (but Leaves Fashion TV Out) http://tinyurl.com/27xj7p,,False,Sun May 06 05:09:48 +0000 2007,0,51596762
0,Twitter Web Client,Death Toll for Contractors Reaches New High in Iraq http://tinyurl.com/2es8x8,,False,Sat May 19 02:18:16 +0000 2007,0,69517452
0,Twitter Web Client,U.S. Fugitives Worry About a Cuba Without Castro http://tinyurl.com/yw5anl,,False,Sat May 12 09:09:05 +0000 2007,0,61249292
0,Twitter Web Client,Billionaire Elected President of World Jewish Congress http://tinyurl.com/2dtzjy,,False,Mon Jun 11 02:19:38 +0000 2007,0,99124322
0,Twitter Web Client,Missile Test Comes as Financing Is Threatened http://tinyurl.com/yu8u4p,,False,Wed May 23 02:17:45 +0000 2007,0,74673222
0,Twitter Web Client,"In Bid for Better Care, Surgery With a Warranty http://www.nytimes.com/2007/05/17/business/17quality.html?ex=1337054400&en=3d8a549fa8ccb22c&",,False,Thu May 17 03:19:16 +0000 2007,0,66485092
0,Twitter Web Client,Kellogg to Phase Out Some Food Ads to Children http://tinyurl.com/yvgc2k,,False,Thu Jun 14 04:11:16 +0000 2007,0,103775762
0,Twitter Web Client,Unfriendly Views on U.S.-Backed Arabic TV http://www.nytimes.com/2007/05/17/washington/17hurra.html?ex=1337054400&en=72ad96d7a6ae6636&ei=508,,False,Thu May 17 02:18:30 +0000 2007,0,66431612
0,Twitter Web Client,2 Oil Firms Are Defiant in Venezuela http://tinyurl.com/ys92oa,,False,Wed Jun 27 03:08:37 +0000 2007,0,122353652
0,Twitter Web Client,"The Energy Challenge: Efficiency, Not Just Alternatives, Is Promoted as an Energy Saver http://tinyurl.com/22gdgh",,False,Tue May 29 12:27:01 +0000 2007,0,82483342
0,Twitter Web Client,Chinese Company Denies Defect in Recalled Tires http://tinyurl.com/ywayuw,,False,Tue Jun 26 18:08:51 +0000 2007,0,121780352
0,Twitter Web Client,Gates Offers to Work With China’s Military http://tinyurl.com/26k4r7,,False,Sat Jun 02 04:16:35 +0000 2007,0,87682352
0,Twitter Web Client,"Naples Journal: In Mire of Politics and the Mafia, Garbage Reigns http://tinyurl.com/yragnl",,False,Thu May 31 02:06:50 +0000 2007,0,84753272
0,Twitter Web Client,Leader’s Arrest Uncovers Divide in Hmong-Americans http://tinyurl.com/27aplh,,False,Thu Jun 14 07:10:01 +0000 2007,0,103926492
0,Twitter Web Client,"Craig Thomas, Senator From Wyoming, Dies at 74 http://tinyurl.com/286fd6",,False,Tue Jun 05 21:16:10 +0000 2007,0,92428152
0,Twitter Web Client,Senate Rejects Changes in Immigration Bill http://tinyurl.com/2gy384,,False,Thu May 24 21:07:32 +0000 2007,0,77038002
0,Twitter Web Client,Fashion Writer Sentenced to 20 Years in Attack http://tinyurl.com/2febo8,,False,Mon Jun 18 20:19:34 +0000 2007,0,110183412
0,Twitter Web Client,North Korea Says It Has Invited Nuclear Team http://tinyurl.com/yqopt9,,False,Sat Jun 16 20:09:46 +0000 2007,0,107589032
0,Twitter Web Client,5 U.S. Soldiers Killed in Iraq Attack http://tinyurl.com/ytwd3s,,False,Fri Jun 29 15:08:17 +0000 2007,0,126343372
0,Twitter Web Client,Many Detainees at Guant,,False,Sat May 05 01:09:55 +0000 2007,0,50383972
0,Twitter Web Client,"[TS] This Land: Where Little Grows, Capitalism Takes Root http://select.nytimes.com/2007/05/13/us/13land.html?",,False,Sat May 12 22:09:39 +0000 2007,0,61885292
0,Twitter Web Client,"Sarkozy, Elected in France, Vows Break With Past http://tinyurl.com/2552b3",,False,Mon May 07 03:09:36 +0000 2007,0,52664762
0,Twitter Web Client,Move by North Korea to Allow Inspectors Is Welcomed http://tinyurl.com/22fbwk,,False,Sun Jun 17 15:09:39 +0000 2007,0,108514302
0,Twitter Web Client,Stir in G.O.P. as Ex-Senator Moves to Run http://tinyurl.com/29fl2h,,False,Thu May 31 02:06:53 +0000 2007,0,84753322
0,Twitter Web Client,Dam’s Natural Allies Have a Change of Heart http://tinyurl.com/27majw,,False,Sat May 12 20:08:59 +0000 2007,0,61773602
0,Twitter Web Client,Dozens Killed in Violence Around Iraq http://tinyurl.com/293urb,,False,Tue Jun 05 19:14:49 +0000 2007,0,92299652
0,Twitter Web Client,"From China to Panama, a Trail of Poisoned Medicine http://tinyurl.com/yr5um7",,False,Sun May 06 05:09:47 +0000 2007,0,51596742
0,Twitter Web Client,New Scrutiny as Immigrants Die in Custody http://tinyurl.com/2bkx72,,False,Tue Jun 26 02:08:42 +0000 2007,0,120824262
0,Twitter Web Client,U.S. Holds Direct Talks in North Korea http://tinyurl.com/yuasen,,False,Thu Jun 21 12:09:19 +0000 2007,0,114480472
0,Twitter Web Client,Biologists Make Skin Cells Work Like Stem Cells http://tinyurl.com/2gxoy7,,False,Thu Jun 07 02:10:18 +0000 2007,0,94114922
0,Twitter Web Client,An Artist Sets Up House(s) at the Grand Palais http://tinyurl.com/27os8t,,False,Thu May 31 00:06:55 +0000 2007,0,84638982
