favorite_count,source,text,in_reply_to_screen_name,is_retweet,created_at,retweet_count,id_str
1,Twitter Web Client,Time Heals Rift as Citadel Lets Former Cadet Back in the Fold http://tinyurl.com/b5y5ok,,False,Tue Mar 03 03:26:21 +0000 2009,0,1272227927
12,Twitter Web Client,Obama to Push Immigration Bill as One Priority http://tinyurl.com/d3kt26,,False,Thu Apr 09 03:16:54 +0000 2009,0,1481154539
5,Twitter Web Client,Russia Is Planning a ‘Large-Scale Rearming’ http://tinyurl.com/d6qk9w,,False,Tue Mar 17 17:08:09 +0000 2009,0,1343215852
7,Twitter Web Client,"In Binghamton, Failure and Paranoia Preceded a Massacre http://bit.ly/s01x",,False,Sat Apr 11 23:54:08 +0000 2009,0,1499943930
3,Twitter Web Client,"9/11 Victims Who Sued Got Bigger Payments, Report Says http://tinyurl.com/cdvyru",,False,Thu Mar 12 20:45:38 +0000 2009,0,1318140522
5,Twitter Web Client,Economy to Dominate Annual Chinese Gathering http://tinyurl.com/ddgdfs,,False,Wed Mar 04 16:06:08 +0000 2009,0,1279034930
0,Twitter Web Client,City Room: Antismoking Ads Focus on Children http://tinyurl.com/dlbzq5,,False,Mon Mar 30 19:53:37 +0000 2009,0,1419810165
0,Twitter Web Client,Sri Lanka Bombing Kills at Least 7 http://tinyurl.com/bt5o67,,False,Tue Mar 10 06:34:39 +0000 2009,0,1304334706
2,Twitter Web Client,ArtsBeat: Poster Artist Answers A.P.’s Lawsuit http://bit.ly/jwW9o,,False,Thu Apr 16 18:48:03 +0000 2009,0,1535790853
2,Twitter Web Client,Suicide Attack Kills at Least 15 in Iraq http://bit.ly/13m7xv,,False,Thu Apr 16 12:18:07 +0000 2009,0,1533130118
5,Twitter Web Client,Obama Adviser Said to Be Tied to Pension Deal http://bit.ly/2pL6og,,False,Fri Apr 17 02:55:34 +0000 2009,0,1539041900
2,Twitter Web Client,Spain Hails Arrest of Suspected ETA Leader http://bit.ly/1XmVd,,False,Sun Apr 19 17:25:35 +0000 2009,0,1559163095
12,Twitter Web Client,Copyright Holders Challenge Sites That Excerpt http://tinyurl.com/d3zydz,,False,Mon Mar 02 07:11:32 +0000 2009,0,1268384856
2,Twitter Web Client,Getting Their Kirk On http://tinyurl.com/ctbrvc,,False,Thu Mar 19 17:08:32 +0000 2009,0,1355437006
1,Twitter Web Client,Riding the Rails http://tinyurl.com/d7d2he,,False,Fri Mar 06 20:06:09 +0000 2009,0,1289849200
6,Twitter Web Client,"Virtual Leagues Fold, Forcing Gamers to Find Actual Jobs http://tinyurl.com/daa2hd",,False,Thu Apr 02 11:02:37 +0000 2009,0,1437650794
2,Twitter Web Client,Chávez Offers to Restore Envoy to U.S. http://bit.ly/D6845,,False,Sat Apr 18 23:50:10 +0000 2009,0,1554379639
13,Twitter Web Client,NYT NEWS ALERT: Swine Flu Prompts U.S. to Declare Public Health Emergency,,False,Sun Apr 26 17:50:04 +0000 2009,0,1621910427
6,Twitter Web Client,Chicago 2016 Offers I.O.C. a Compact Games Plan http://tinyurl.com/dlc7aa,,False,Wed Apr 08 21:51:18 +0000 2009,0,1479435385
1,Twitter Web Client,Britain to Resume Talking With Hezbollah http://tinyurl.com/bh6qx6,,False,Thu Mar 05 23:25:44 +0000 2009,0,1285829243
0,Twitter Web Client,"City Room: Weiner Undecided on Mayoral Race, He Says http://tinyurl.com/c2e5gy",,False,Thu Mar 12 00:48:25 +0000 2009,0,1313650796
3,Twitter Web Client,Diner's Journal: Sampling Banh Mi http://tinyurl.com/ceqadu,,False,Wed Apr 08 01:54:28 +0000 2009,0,1473714173
4,Twitter Web Client,U.S. Is Said to Prepare Filing for Chrysler Bankruptcy http://bit.ly/TDDX0,,False,Thu Apr 23 19:31:24 +0000 2009,0,1596925058
3,Twitter Web Client,G.O.P. Senators Say Some Big Banks Can Be Allowed to Fail http://tinyurl.com/arkcjq,,False,Sun Mar 08 19:27:37 +0000 2009,0,1297298714
3,Twitter Web Client,‘Fast & Furious’ Takes In $72.5 Million http://tinyurl.com/c636bb,,False,Sun Apr 05 23:52:07 +0000 2009,0,1459698536
5,Twitter Web Client,TierneyLab: God Plays Dice with Einstein http://tinyurl.com/demj7j,,False,Mon Mar 30 14:49:48 +0000 2009,0,1418105131
3,Twitter Web Client,Old Clinton Hands Line Up Behind Gillibrand http://tinyurl.com/cdnwu4,,False,Wed Mar 11 02:06:16 +0000 2009,0,1308626512
1,Twitter Web Client,OPEC to Maintain Current Output http://tinyurl.com/clkjnb,,False,Sun Mar 15 17:25:40 +0000 2009,0,1332110189
1,Twitter Web Client,Officer Leads Old Corps in New Role in Pakistan http://tinyurl.com/cqp2yw,,False,Sat Mar 07 16:50:20 +0000 2009,0,1293200999
4,Twitter Web Client,"Poughkeepsie Journal: Restoring a Rail Bridge, Without the Rails http://bit.ly/s2ou0",,False,Fri Apr 24 22:43:28 +0000 2009,0,1608224031
0,Twitter Web Client,UConn Wins National Championship http://tinyurl.com/dfrt3z,,False,Wed Apr 08 03:51:31 +0000 2009,0,1474369635
8,Twitter Web Client,N.H. Senate Passes Gay Marriage Bill http://bit.ly/Cqzc6,,False,Wed Apr 29 19:56:13 +0000 2009,0,1652043354
2,Twitter Web Client,Moderate Is Said to Be Pick for Court http://tinyurl.com/c49fmc,,False,Tue Mar 17 08:46:36 +0000 2009,0,1341192337
4,Twitter Web Client,Pirates Seize Ship With U.S. Crew Off Coast of Somalia http://tinyurl.com/cvxmzm,,False,Wed Apr 08 14:42:48 +0000 2009,0,1476913098
3,Twitter Web Client,Clinton in Beirut Ahead of Key Election http://bit.ly/lSGWE,,False,Sun Apr 26 09:32:57 +0000 2009,0,1619567594
2,Twitter Web Client,Floyd Norris: The Ubiquity of Distress http://tinyurl.com/by65ed,,False,Tue Mar 10 20:50:26 +0000 2009,0,1307252827
1,Twitter Web Client,"As Wild Horses Multiply, a Voice for Contraception http://bit.ly/SBSp7",,False,Mon Apr 20 20:59:51 +0000 2009,0,1568877881
3,Twitter Web Client,"Prostate Cancer Screening Found to Save Few, if Any, Lives http://tinyurl.com/dnkqcs",,False,Wed Mar 18 19:32:31 +0000 2009,0,1350110977
3,Twitter Web Client,Bits: U.N. Says U.S. Internet and Telecoms Lags http://tinyurl.com/c4rgqd,,False,Tue Mar 03 12:07:04 +0000 2009,0,1273445453
3,Twitter Web Client,Yemen Dispute Slows Closing of Guantánamo http://bit.ly/17sOAN,,False,Thu Apr 23 18:29:40 +0000 2009,0,1596416695
0,Twitter Web Client,Suspected Pirate Arrives in New York to Face Charges http://bit.ly/lvaH2,,False,Tue Apr 21 15:04:09 +0000 2009,0,1575554572
6,Twitter Web Client,A.I.G. Lists Firms That Got Money From Taxpayers http://tinyurl.com/cyvszg,,False,Mon Mar 16 02:29:23 +0000 2009,0,1334358144
4,Twitter Web Client,Fears of Major Floods in North Dakota http://tinyurl.com/cjz4yw,,False,Wed Mar 25 21:06:02 +0000 2009,0,1390348084
2,Twitter Web Client,Pushing the Limit: Climber Still Seeks Larger Meaning in His Epic Escape http://tinyurl.com/cbtcux,,False,Wed Apr 01 00:10:42 +0000 2009,0,1427990529
2,Twitter Web Client,Administration Open to Taxing Health Benefits http://tinyurl.com/bpxbl6,,False,Sun Mar 15 02:15:19 +0000 2009,0,1329749140
2,Twitter Web Client,North Korea Reopens Military Hotline http://tinyurl.com/cab5b9,,False,Fri Mar 20 14:21:59 +0000 2009,0,1360436726
1,Twitter Web Client,City Room: F.B.I. Resumes Search for Mob Graves http://tinyurl.com/bbkz7f,,False,Mon Mar 09 15:46:31 +0000 2009,0,1300830532
5,Twitter Web Client,Dance: Still Dancing in Her Dreams http://bit.ly/DfbYu,,False,Sat Apr 18 05:14:49 +0000 2009,0,1548873347
4,Twitter Web Client,Harvard Medical School in Ethics Quandary http://tinyurl.com/andxjy,,False,Tue Mar 03 16:24:32 +0000 2009,0,1274342664
1,Twitter Web Client,Iceland’s Premier Eyes Entry to European Union http://bit.ly/15MVaj,,False,Sun Apr 26 23:08:06 +0000 2009,0,1624153165
1,Twitter Web Client,Seattle Journal: New Soccer Team Stokes Seattle’s Passion http://tinyurl.com/djqze4,,False,Wed Apr 01 01:11:07 +0000 2009,0,1428320464
3,Twitter Web Client,"651,000 Jobs Reported Lost in February http://tinyurl.com/b4dwqc",,False,Fri Mar 06 14:24:44 +0000 2009,0,1288376421
5,Twitter Web Client,Disney Expert Uses Science to Draw Boy Viewers http://bit.ly/FIUAy,,False,Tue Apr 14 02:07:46 +0000 2009,0,1513664211
3,Twitter Web Client,Wide Receiver Charged in Deadly Crash http://tinyurl.com/d2dx5x,,False,Thu Apr 02 04:54:13 +0000 2009,0,1436560760
4,Twitter Web Client,Ex-Blackwater Workers May Return to Iraq Jobs http://tinyurl.com/cz7ald,,False,Sat Apr 04 02:53:12 +0000 2009,0,1449547888
4,Twitter Web Client,"Plot Foiled? In Bolivia, Truth Is Elusive http://bit.ly/zXZaJ",,False,Tue Apr 28 03:50:57 +0000 2009,0,1635946048
1,Twitter Web Client,Dalai Lama Harshly Condemns China Over Tibet http://tinyurl.com/aqz5e9,,False,Tue Mar 10 12:25:10 +0000 2009,0,1305093399
1,Twitter Web Client,"Choosing Its Own Path, Ford Stayed Independent http://tinyurl.com/cafudp",,False,Wed Apr 08 19:58:02 +0000 2009,0,1478765345
0,Twitter Web Client,"With Fewer Pots to Stir, Competition Rises Among Cooks http://tinyurl.com/def5et",,False,Wed Mar 18 02:46:19 +0000 2009,0,1346249955
5,Twitter Web Client,The Saturday Profile: A Black Imam Breaks Ground in Mecca http://bit.ly/GAEki,,False,Sat Apr 11 06:02:21 +0000 2009,0,1495696249
2,Twitter Web Client,A New Nonprofit Aims at Urgent Threats http://bit.ly/4yVbEc,,False,Tue Apr 14 23:19:54 +0000 2009,0,1520740132
4,Twitter Web Client,Drone Strike Kills 21 in Pakistan http://tinyurl.com/bn9kjx,,False,Fri Mar 13 10:44:19 +0000 2009,0,1321081696
4,Twitter Web Client,"South: No. 1 North Carolina 72, No. 2 Oklahoma 60: Tar Heels Overcome Sooners’ One-Man Show http://tinyurl.com/c6sutl",,False,Mon Mar 30 01:53:02 +0000 2009,0,1415323565
5,Twitter Web Client,Man Caught After Stealing Plane http://tinyurl.com/cfswoq,,False,Tue Apr 07 05:38:59 +0000 2009,0,1467883859
1,Twitter Web Client,Rodriguez Out of W.B.C. With Injury http://tinyurl.com/cqpwbo,,False,Wed Mar 04 02:07:13 +0000 2009,0,1276720299
2,Twitter Web Client,Financial Fraud Is Focus of Attack by Prosecutors http://tinyurl.com/cvxnwg,,False,Wed Mar 11 22:26:12 +0000 2009,0,1313048175
2,Twitter Web Client,DealBook: UBS Raises Top Bankers’ Salaries http://tinyurl.com/be5u7v,,False,Sun Mar 01 22:06:44 +0000 2009,0,1266814439
4,Twitter Web Client,Test Pilot Killed in Crash of New Jet http://tinyurl.com/d3b3xo,,False,Thu Mar 26 03:47:05 +0000 2009,0,1392419467
8,Twitter Web Client,Idea of the Day: Smoot and Hawley http://tinyurl.com/cya4sa,,False,Wed Apr 01 13:32:14 +0000 2009,0,1431293438
3,Twitter Web Client,"White House Memo: President Sticks to the Script, With a Little Help http://tinyurl.com/ddreuy",,False,Fri Mar 06 02:48:24 +0000 2009,0,1286569882
12,Twitter Web Client,"Tired of Looking for Work, Some Create Their Own http://tinyurl.com/ap9evp",,False,Sat Mar 14 01:08:14 +0000 2009,0,1325037248
2,Twitter Web Client,City Room: Spending Extra Unemployment? http://tinyurl.com/cer6r8,,False,Mon Mar 30 21:12:22 +0000 2009,0,1420260023
9,Twitter Web Client,"NYT NEWS ALERT: Iowa Supreme Court Says Gay Marriage Ban Is Unconstitutional, A.P. Reports",,False,Fri Apr 03 14:08:05 +0000 2009,0,1445425188
8,Twitter Web Client,Colleges Are Accepting More Students Who Can Pay Full Fare http://tinyurl.com/ctfbyq,,False,Mon Mar 30 20:32:54 +0000 2009,0,1420033189
4,Twitter Web Client,"Moscow Journal: Russian Volunteers Keep Eye on Citizens, and the Police http://tinyurl.com/cdh4dr",,False,Wed Mar 25 07:30:19 +0000 2009,0,1386772648
0,Twitter Web Client,Space Shuttle Launched After Delays http://tinyurl.com/db7xet,,False,Mon Mar 16 01:09:00 +0000 2009,0,1334032198
1,Twitter Web Client,Suicide Car Bomber Kills 10 People in North Iraq http://bit.ly/clbVD,,False,Wed Apr 15 15:51:09 +0000 2009,0,1526116265
2,Twitter Web Client,Fed Chief Urges Congress to Act on Budget Despite Deficit http://tinyurl.com/dx4ldf,,False,Tue Mar 03 16:24:33 +0000 2009,0,1274342749
2,Twitter Web Client,CNBC Thrives as Hosts Deliver News With Attitude http://tinyurl.com/d7ah5u,,False,Mon Mar 09 13:44:35 +0000 2009,0,1300335221
5,Twitter Web Client,Few Strings on Russian-Style Bailout http://tinyurl.com/ce2oja,,False,Mon Apr 06 23:12:33 +0000 2009,0,1466008728
0,Twitter Web Client,"Corzine, Tough Sell, Works to Connect With Voters http://tinyurl.com/cvj9sf",,False,Tue Mar 10 04:10:11 +0000 2009,0,1303964306
4,Twitter Web Client,City Room: Imagining a World Trade Center Logo http://tinyurl.com/c9xzjf,,False,Wed Apr 08 13:47:33 +0000 2009,0,1476592080
3,Twitter Web Client,Sports of The Times: A Reminder of Why the Game Matters http://tinyurl.com/cnsxor,,False,Fri Mar 13 18:28:00 +0000 2009,0,1323136267
3,Twitter Web Client,A Dispute in Bollywood Over Revenue http://tinyurl.com/dfp52t,,False,Fri Apr 10 10:23:48 +0000 2009,0,1489606246
0,Twitter Web Client,The Lede: Images of the Lahore Gunmen http://tinyurl.com/8muwv7,,False,Thu Mar 05 21:53:06 +0000 2009,0,1285434959
1,Twitter Web Client,Homeless Struggle to Cope in Italy Quake Zone http://tinyurl.com/d458jo,,False,Wed Apr 08 16:12:07 +0000 2009,0,1477437462
2,Twitter Web Client,"City Room: Service Disrupted on 1,2 and 3 Lines http://tinyurl.com/ckowpp",,False,Mon Mar 16 19:28:57 +0000 2009,0,1337989185
3,Twitter Web Client,Head of Senate Panel Calls for Hearing on Wiretaps http://bit.ly/1mQX52,,False,Thu Apr 16 16:14:29 +0000 2009,0,1534692733
5,Twitter Web Client,Pakistan Claims to Retake Town From Taliban http://bit.ly/z7GJ8,,False,Wed Apr 29 07:54:11 +0000 2009,0,1647187684
3,Twitter Web Client,China Detains Tibet Protesters http://tinyurl.com/d4ezd8,,False,Sun Mar 22 19:10:00 +0000 2009,0,1371579475
4,Twitter Web Client,"East: No. 3 Villanova 77, No. 2 Duke 54: Villanova Is Too Much for Blue Devils http://tinyurl.com/ckhbwz",,False,Fri Mar 27 06:35:36 +0000 2009,0,1399564804
4,Twitter Web Client,"Washington Memo: Despite Major Plans, Obama Taking Softer Stands http://bit.ly/fX88n",,False,Sat Apr 18 20:18:56 +0000 2009,0,1553078201
1,Twitter Web Client,A.I.G. Bonuses Strike a Nerve Like Few Other Topics http://tinyurl.com/c2knuj,,False,Tue Mar 17 21:25:59 +0000 2009,0,1344692474
2,Twitter Web Client,Trade Chief Nominee Sets Out Goals http://tinyurl.com/b7ge2x,,False,Tue Mar 10 04:10:13 +0000 2009,0,1303964498
8,Twitter Web Client,The Sudden Charm of Public School http://tinyurl.com/daanqv,,False,Sat Apr 04 15:01:28 +0000 2009,0,1451755664
3,Twitter Web Client,NYT NEWS ALERT: Bank of America Shareholders Remove Lewis From Chairman Post,,False,Wed Apr 29 21:52:04 +0000 2009,0,1653081830
0,Twitter Web Client,U.S. Trade Chief Seeks ‘New Paradigm’ http://bit.ly/MWdLy,,False,Thu Apr 23 20:17:46 +0000 2009,0,1597305132
1,Twitter Web Client,Auditors Raise Doubts About G.M.’s Viability http://tinyurl.com/cyes92,,False,Thu Mar 05 14:07:44 +0000 2009,0,1283377613
9,Twitter Web Client,Obamas Prepare to Plant White House Vegetable Garden http://tinyurl.com/dd99ht,,False,Thu Mar 19 22:45:42 +0000 2009,0,1357114393
3,Twitter Web Client,Asian Data Highlights Severity of Economic Crisis http://tinyurl.com/cm9dkl,,False,Wed Apr 01 06:38:25 +0000 2009,0,1429891666
2,Twitter Web Client,Glamour Dims as Hecklers Hit the Auto Show http://bit.ly/4mUkLH,,False,Tue Apr 14 02:54:13 +0000 2009,0,1513966207
6,Twitter Web Client,Motherlode: Dealing With Bullying http://tinyurl.com/d3nonj,,False,Tue Apr 07 18:16:53 +0000 2009,0,1471076257
6,Twitter Web Client,"Idea of the Day: Malls, Main Street and Recession http://tinyurl.com/cebvvr",,False,Tue Mar 31 12:11:10 +0000 2009,0,1423900105
3,Twitter Web Client,Motherlode: Driving While Breastfeeding http://tinyurl.com/dnha3w,,False,Tue Mar 03 01:24:33 +0000 2009,0,1271805433
0,Twitter Web Client,U.S. Halted Some Afghan Raids Over Concern on Deaths http://tinyurl.com/bm85fl,,False,Tue Mar 10 03:27:42 +0000 2009,0,1303821378
0,Twitter Web Client,Consumer Spending Up Slightly http://tinyurl.com/c4sut7,,False,Fri Mar 27 14:09:35 +0000 2009,0,1401052560
12,Twitter Web Client,Obama Unveils High-Speed Rail Plan http://bit.ly/3UjOUZ,,False,Thu Apr 16 16:30:06 +0000 2009,0,1534805774
1,Twitter Web Client,"North Carolina 83, Villanova 69: Tar Heels Rout Villanova to Reach Final http://tinyurl.com/c3wtpc",,False,Sun Apr 05 04:48:46 +0000 2009,0,1455523445
2,Twitter Web Client,Los Angeles Re-Elects Villaraigosa http://tinyurl.com/bcyn7c,,False,Wed Mar 04 10:24:02 +0000 2009,0,1278002349
2,Twitter Web Client,More Squatters Are Calling Foreclosures Home http://tinyurl.com/c34zwk,,False,Fri Apr 10 04:41:06 +0000 2009,0,1488550698
0,Twitter Web Client,"ArtsBeat: Horton Foote, Playwright, Dies at 92 http://tinyurl.com/cz44uu",,False,Wed Mar 04 23:44:18 +0000 2009,0,1280979794
8,Twitter Web Client,Research on Lesser-Known Nazi Sites Is Now Public http://bit.ly/mxWC4,,False,Sun Apr 19 17:25:37 +0000 2009,0,1559163187
3,Twitter Web Client,Florida High School Senior to Try for Fifth Consecutive No-Hitter http://bit.ly/uupQj,,False,Tue Apr 28 05:24:44 +0000 2009,0,1636571961
11,Twitter Web Client,Reinventing America’s Cities: The Time Is Now http://tinyurl.com/dl5oal,,False,Sun Mar 29 17:39:37 +0000 2009,0,1413026402
2,Twitter Web Client,"In an Olympic City, the Kremlin Favorite Leads a Race on an Uneven Playing Field http://bit.ly/zOqWl",,False,Sat Apr 25 08:19:30 +0000 2009,0,1611550890
1,Twitter Web Client,Deal Reported for British Hostages http://tinyurl.com/dla3vx,,False,Fri Mar 27 20:33:08 +0000 2009,0,1403252709
1,Twitter Web Client,3 Dead as Tornado Hits Arkansas http://tinyurl.com/cbeosw,,False,Fri Apr 10 17:16:08 +0000 2009,0,1491656840
0,Twitter Web Client,A Tentative Free Trade Deal for S. Korea and E.U. http://tinyurl.com/ctvrob,,False,Tue Mar 24 07:31:14 +0000 2009,0,1380615826
0,Twitter Web Client,"MazatláJournal: For Some Taxi Drivers, a Different Kind of Traffic http://tinyurl.com/cl6vhb",,False,Mon Mar 02 06:25:15 +0000 2009,0,1268291434
6,Twitter Web Client,Palestinian Prime Minister to Resign http://tinyurl.com/b93fbh,,False,Sat Mar 07 13:25:50 +0000 2009,0,1292644327
4,Twitter Web Client,The @artsbeat bloggers Ben Sisario & Ben Ratliff resume live tweeting from day 2 of the #Coachella Music Festival http://bit.ly/16d0mz,,False,Sat Apr 18 17:17:35 +0000 2009,0,1551911253
3,Twitter Web Client,Pirates Attack Another U.S. Ship http://bit.ly/qEET,,False,Wed Apr 15 02:41:00 +0000 2009,0,1522283222
3,Twitter Web Client,Mortgage Fraud Case Poses Federal Quandary http://tinyurl.com/c4z5ha,,False,Sun Mar 08 00:44:06 +0000 2009,0,1294687780
1,Twitter Web Client,Albany Takes Step to Repeal Rockefeller Drug Laws http://tinyurl.com/aklmpx,,False,Wed Mar 04 18:46:38 +0000 2009,0,1279742384
3,Twitter Web Client,Convictions Reversed in Pennsylvania http://tinyurl.com/d8rlhx,,False,Thu Mar 26 22:12:52 +0000 2009,0,1397198686
5,Twitter Web Client,ArtsBeat: Woody Allen Film to Open Tribeca Festival http://tinyurl.com/bgze7x,,False,Mon Mar 02 22:05:17 +0000 2009,0,1271071672
3,Twitter Web Client,North Korea Said to Detain 2 U.S. Journalists http://tinyurl.com/cmpkcv,,False,Thu Mar 19 06:25:34 +0000 2009,0,1353072347
7,Twitter Web Client,Gadgetwise: Rethinking Blu-ray http://bit.ly/pzz9p,,False,Fri Apr 24 05:12:16 +0000 2009,0,1601295103
9,Twitter Web Client,Concrete Is Remixed With Environment in Mind http://tinyurl.com/cnxtdh,,False,Tue Mar 31 00:33:25 +0000 2009,0,1421301922
1,Twitter Web Client,Investors Pull Back After a Strong Week http://tinyurl.com/cagojt,,False,Fri Mar 27 19:53:54 +0000 2009,0,1403030018
5,Twitter Web Client,Damage to Historical Monuments ‘Significant’ http://tinyurl.com/dbuapo,,False,Mon Apr 06 18:52:04 +0000 2009,0,1464579590
6,Twitter Web Client,New Jobless Claims Fall More Than Expected http://tinyurl.com/c2q7vc,,False,Thu Mar 19 13:49:30 +0000 2009,0,1354352815
4,Twitter Web Client,"In Taliban’s Surge in Pakistan, a Pattern of Guile and Force http://bit.ly/yl6tP",,False,Sat Apr 25 23:26:38 +0000 2009,0,1616509147
10,Twitter Web Client,Economix: The Drug (Statistics) War http://bit.ly/jZSSn,,False,Fri Apr 17 17:34:19 +0000 2009,0,1543864274
1,Twitter Web Client,OPEC to Keep Production Steady http://tinyurl.com/dztnbc,,False,Sun Mar 15 18:06:14 +0000 2009,0,1332270427
1,Twitter Web Client,Senate Aide Guilty in Abramoff Case http://tinyurl.com/asvlpv,,False,Tue Mar 10 19:47:46 +0000 2009,0,1306961064
4,Twitter Web Client,"City Room: U2 Sneaks Into Fordham, and So Do Fans http://tinyurl.com/d5oypu",,False,Fri Mar 06 19:28:46 +0000 2009,0,1289680927
6,Twitter Web Client,"Emerging Markets, Setting a New Pace http://bit.ly/7qd5",,False,Sun Apr 12 05:01:58 +0000 2009,0,1501404286
0,Twitter Web Client,Crash Injures Zimbabwe Premier http://tinyurl.com/cmb2ro,,False,Sat Mar 07 10:09:33 +0000 2009,0,1292300889
4,Twitter Web Client,E.P.A. Moves Toward Regulating Greenhouse Gases http://bit.ly/If0lS,,False,Fri Apr 17 15:25:54 +0000 2009,0,1542823817
1,Twitter Web Client,"Fiat Weighs Buying G.M.’s Opel Unit, Officials Say http://bit.ly/QPbYs",,False,Thu Apr 23 15:08:21 +0000 2009,0,1594788737
0,Twitter Web Client,Labor Groups Reach an Accord on Immigration http://bit.ly/3RdvQi,,False,Tue Apr 14 02:54:12 +0000 2009,0,1513966118
2,Twitter Web Client,Stocks Fall in Asian Trading http://bit.ly/NpOmJ,,False,Tue Apr 21 03:39:13 +0000 2009,0,1572079357
4,Twitter Web Client,Capitalism Finds Voice in China TV http://tinyurl.com/cpd7qn,,False,Mon Mar 16 03:31:39 +0000 2009,0,1334604289
0,Twitter Web Client,City Room: Acting Bronx Leader Lives in Brooklyn http://tinyurl.com/99q4jv,,False,Thu Mar 05 21:53:08 +0000 2009,0,1285435185
3,Twitter Web Client,"Wall Street Finishes Week Higher, but Just Barely http://bit.ly/WrXIc",,False,Fri Apr 17 20:31:47 +0000 2009,0,1545318710
1,Twitter Web Client,As Much as a Foot of Snow Is Predicted for New York http://tinyurl.com/bhpph3,,False,Mon Mar 02 06:25:17 +0000 2009,0,1268291502
0,Twitter Web Client,Ill From Food? Ability to Investigate Varies by State http://bit.ly/1ecU3,,False,Mon Apr 20 02:08:04 +0000 2009,0,1562100354
2,Twitter Web Client,Your Money: The Pros and Cons of Buying a Chevy http://bit.ly/1OcG9d,,False,Fri Apr 24 18:57:10 +0000 2009,0,1606343932
1,Twitter Web Client,Japan War Shrine Visit Angers China http://bit.ly/m77tI,,False,Thu Apr 23 13:19:34 +0000 2009,0,1593944207
1,Twitter Web Client,Supreme Court Backs F.C.C. on Indecency Rule http://bit.ly/DCQJM,,False,Tue Apr 28 20:07:06 +0000 2009,0,1642176009
5,Twitter Web Client,Teacher Booked in Child’s Death http://bit.ly/34daAr,,False,Sat Apr 11 14:16:50 +0000 2009,0,1497060480
3,Twitter Web Client,"Art Review | 'The Generational: Younger Than Jesus': Young Artists, Caught in the Act http://tinyurl.com/dd5pej",,False,Fri Apr 10 08:33:17 +0000 2009,0,1489323071
3,Twitter Web Client,Old Water Pipes Becoming Hard to Ignore http://bit.ly/10A5HC,,False,Fri Apr 17 16:17:30 +0000 2009,0,1543244746
1,Twitter Web Client,"State Cuts Delay U.S. Benefits, Official Says http://bit.ly/VQG4",,False,Mon Apr 13 03:18:14 +0000 2009,0,1506935482
2,Twitter Web Client,Green Inc.: Cheap Car May Cost the Environment http://tinyurl.com/dm87rp,,False,Mon Mar 23 16:48:42 +0000 2009,0,1376459754
1,Twitter Web Client,Former Countrywide Leaders Start Firm to Buy Bad Loans http://tinyurl.com/bghrbg,,False,Wed Mar 04 01:26:45 +0000 2009,0,1276582008
6,Twitter Web Client,"As Courts Face Deep Cuts, Some States Squeeze Defendants http://tinyurl.com/czxwwj",,False,Mon Apr 06 16:31:02 +0000 2009,0,1463770419
2,Twitter Web Client,Accounts Differ of Afghanistan Strike http://tinyurl.com/ct49gw,,False,Sun Mar 22 21:24:05 +0000 2009,0,1372149560
2,Twitter Web Client,Resentments in Sri Lanka Reflect Challenges to Peace http://tinyurl.com/cy2599,,False,Sun Mar 22 09:05:12 +0000 2009,0,1369792209
1,Twitter Web Client,European Markets Edge Downward http://tinyurl.com/c3vkt3,,False,Thu Mar 05 12:47:04 +0000 2009,0,1283119062
2,Twitter Web Client,Fraud Charge in N.Y. Pension Case http://bit.ly/HYId5,,False,Thu Apr 30 18:30:58 +0000 2009,0,1661501202
0,Twitter Web Client,"NYT NEWS ALERT: Reports That Hostages Have Been Taken in Binghamton, N.Y.",,False,Fri Apr 03 16:40:06 +0000 2009,0,1446333184
5,Twitter Web Client,Saudis Retool to Root Out Terrorist Risk http://tinyurl.com/ctkpd3,,False,Sun Mar 22 18:05:26 +0000 2009,0,1371306674
9,Twitter Web Client,"In a Shifting Era of Admissions, Colleges Are Sweating http://tinyurl.com/bhhe34",,False,Sat Mar 07 18:49:19 +0000 2009,0,1293576584
3,Twitter Web Client,"In New Jersey, Bills Offering In-State Tuition to Illegal Immigrants Face a Fight http://bit.ly/11oynw",,False,Mon Apr 20 02:33:53 +0000 2009,0,1562262676
5,Twitter Web Client,Thousands Protest in Bangkok http://tinyurl.com/cxnty8,,False,Wed Apr 08 07:17:58 +0000 2009,0,1475175830
0,Twitter Web Client,"Wheels: It’s Official, Prius to Get 50 M.P.G. http://tinyurl.com/btse4c",,False,Mon Mar 02 20:27:19 +0000 2009,0,1270677868
4,Twitter Web Client,Paper Cuts: Questions for Rivka Galchen http://bit.ly/hbKIw,,False,Fri Apr 17 11:50:09 +0000 2009,0,1541363554
4,Twitter Web Client,On the White House: Eyes of the World Are on Obama http://tinyurl.com/c9v4ct,,False,Wed Apr 01 14:49:18 +0000 2009,0,1431742571
2,Twitter Web Client,"NYT NEWS ALERT: Prosecutors Tell Judge That Madoff Faces Up to 150 Years in Prison, A.P. Reports",,False,Tue Mar 10 19:46:27 +0000 2009,0,1306957462
7,Twitter Web Client,The Pleasure Principle http://tinyurl.com/bmtz2w,,False,Sat Mar 14 04:24:57 +0000 2009,0,1325763653
2,Twitter Web Client,"News Analysis: Dismissal for Stevens, but Question on ‘Innocent’ http://bit.ly/D7MrX",,False,Sat Apr 11 16:08:34 +0000 2009,0,1497569821
7,Twitter Web Client,Your Money: Thoughts on Walking Away From Your Home Loan http://tinyurl.com/d4wc4h,,False,Sat Mar 14 01:08:12 +0000 2009,0,1325037091
7,Twitter Web Client,Amazon Says Error Removed Listings http://bit.ly/qZUY,,False,Tue Apr 14 00:45:18 +0000 2009,0,1513129579
3,Twitter Web Client,Co-Creator of Dungeons & Dragons Dies at 61 http://bit.ly/IZpIf,,False,Fri Apr 10 22:58:01 +0000 2009,0,1493678625
4,Twitter Web Client,New Concern About Cuts in Oil Investment http://tinyurl.com/c8l2x3,,False,Fri Mar 27 01:13:08 +0000 2009,0,1398166714
3,Twitter Web Client,"On the Runway: Balenciaga, Paris Under the Skin http://tinyurl.com/amxbbc",,False,Thu Mar 05 12:47:05 +0000 2009,0,1283119110
3,Twitter Web Client,Franken Wins Ruling in Minnesota Senate Race http://tinyurl.com/cgyjom,,False,Wed Apr 01 04:32:14 +0000 2009,0,1429411039
